video_id,date,start,text
GYIOTNB4bO8,20200327,12930,Falcon O2  Oh, there we go get it. Oh, I  Just tripled up in a dre Andry's oh cool. I just tripled up. Oh, I had a stand by the way. Sorry guys  I just tripled up  Now back in back in a baby back with our initial trip stack
GYIOTNB4bO8,20200327,12951,I don't want to go. Oh, no, I was just talking about character creation. I think earlier. Oh, then you didn't die  No, no, no  Shut up move  No, can you show us your chips? I can't it's blip between the where the cards are reported where it tells you what you have
GYIOTNB4bO8,20200327,12972,You can put two little black icons above it  How do you can you just turn off where it tells you what your hand is?  I don't need it to fill in the blanks for me. I don't know well, then don't talk ever again
GYIOTNB4bO8,20200327,12983,Put another black bar. I don't like that and it compromises the integrity of my stream. I hope you lose  moat  You heard me  Display hand hint is that it maybe?  apply  You know they keep moving tables it's kind of annoying drew I
GYIOTNB4bO8,20200327,13005,Can't learn anybody at my table  Shut up  No, I won't really yeah  You won't even consider it no I would even shut up for a dollar  Shut up moat this is an important what's your current I can't no one's gonna cheat bro
GYIOTNB4bO8,20200327,13035,Type one if you wouldn't cheat
GYIOTNB4bO8,20200327,13056,He called the nine oh my god, okay  All right, we're going in the tank guys. We're just gonna play ABC. It's easy  It's so ultra tight nobody fucking folds in this shit all right  What was my hand I it was a misstrait, but it could have hit he
GYIOTNB4bO8,20200327,13081,Got calling stations all over the place that's all right load up oxygen not included that's cuz it's two dollars a fucking reason  I know that's fine. That's all right. Oh  Any calling stations in the chat  Oh
GYIOTNB4bO8,20200327,13107,Oh check it just it's just I'm sorry. It's so dumb. I'm ready
GYIOTNB4bO8,20200327,13127,I'm sorry, I don't know why does the Zelda game on switch have difficulties or is it all just the same difficulty traditionally? They don't usually so  They've played it I  Did play with your mom you know yeah, what's your name? I know what I did Cheryl what's her name? No
GYIOTNB4bO8,20200327,13144,What do you say it like you fucking know it too?  Dude, there's something fuck with I won't say no  I'm going all in like it. I'm shipping it do it. Oh wait. I can do it. I got a funny meme for you
GYIOTNB4bO8,20200327,13159,Hold on balls deep I'm all in like in  You win in the grinnings are fucking funny to me, dude, holy shit. Oh, I got a nine mooped
GYIOTNB4bO8,20200327,13192,Whoo, I'm in it. I got six K again  Sorry chat I won with ace nine and  Zoom thanks you calling station beach  CTF oh
GYIOTNB4bO8,20200327,13212,Call the fuck out mag check any mags in here  Uh trumper check any any trumpers in here?  When Steve moves in Miami chat this or Dan said that he's gonna set up a poker table
GYIOTNB4bO8,20200327,13234,We're gonna do poker night Friday. There's gonna be a podcast  Called the poker podcast and we're gonna invite people and they're gonna come and play poker with us  Because the worst part of podcast is everybody sitting around doing nothing
GYIOTNB4bO8,20200327,13245,But with this we'll all be able to hang out and play poker  And we'll show you the cards and the way we'll implement that is it's  eight truths and a lie so every  Or no eight lies in a truth
GYIOTNB4bO8,20200327,13258,So if you want to say something true and chat no, that's done. That's so complicated is never gonna work  Well, it's the only way that we can show our cards without people like telling us the  Like hands right?
GYIOTNB4bO8,20200327,13269,We just can't look at chat. Oh  I mean, that's fine. I guess wait. Holy shit. Have you seen the map hold on? I  Just did this what the fuck?
GYIOTNB4bO8,20200327,13303,Wait, hold on do you  We should ask  Guys these are memes that will never leak. I'm so sorry guys
GYIOTNB4bO8,20200327,13327,No, no, no, these are 12 out of 10  10s, yeah, these are good. Oh  My god  Black people do be that way guys what what?  Oh
GYIOTNB4bO8,20200327,13348,clever  Lock arms tend that's not what we were talking about  I'm just checking it chat. I'm just checking it because you don't have a good hand right now
GYIOTNB4bO8,20200327,13370,Not sure me and a little call machine  Get this donkey out of my hand do you guys care about like pretty Instagrams at all  To girl me like so Molina even before I met her like is super fucking try hard about her Instagram
GYIOTNB4bO8,20200327,13391,And I'm wondering if I should like I was thinking about just paying Elena to do my Instagram and doing the same  When you say pretty do you know your Instagram ever make you money  I mean you can definitely use a response it this picture is horrible
GYIOTNB4bO8,20200327,13403,I don't know why but like she does a thing where she has like the color coordination on like everything  Yeah, there's like a consent. Oh my god. I can't even look at it  But if you look at her Instagram, there's like really good like color coordination across like all of the pictures or whatever
GYIOTNB4bO8,20200327,13416,Like everything is like consistently themed and everything like from a I don't like that at all  Why like I mean her her shit looks good  But I don't like when it's just the same shit like if I if I go to a food page like for some of the chefs
GYIOTNB4bO8,20200327,13428,I follow I don't want to see the same style like the same fucking plate with just different food on it  I want to see something unique in each image. So it's not the same shit at all. It's different stuff in every picture
GYIOTNB4bO8,20200327,13438,It's just the colors are consistent. Oh, I know I get what you're saying. No, I got boop and nice  Things are TBA I know my joke went too far fuck you  All right, it's just not our plan. It's not our platform. Yeah, I just don't know how much engagement guys get like when I like how many
GYIOTNB4bO8,20200327,13459,Followers does Nim have on Instagram. Do you know have you seen Nim stomach?  Is it Nymian  Nimian  I want you  Like namily has 15,000 followers and he's hot as fuck. I don't know. I don't know if girls just don't really do
GYIOTNB4bO8,20200327,13484,Like Instagram posts or don't well no, but girls. He's Instagram. What the guys do I don't know. I'm not sure I  Think the thing is it's mostly guys on Instagram just following girls  Maybe no, there's a lot of girls. It's a lot of female to use it. Yeah, why am I calling here? Oh my board
GYIOTNB4bO8,20200327,13509,Did you have to do anything special to get this app to run on your computer, no  Still in this shit, of course I am Jans soon  I'm so pissed that F1's canceled  Formula one are you a fan? Yeah, I like formula a lot
GYIOTNB4bO8,20200327,13529,What do I do when I have to Stephen do I ship it? Yeah, you ship it  Why don't you have a verified check mark on YouTube I think you have to like getting a verified check mark for the name destiny
GYIOTNB4bO8,20200327,13542,That is really hard  Well, I'm just emptying all of my chips away  Wait, so you think if your name was something else you would have been able to get verified  I think so because you have to prove like rights to the name of some shit ask us on for instead vice yes
GYIOTNB4bO8,20200327,13555,340 thousand dollars  Yeah, if I had a YouTube channel with like a hundred million followers to paint my Instagram  Okay, I have 200 thousand followers to write that's not as a special case  We can't all be a nepotism Andy
GYIOTNB4bO8,20200327,13569,Be nice to us on  He's my friend. Yeah, that is  Hey  I'm a Ferrari and  Red Bull Chad, sorry go ahead
GYIOTNB4bO8,20200327,13590,Stephen would you ever call someone out on Twitter and then if they said they wanted to talk to you on a stream tell them to go fuck  themselves  No, what the fuck why would I do that? I love arguing people I'm calling someone out of this issue because I feel you know
GYIOTNB4bO8,20200327,13600,There's doing some better. What if they ask her $500?  I  Okay, come and say he say thank you for all of your camera advice, but you're full of shit  So he's like well  I have eight thousand followers on Twitter and he's a guy but all of his pictures are pretty girls
GYIOTNB4bO8,20200327,13616,Fuck you. What the fuck dog squad W  So the source of that question was that I baited his son into some  And when I wanted to talk to him about it because he only responds to fucking like inflammatory should I say he's like now
GYIOTNB4bO8,20200327,13639,Fuck off go back to DJG  And he gave his prep oil off. Oh, yeah, if you think you can do you want to  Because he doesn't want to get good. What? No, it doesn't make sense like he's he's like bullshit with me before but that day
GYIOTNB4bO8,20200327,13652,I don't know. He's in pissy Bernie mood or something. I want to take your fucking bait your shitty bait  Well, here comes Mr. Mooten. I bet I can get a half row Stan his son's a mean man  Any his son fans in the chat type Pepe or no type E
GYIOTNB4bO8,20200327,13669,I wasn't going there to be to me anything chat. I was just going to fucking talk man  He had an opinion  Andy can you how do you get blocked conversations on Instagram? Can you do that if somebody blocks you?
GYIOTNB4bO8,20200327,13683,I don't think there's a way to like find the convoy again like cuz yeah copy and paste it into a incognito tab  No, I'm looking for a conversation like a DM's that I had with him you dumbass. Oh
GYIOTNB4bO8,20200327,13695,No, I don't think you can't I think they remove  So  Girls on Tinder link their Instagram sometimes like oh like message me there and it's like okay  I mean fuck I might as well cuz I have a lot of follows in this term relative to a normal person
GYIOTNB4bO8,20200327,13711,So maybe that'll like give me a hand up and I messaged some girl and she's like oh well like  This is like part of my job or whatever  And I'm like, oh, what do you mean? She's like well I only do this for pay and I said oh I said well
GYIOTNB4bO8,20200327,13723,You're really pretty so I think I'd only charge you like 30 bucks. She blocked me  I want the screenshot of the convo  Fuck that's a good meme. I don't know  He's making it up cat. I'm not there are escorts apparently on fucking Instagram that like when you're no
GYIOTNB4bO8,20200327,13740,I'm sorry on tinder when you messaged them on instagram. They try to fucking make you buy shit  You ain't paying for shit homie
GYIOTNB4bO8,20200327,13762,Damn dude  Dude it is the it is the literal embodiment of squad w you understand right?  Oh, hold on. Yeah. Oh wait wait
GYIOTNB4bO8,20200327,13785,Yep, and then yep, yep  There's only kind of just pictures. I believe you know pictures and videos on only fans  Yep, both. Like the meme. I can't these are unlinkable  These are so leekable memes. I'm sorry. Fuck it. I'm calling
GYIOTNB4bO8,20200327,13802,These are nuclear luck. Can you show rebuy because I'm about to busto  Yes, yes. Yeah, I think that well. I don't know. No, no, no, no, no, and don't say yes  Sorry, I was saying yes because I want to hand I'm an 8k but yes, you can. I just saw mr. Cash's back rebuy and he's got obama
GYIOTNB4bO8,20200327,13818,Can you get banned for the secret memes  I  Just secret. Okay  Is this real money? No, this is a play money. This is the last level of rebuy wait. Can I can you top up?  You should be able to eat if you rebuy. No, no without top up to 3k. What do you mean? How no no like without having to busto
GYIOTNB4bO8,20200327,13838,Oh, no, I don't think so. Oh, no, I don't know anything because busto  Okay  How long when does the level end?  It just changed so I don't know how to tell but  Oh god, fuck it. We're going all in on this and I'll give a fuck
GYIOTNB4bO8,20200327,13863,I'm ready for doom. I'm what do I get for beating the slayer levels?  Am I even getting a good advantage over moat if he's skipping them or am I just wasting my time and you're wasting your fucking time?
GYIOTNB4bO8,20200327,13871,You get some weapon points, don't you? Yeah, but I want like five weapon points because these are hard  If it gives me like two or one, I'm gonna be like, okay  Three weapon points  Okay, what the difference?  Have you got to the the time challenge right before there's that
GYIOTNB4bO8,20200327,13891,Area where they're like it's the spike crushing you but you go to the right of it and there's the time challenge  And you'll see like two explosive balls in the armor  No, okay
GYIOTNB4bO8,20200327,13913,Chad, I'm dominating  How much what's your sex even zero? I'm all in right now. I'm at 8.2k. I'm about to go busto  He's about to go busto  Here we go busto get me out throw up a e-countdown. That's what we have guys good luck
GYIOTNB4bO8,20200327,13930,Oh, yeah  Is there a limit on a oh my god five people all inning? Holy shit. You could be rich right now. Please just throw up one ace. Nope  Oh  It was a split pot. God damn it. I just want to go busto. I just want to go
GYIOTNB4bO8,20200327,13947,Oh  Raised  So I'm just all in. I'm all ending with any with any two cards guys any two cards
GYIOTNB4bO8,20200327,13973,What if it was two seven  oh my god what was that I all in with pocket sevens that guy had ace queen and  the flop comes queen ace queen okay dude oh fuck
GYIOTNB4bO8,20200327,13996,I'm an eight stand to the man running the stand hey got any grapes I step  shit youtubers are modern the live posting tricks chat and he's saying dumb shit  if I'm gonna think it says all sham no well these people will not talk to me
GYIOTNB4bO8,20200327,14014,they are dumb as fuck don't do it is really maulting and equating knowing the  basics of what you're carried to you can do it's a hundred percent min max  try hurting wait wait right now wait hold on no way is he talking about what I was
GYIOTNB4bO8,20200327,14027,talking about earlier no way oh wait he's not even streaming right now he is I  mean like he's not a computer yes I have five four oh into my table right now  what is happening someone like a clip you just got done mauling give me the
GYIOTNB4bO8,20200327,14057,clips boy me the clips me the clips clip clip clip clip clip clip clip clip clip  clip clip clip clip clip clip clip  wait am I about this no you can keep it off everyone you can turn on now
GYIOTNB4bO8,20200327,14079,everyone I guess just let me get banned from this chat so I can be done  follow all my shit we have a hundred no I'm I really want to ask this person  why they would say I'm a conservative oh well the person's name live posting some
GYIOTNB4bO8,20200327,14094,dumbfuck Twitter's chat where the clips  where are the clips where are the clips stop calling all of my raises I want some
GYIOTNB4bO8,20200327,14116,goddamn respect to this table you know what I'm gonna flop a straight I could  feel it we are on high clip alert  just end up with your dumb ass code say no you're welcome
GYIOTNB4bO8,20200327,14139,people they want context I'm part of a D&D show with Destiny Trump and Zizarin  that runs Wednesdays called Empires of Arcadia I literally turned a corner on  my character and got hit by 27 damage breath weapon without my turn fucking
GYIOTNB4bO8,20200327,14159,resolving not knowing that it was there there was nothing I could have done to  counterplay it it was just dog shit and like I'm gonna call it I don't care  anymore I'm not gonna call it like I see it it's just dog shit DM it that's what
GYIOTNB4bO8,20200327,14169,it is it's like not the kleiboo's a bad DM in this case though this DMS versus  the player shit is complete horseshit as Gary Gygax style shit like you see a  trap and you die I hate this gameplay I hate it not giving players agency to be
GYIOTNB4bO8,20200327,14182,able to imagine having the agency to see that all of your party is at half HP  having infinite time to make a decision and holding on to two level two heels  and then blaming the three level two heels and then blaming the DM that you
GYIOTNB4bO8,20200327,14194,got one shot while sitting on resources oh my god fuck that's good  also had a level three concentration spell which you could use at any time  to make a bunch of things to go and scout oh yeah you could have used some
GYIOTNB4bO8,20200327,14207,in animals to scout ahead and that's not even like thinking like that's not  even like oh I'm a backseat quarterbacking that's like just playing your  fucking character to like the correct limits like we literally to beg him just
GYIOTNB4bO8,20200327,14217,to kill ninks you had to beg him to use level one spell slots how many cards  you need to get a goddamn straight in this fucking game do you think he I  don't think there's enough on the board for straight right I don't think there is
GYIOTNB4bO8,20200327,14238,right no hold on nine ten does it matter wait does what matter I thought  this guy was both now right hey katerina just joined us tempo storm true  just okay I'm laughing actually I have a straight guys I had to straight the whole
GYIOTNB4bO8,20200327,14261,time what is my stack position 22 of a four whoa what the fuck  any drama and you really are some huge nerds
GYIOTNB4bO8,20200327,14292,I do see stack position there's a little graph thing you can click over here  that'll show you your position is 22 out of 84 how many people are left in  can we tell them well if I'm position 22 out of 84 I think I would go ahead and
GYIOTNB4bO8,20200327,14308,venture guess that there are 84 people left in where you see that  that  that I read by yeah yeah I read but you got a problem with that kid  bring Devin in there and bring him in here right now bring him in all mauled for a
GYIOTNB4bO8,20200327,14334,little bit  he call itham did you do drama how  it sounded
GYIOTNB4bO8,20200327,14356,dumb  It's dumb, baby!  Yeah!
GYIOTNB4bO8,20200327,14383,Oh, nay, Lynn!  Oh, no, no, no!  Hey, people are gonna stop shipping it.  Can I play the game?  Wonder if people are gonna stop shipping it?  Yeah, just like going all in on crazy shit.  Everyone is always gonna ship it, move it.
GYIOTNB4bO8,20200327,14405,Oh, the vines are done? Okay, good.  Thank God.  He wasted his last transformation.  Oh, yeah, he was still asking like 20 episodes in!  How long does my transformation last?  Oh, my God!  These are like the basics of your character.
GYIOTNB4bO8,20200327,14422,Like, you're at Druid.  You're level six.  It's your transform.  It's a little...  You were watching a lot of D&D stuff earlier in episode nine.  You guys discovered how long his transformation last.  Well, like, but that's episode nine.  Like, these are your old names.
GYIOTNB4bO8,20200327,14435,You should have been known before.  It's the main things you do.  Like, that would be like a barbarian asking every episode.  Like, how long does rage last?  What am I supposed to do with rage?  Like, I don't know.
GYIOTNB4bO8,20200327,14445,Okay, sorry.  Is it too late to sign up for the Ace of Turner?  You just missed it, my dude.  I'm sorry.  He also ran a level one spell slot to heal himself in Snake form.
GYIOTNB4bO8,20200327,14466,Oh, yeah, because he can expend his spell slots to...  That works though, right?  What do you mean?  Yeah, but then he didn't want to use the spell later to heal somebody.  Oh, yeah, not using spells later.  It's just, I don't know why, but...
GYIOTNB4bO8,20200327,14482,Oh, the clip war has begun.  And he said he's not going to do...  And, like, I'm going to call him a...  I don't care anymore.  I'm not going to call him a C-  It's just dog shit DM.  That's one of the...
GYIOTNB4bO8,20200327,14492,Not that C-  It's not that C-  It was a bad DM in this case though.  This DM's versus the player shit is complete horseshit.  It's Gary Gygax style shit.  Like, you see a trap and you die.  I hate this gameplay.
GYIOTNB4bO8,20200327,14501,I hate it.  Not getting players A to be able to...  I'm just going to have the agency to see that all of your party have that half HP.  I'm going to have the time to make a decision holding on to two level two heals and then
GYIOTNB4bO8,20200327,14507,blowing three level two heals.  I don't want to do this like, this is like really dumb DD drama shit.  But I can have it if I can just fine.  I have an opinion.  This is just a standard DD drama shit.
GYIOTNB4bO8,20200327,14519,It's always like, dgg drama, debate tactics.  I feel like I've probably been...  You know how you know I'm confident?  You know I know I have a good grip on reality because I think I get gaslit more than literally
GYIOTNB4bO8,20200327,14529,any other fucking person on the entire fucking internet.  Holy shit.  I have been gaslit from so many different corners of the internet from so many different kinds  of people.  Like it is unfuckable, believable.  Oh my god.  I thought he said D&D drama.
GYIOTNB4bO8,20200327,14546,Did he say D&D drama or dgg drama?  I thought he said dgg.  I couldn't miss her though.  The heal didn't carry over from snake farm.  Yeah, because if you stop in snake farm and then you retransform it doesn't do anything.
GYIOTNB4bO8,20200327,14561,Yeah, it doesn't come back with you.  To be fair, Chad is waving this up a bit.  Why don't they get me to be whipped up to say that for him to say Kweiboo is a dog shit  DM.  Or he's been dog shit DMing.
GYIOTNB4bO8,20200327,14576,No, I don't think he said dog shit DMing.  He said dog shit DMing.  He said this is just dog shit DMing.  And then I think after he's like, well I don't want to say Kweiboo is a bad DM.
GYIOTNB4bO8,20200327,14585,Sure.  I mean those are coming like dog shit.  Yeah.  It wasn't even a savor die.  He did the math and apparently at his current HP the 27 or whatever it was a 6% chance to  die.  And that's at half HP for him.
GYIOTNB4bO8,20200327,14599,If he would have used a single one of his three heals he would have been a hundo for some  times.  He would have been Kino.  Kino.  Or if he would have stayed as a snake.  What is this?  What are these flops?
GYIOTNB4bO8,20200327,14615,These flops are wild man.  That's not how Kino works.  Honestly I just use Kino for cool.  I think people get really mad so I just kept saying it.  I thought Kino is like amazing or cool.  I don't think it is.
GYIOTNB4bO8,20200327,14627,I think Kino refers to like if it's some piece of art that's like the best or some shit  or whatever.  Or I don't know some of these shit.  You know where I don't want this one.  I just said Kino and people get real bad.
GYIOTNB4bO8,20200327,14637,It's fucking Kino dude.  Are you going to debate the live posting person?  Yeah I would over any topic she wants over whether or not I'm conservative or anything.  But she won't talk to me.  I know these types of people.
GYIOTNB4bO8,20200327,14647,They like adamantly avoid confrontation at all costs and they only live inside their  little dipshit echo chambers.  That person will never ever ever ever be in the same call as me ever unless there's at  least seven other lefties and they're screaming at me as well.
GYIOTNB4bO8,20200327,14659,So they don't have to confront the fact they're utterly fucking clueless about any of the  things they talk about.  I'll debate you on anything.  Really?  Yeah.  Yeah you dumb fucking cock.  Did Liv call you a conservative?  Incess.  Yeah she says I'm a conservative.
GYIOTNB4bO8,20200327,14673,Fuck why is this song?  He's not working.  Chat we need more song requests please.  Are you still in this tournament?  Yeah I'm at seven.  I've got eight K.  I want to go to Mr. Newton's table guys.  That's just what I want to be.
GYIOTNB4bO8,20200327,14694,I would destroy you if you're at my table.  I just like I'm going to destroy you and I would destroy you and poke.  Thank you Jacob for the gifted sub to Hollow Nekko.  The Uer.  Oh this Hollow Nekko guy, he's been in my chat for the past two or three days at every fucking
GYIOTNB4bO8,20200327,14709,hour just ooing and it's a real person.  If you try to like talk to him, he'll like respond to you and everything.  It's fucking insane.  Wait it's a bot or what?  No it's a real person.  If you talk to him he'll respond.
GYIOTNB4bO8,20200327,14720,Wait what?  Yeah real people respond when you talk to him.  What do you mean?  Yeah I know but he's in my chat all the time ooing.  You said he's a bot or something.  No.  You just told me that there's a person in my chat who's a real person when you talk to
GYIOTNB4bO8,20200327,14736,them they respond to you.  Is this like how you're using my chat?  Oh my god what do you think?  Maybe that's why I think I'm a bot.  Maybe that's why you think you're at NPC in a main character's movie.
GYIOTNB4bO8,20200327,14747,Dude you need to fucking get off to it and run Nuke's this more because you're losing it man.  I'm going to come here and watch some of that Nuke's this.  Oh my god.  By the way Nuke's this is a video game that's even I play.
GYIOTNB4bO8,20200327,14761,I think Mr. Mooten is looping.  Destiny you're on reference couch wake up.  Good boy.  Look at him.  Doo dee dee dee dee dee.  These men.  Last D&D clip.  Oh wait there's another one.
GYIOTNB4bO8,20200327,14788,Please no one close it right now.  I'm going L.N.  Wait this game I'm done.  Wait.  That guy has to go all unscrew you.  Fold out.  I have a jack.  I've got trips by the way.  Yeah you couldn't beat that.
GYIOTNB4bO8,20200327,14803,I didn't have trips by the way.  But he thought I did.  He thought I did.  Get him out of my hand.  Can't play conservatively with a chip stack.  You understand your character by episode 16?  Yeah I agree.  But there's 5 billion latest like 5 billion decisions you have to make a spell.
GYIOTNB4bO8,20200327,14814,You should understand your character by episode 16.  Yeah I agree.  But there's there's 5 billion latest like 5 billion decisions you have to make as spellcasters.  Nothing that Destiny is saying is wrong.  My argument is not against I could have played better.
