video_id,date,start,text
GYIOTNB4bO8,20200327,0,you
GYIOTNB4bO8,20200327,72,of  my  I'm sorry, I didn't take a show.
GYIOTNB4bO8,20200327,92,What time is on a man?  I'm a PST.  Jesus.
GYIOTNB4bO8,20200327,118,This is not delivered every spits on packaging.  Coronavirus, why?  How blue are your balls from what?  What do you mean?
GYIOTNB4bO8,20200327,140,This is your moon goddess Chipotle stone?  What are you doing?
GYIOTNB4bO8,20200327,181,When are we watching boondocks episodes?  Hopefully soon.
GYIOTNB4bO8,20200327,214,Much love, white people, happy.
GYIOTNB4bO8,20200327,238,I thought that was a party.  7
GYIOTNB4bO8,20200327,263,What do I care about this?
GYIOTNB4bO8,20200327,292,You read your crazy destiny.  I like you, but you're crazy.  Right now in New York City.  I need a video that's no more than three sardines long.
GYIOTNB4bO8,20200327,312,Hey, this is Henry.  Where we go down there areuppress makers looking.
GYIOTNB4bO8,20200327,337,I'm 46 years old.  Before acting to the Lily fought together, I would never leave a audience.  Because, of course, we can't have exponential growth forever.  At some point, the disease will run out of new people to infect, either because most people
GYIOTNB4bO8,20200327,360,have already been infected or because we as society manage to get it out of control.  But and this is the scary part to me, when you're in the middle of an exponential,  it's essentially impossible to tell when it's going to end.
GYIOTNB4bO8,20200327,371,Are we in for 10 times as many cases as we currently have?  Or 100 times as many?  Or 1000?  Exactly.  What it feels like to be in the middle of a league loss streak.  Especially when exponential growth ends is important, because it hugely determines how
GYIOTNB4bO8,20200327,385,many people fall ill.  Yet so little reporting actually focuses at all on how to tell if exponential growth  is ending.  After talking about this with my friend, Autish, he put together a new graph visualizing the  COVID-19 epidemic on a global scale.
GYIOTNB4bO8,20200327,397,This graph uses the real data and shows all countries traveling along the trajectory  of exponential growth.  And it makes it super obvious which ones have managed to stop the exponential spread  of disease.  They plummet downwards off the main sequence in a way I find super compelling.
GYIOTNB4bO8,20200327,410,In this figure also makes it abundantly clear that even if a country doesn't have lots  of cases right now, COVID-19 is probably going to follow the same trajectory there and end  up spreading, and spreading, and spreading.  Until that country hits the emergency eject button.
GYIOTNB4bO8,20200327,423,If you're planning for the future and your country doesn't have a lot of cases yet,  it's nevertheless a safe bet that you're probably headed down a similar path.  So how did we make this graph?  Well there are three key ideas.
GYIOTNB4bO8,20200327,435,The first is to plot on a logarithmic scale, since that's the natural scale for exponential  growth.  And it's that the tick marks grow by multiples of 10, so 10, 100, 1000, rather than 10,  20, 30.  This scales up small numbers and scales down large numbers, making the growth equally apparent
GYIOTNB4bO8,20200327,450,on all scales, and lets us compare the growth in countries with very different numbers of  cases.  Which brings us to the second idea.  Catch changes early by looking at change itself.  For example, if you look at the growth of cases in South Korea, you can see that at first
GYIOTNB4bO8,20200327,462,they're exponential and later the growth slows down.  But when you're halfway up this curve, it's hard to tell by eye that it is slowing down.  It kind of still looks exponential.  If instead you chart the number of new cases in the last week, in other words, the rate
GYIOTNB4bO8,20200327,475,of growth, it's much easier to see that the growth is indeed starting to slow down.  And when the number of new cases each week flattens out or goes down, you've escaped  the scary exponential growth zone.  The third idea behind our graph is one from physics.
GYIOTNB4bO8,20200327,488,Don't plot against time.  Usually, when you see exponential growth, the number of cases is plotted versus time.  But the spread of the disease doesn't care if it's March or April.  You'd only care about two cases.  We better get a conservative video review, Stephen or else.
GYIOTNB4bO8,20200327,504,Bonus meme, no bonus meme.  Many new cases there will be today.  That is the total number of infections and the growth rate of infections.  The defining feature of exponential growth is that the number of new cases is proportional
GYIOTNB4bO8,20200327,518,to the number of existing cases.  Which means that if you plot new cases versus total cases, exponential growth appears as  a straight line.  So these are what we plotted on our graph.  The number of new cases, aka the growth rate, is on the y-axis.
GYIOTNB4bO8,20200327,532,And the cumulative number of cases is on the x-axis, both on logarithmic scales.  This gives us a beautiful, horrible graph that shows where all countries are in their  COVID-19 journeys.  It makes it obvious that the disease is spreading in the same manner everywhere.
GYIOTNB4bO8,20200327,545,We're all headed on the same trajectory, just shifted in time.  And it makes it obvious where public health measures, like testing, isolation, physical  distancing, and contact tracing, have started to beat back the disease.  And where they either aren't working, or haven't had time to show up in the data.
GYIOTNB4bO8,20200327,559,In nearly every country so far, the number of cases grows at basically the same rate,  until it doesn't.  And that's what I feel like is missing from so much COVID-19 coverage.  A sense of whether or not we can see the light at the end of the tunnel.
GYIOTNB4bO8,20200327,571,Are we still on the rocket ship of contagion, like the US?  Or have we managed to hit the emergency eject button, like China?  And this graph shows us that.  It gives us some sense of what's actually happening in these uncertain times.
GYIOTNB4bO8,20200327,583,That said, this graph also has a number of caveats and limitations.  Its main goal is to emphasize deviations from exponential growth, that is, to amplify the  light at the end of the tunnel.  So it may be less informative for other purposes.
GYIOTNB4bO8,20200327,594,So here are the caveats.  10,000 looks really close to 1,000 on a log scale.  This kind of distortion might allow people to take COVID-19 less seriously.  Also, the log scale on the x-axis makes it harder to see your resurgence of new infections
GYIOTNB4bO8,20200327,609,after a significant downturn.  A plot with a linear x-axis is better for that.  Unlike most other COVID-19 graphs you've probably seen, time isn't on the x-axis, which might  be confusing.  Instead, time is shown through an animation.  Another important caveat is that this graph, and basically every other COVID-19 graph you've
GYIOTNB4bO8,20200327,630,seen, isn't actually showing the true number of cases, just the number of detected cases.  The true number of cases is unknown, but certainly much higher than the number detected.  In reality, COVID-19 cases spread at a slower rate than what this data implies.
GYIOTNB4bO8,20200327,646,It's kind of a subtle idea, but this data reflects not just increases in case numbers,  but also increases in the number of tests performed.  And since we're ramping up tests, it makes it look like the cases are growing faster
GYIOTNB4bO8,20200327,656,than they actually are.  But they're still growing.  The data we're using is incomplete, as it relies on daily reports from overburdened  healthcare systems around the world.  Also different countries have dramatic differences in the resources that are available and dedicated
GYIOTNB4bO8,20200327,669,for testing.  Finally, the trends in this plot are delayed a few days since we're plotting the average  growth rate over the last week.  There's just too much variability in the data to plot daily growth rates.  This is actually kind of a good thing.
GYIOTNB4bO8,20200327,681,It means it's a pessimistic graph.  It doesn't get too excited too soon, and so a downward trend on the graph is much more  likely to be a real downward trend.  And a real downward trend is what we want for all countries.
GYIOTNB4bO8,20200327,692,A lot of daily news just reports recent data points.  Yet to understand where we're headed, it's not enough to know just where we are today.  We need to be talking about trends.  How many new cases are there today relative to the number of new cases yesterday, or last
GYIOTNB4bO8,20200327,704,week?  Charting the rate of change empowers us all to more clearly see what the future holds.  A giant thanks to Atish Bhatia, who created the interactive visualization and helped write  this script.  Atish's work on this has been a beacon to me in these hard times.
GYIOTNB4bO8,20200327,718,And this video was made possible by Brilliant.org, which I don't know if you know anybody who's  looking for interaction.  Okay, what a fucking nerd.  Got him.  Loadout is 8,400 dollars.  Loadout is way too cheap.  It seems like there's no point in like, I think more zone is really close to me.
GYIOTNB4bO8,20200327,743,A really, really, really good game.  There's just like a couple things I think I would change.  The loadout is like way too, way too cheap.  I think the loadout should cost like 15,000, even 8,500 seems a little cheap.
GYIOTNB4bO8,20200327,754,Like if you go uncontested in like a loot area, it's pretty easy to just, it's pretty  easy to walk away with like literally $10,000.  Like it's pretty insane.  Especially as a team, especially since the loadout like loads your whole team out.
GYIOTNB4bO8,20200327,768,You could easily walk away from every 20,000.  What?  How did you get in here at the same time?  I did.  I saw you come in.  Do we cover the binary?  Saw me on the boxes reported on it.  Vox didn't report that he sexually saw someone.
GYIOTNB4bO8,20200327,783,He reported on other people reporting it.  It'll be an eternity of like any, I don't know if you're like a huge Bernie bro.  So there's been, there's been like a strange like sexual assault allegation that has come  out against Biden.
GYIOTNB4bO8,20200327,794,Like a few, a few of like the very like weird like kind of off media have like reported  on but no like mainstream media is has reported on it yet.  But like the Bernie bro is especially my subreddit are fucking furious about it.
GYIOTNB4bO8,20200327,808,Holy shit.  Oh, there might be a Yahoo report about it.  I haven't seen that yet.  Yahoo is this, this media stuff.  Did you read that spell at all?  Hold on one second.
GYIOTNB4bO8,20200327,833,What's strange about the accusation?  The lady has made some very weird like Russian esc statements in the past.  This week free time has been amazing.  Like some pretty fucking weird shit about that.  But she started deleting a whole bunch of before she came out publicly with her accusation.
GYIOTNB4bO8,20200327,858,And then it would just be nice to see like mainstream media outlets like verify the story  because there's a lot that goes into like a lot of people think that just like oh person  makes accusations of someone oh well but then we report on it.
GYIOTNB4bO8,20200327,867,But usually like the mainstream media outlets do a significant amount of work to actually  validate and verify the facts around the story.  What do you mean Russian ask like what I think so many copy pasted in my story.
GYIOTNB4bO8,20200327,883,Maybe check hold on.  Oh, you guys have stepped up on the subreddit post by the way.
GYIOTNB4bO8,20200327,904,Good job.  I'm pretty sure the D&D memes were legendary.  Wait, where are these posts?  No.
GYIOTNB4bO8,20200327,924,Do you think the media did fair or point when we came to investigate in the cabinet memes?  I mean, Project Veritas tried to show that they were super biased and Wapo snuffed that  shit out immediately so I don't know.
GYIOTNB4bO8,20200327,944,Somebody I wish I could remember what Reddit poster was.  Someone here was copy pasting some of the stuff she'd written on.  Someone in chat said that they had like wrote like a letter in Russian or whatever and it
GYIOTNB4bO8,20200327,958,was like with mail ending verbs or something.  I don't know about that.  Oh, yeah.  Just here are some things that she'd written in a blog.  Technically being pro-Russia or whatever doesn't mean that you also couldn't have been sexually
GYIOTNB4bO8,20200327,972,so popular.  It's possible that these things will happen.  Change your words into truth and then change the bet truth into love.  Lyrics from the song As by Stevie Wonder.  What have I told you that everything you learned about Russia was wrong?
GYIOTNB4bO8,20200327,984,What have I told you as an American citizen we've been fed propaganda to further a certain  political agenda?  A political American agenda.  What have I told you that we are the bad guys and that we're on the wrong side of history?
GYIOTNB4bO8,20200327,993,Our American empire is falling and failing not because of some imagined threat from a foreign  nation but because of our collective greed.  Greed is what runs our economy and greed is what will destroy America.  I'm not being paid to write my political opinions nor am I being hired by someone to do it.
GYIOTNB4bO8,20200327,1006,I'm writing about this subject for the same reason I got into politics.  I care for my local community, my global community.  I believe in service to my fellow citizens.  It's the most important work community or is the most important work I'll ever do.
GYIOTNB4bO8,20200327,1016,I love my country about a reflection of our collective dysfunction and our need to move  in a better direction.  When I was in my early 20s and just out of college I began my journey to politics.  I left that political work behind a few years ago.
GYIOTNB4bO8,20200327,1026,I was out of my position and took myself out of the Washington DC Beltway.  Why first I started as an actor in classical theater and artist and writer before Washington  DC.  This work in the arts has always been my first love and my best vocation.
GYIOTNB4bO8,20200327,1036,A second I saw the reckless imperialism of America, the pain it caused throughout the  world, third I love Russia with all my heart.  I love the people, the history, the culture and even my attempts to learn the language.
GYIOTNB4bO8,20200327,1045,I cannot stand to watch the deception and xenophobia that came from my own American government.  So sad and destructive to revile another culture or country for no reason for economic gain.  President Putin scares the power leading America because he's a compassionate, caring visionary
GYIOTNB4bO8,20200327,1058,leader.  President Putin has higher approval ratings in America than the American president.  President Putin is beloved by Russia and he's not going anywhere.  Instead of being ensnared in the recent political intrigues and America's trying hard to set  that trap, President Putin is keeping a calm focus on his own country's development in
GYIOTNB4bO8,20200327,1072,the future without America.  Keep your eyes to the beautiful future and maybe, just maybe America will come to see  Russia as I do with eyes of love to all my Russian friends.  Happy holidays and Happy New Year's.  Alexandra Tereid, JD.
GYIOTNB4bO8,20200327,1085,I don't know, there's just a lot of weird stuff around this.  I mean if it gets vetted and validated by some more incredible mainstream media sources,  I mean yeah for sure.  I mean I think it should be investigated of course.
GYIOTNB4bO8,20200327,1099,What is JD?  JD is Juris Doctorate, which I think means you have a law degree but you haven't taken  the bar exam.  Are you signing up for the poker thing today?
GYIOTNB4bO8,20200327,1129,Anybody can play.  America's card room, even you, anyone.  Metal Gear Solid.  Just watch the DSP Metal Gear Solid.
GYIOTNB4bO8,20200327,1150,Just watch the DSP Metal Gear series and the seventh game in order of the timeline.  It takes place six years after Metal Gear 2's solid snake who is a secret agent that has  to infiltrate Shadow Moses which is a secret base that was captured by Foxhound who is
GYIOTNB4bO8,20200327,1162,holding the United States hostage for the remains of Big Boss who is the same guy as  Solid Snake except with an eyepatch.  Solid Snake not Big Boss sneaks into the air vent to save DARPA Chief but then he dies.
GYIOTNB4bO8,20200327,1174,So you fight a man called Evolver Asalat but your duel is interrupted by a mysterious  ninja called Gray Fox who is a man called Frank Jager who used to be in Foxhound but  then defected to Zanzibar because he wasn't loved with a former figure skater from Czechoslovakia.
GYIOTNB4bO8,20200327,1190,Because he is a robot he has to cut off Revolver Asalat's hand.  Then Snake finds a peeing man called Adakan who was the son of a famous scientist that  killed himself because his second wife cheated on him with his own son.
GYIOTNB4bO8,20200327,1202,You see, Adakan's father, Huey Emmerich built Metal Gear Zeke for Naked Snake and then built  Metal Gear Solanfer piss for a man called Skollface.  This is why Adakan builds a secret robot called Metal Gear Rex for a man called Liquid Snake
GYIOTNB4bO8,20200327,1215,who was a clone of Solid Snake created from the DNA of Big Boss who was also known as  Naked Snake who was both of their fathers and he has an eyepatch.  Solid Snake is tricked into activating Metal Gear because Campbell thought that Miller
GYIOTNB4bO8,20200327,1227,was not Liquid Snake but he actually was but turns out Revolver Asalat was actually  a double agent the entire time and was secretly working for the third Snake brother called  Solid Snake who was also the President of the United States and has a Dr. Octopus suit
GYIOTNB4bO8,20200327,1243,with plane growers on it and he has an eyepatch.  Are you following me so far?  Next we have Metal Gear Solid 2.  This is where things start to get a little confusing two years after Shadow Moses.  I'm going to say the plot of the main game is super straightforward compared to Metal
GYIOTNB4bO8,20200327,1256,Gear Solid 2.  Alright, we'll stop here.  I don't want to spoil everything in case we can play through Metal Gear Solid 2 as well.  Holy shit.  In case implying.  Oh my god.  7 o'clock EST.  That's two hours.
GYIOTNB4bO8,20200327,1278,Three.  Okay, where is this hat guys?  It must be under private.  Oh.  It starts today in the 27th of March right here.
GYIOTNB4bO8,20200327,1300,At 7 EST is 1900 EST which is 1600 which is in three hours.  Oh, Twitch Poker Epic Battle.  $2,500 guaranteed turny.
GYIOTNB4bO8,20200327,1320,Three people enrolled.  There.  The password for this tournament is...  Oh, I didn't make it in my thing.  I'm sorry.
GYIOTNB4bO8,20200327,1345,It's Epic Poker 3.  Epic Poker 3.  Any caps?  Nope.  It's got a $2.20 buy-in so good luck.  What have you done today, Moot?
GYIOTNB4bO8,20200327,1366,Wait it has a buy-in?  Yep, $2.20.  Fuck.  Yeah, get fucked.  Do you know how much that is?  For our trillionaire streamer like you.  Oh.
GYIOTNB4bO8,20200327,1387,How much money has H Bomber Guide donated to the COVID shit?  Somebody please tell me.  Please please please please please show me where he's donating money.
GYIOTNB4bO8,20200327,1413,These rich fucking lefties are really starting to piss me off.  How many fucking patrons do you think this guy has?  6140.  The minimum Patreon is $2 a month so bare minimum he's making over 12,000 a month just on Patreon.
GYIOTNB4bO8,20200327,1428,That's bare minimum.
GYIOTNB4bO8,20200327,1449,Someone calculated under a separate base of the final pay transit ship in the Vid, the  minimum he makes is $18,000 a month.  Oh, well, okay.
GYIOTNB4bO8,20200327,1472,Remember guys, these guys are just like you.  These guys are just like you.  They're poor.  They're just like you guys.  But to them, that money is table scraps and the wealth inequality is a huge factor in  this pandemic.
GYIOTNB4bO8,20200327,1485,Hey guys, thank you so much for watching my video about how neoliberal-  This guy's a prophet.
GYIOTNB4bO8,20200327,1506,Some commodifies everything.  I'm just a small lefty content creator on this platform and you guys know how hard it  is staying independent.  That's why I'm going to ask that if you have anything to spare at all, please donate to
GYIOTNB4bO8,20200327,1516,my Patreon and let's defeat neoliberal capitalism together.  One year later, guys, I have been blown away by your generosity.  Thanks to your help, I'm able to improve my video quality and make even better video  essays against capitalism.  At this rate, we are closer than ever to a more inclusive, fairer society.
GYIOTNB4bO8,20200327,1535,So keep funding the revolution and buy my merchandise that just released.  One year later, guys, I am so proud of how much trash in this channel is getting.  We are already at $10,000 a month.  The bourgeoisie is trembling.
GYIOTNB4bO8,20200327,1547,Remember guys, install raid shadow legends and level up those characters so they too  can get strong enough to defeat capitalism.  And go to NordVPN.com slash j-r-e-g to hide from spooky authoritarian capitalist threats.  One year later.  I am now a libertarian.
GYIOTNB4bO8,20200327,1571,Surprise, this video is actually sponsored by NordVPN.  You've probably already heard from foreign people.  I have these posts in my sub real.  Kind of doing napkin math, I got 36 frames assuming hitting more than one frame is wrong
GYIOTNB4bO8,20200327,1586,you can do it and then put it in a minute and then he does a math here.  So this guy makes at least $201,612 a year.  This is just on patreon by the way, this doesn't include sponsors or ad revenue.
GYIOTNB4bO8,20200327,1596,Or any other types of money you might make.  $200,000 a year.  And that amount is not even close enough to retire.  So if you all think YouTube content creators is a stable enough job to make donating any  portion of your income possible, your delusional.
GYIOTNB4bO8,20200327,1608,It's not fiscally responsible to live a life of luxury or for to donate even a single dollar  because there's a million ways a source of income could disappear tomorrow or could  do a more stable job.  And just in case anybody calls me a fanboy of this guy, I think donating 400 pieces to
GYIOTNB4bO8,20200327,1620,medical staff in this crisis is fucking smart.  I agree how much it should be applauded because you can't throw my name as a part.  Dude.  Who is um, does H bomb guy, does he have a family, does he have kids or anything?
GYIOTNB4bO8,20200327,1634,Like one individual 200,000 a year.  Holy shit.  That's so much fucking money.  Calm down, sweetie.  No, the oil friends was a real chat.  What's the code Steven or what's the what you called again?
GYIOTNB4bO8,20200327,1657,Sorry.  Dude.  These guys are so disgusting.  It's epic poker three.  Why do they, why are they out here acting like they're like you?  They're not like you.  They'll cast you aside.  Morals are only as good as society allows them to be.
GYIOTNB4bO8,20200327,1674,To them, you're just a freak.  And what was the game named Destiny?  Um, it's like the twitch poker thing or whatever.
GYIOTNB4bO8,20200327,1697,He doesn't donate money privately.  He's lying because he knows there's no way that anybody could ever call him out on it.  100%.  I really want to drop this.  What a fucking loser.  Keep in mind that somebody worth 45 million could divest 95% of their wealth and still
GYIOTNB4bO8,20200327,1721,be a millionaire.  What a stupid fucking statement.  If you make more than a million dollars a year, you should instead give that money to  me.  I'm poor guys.  Just like you guys.  I'm just like you guys.  We're all poor this together, right?
GYIOTNB4bO8,20200327,1741,I'm just like you.  We're all poor together guys, right?  Anyone else having trouble paying the rent?  Anyone else can before the rent.  Touchtag times up Biden.  Uh oh.  The Bernie Bros.  They're out in force today guys.  Biden Bros.
GYIOTNB4bO8,20200327,1759,Hold strong.  The girls are on me.
GYIOTNB4bO8,20200327,1783,Debate her about dog whistles.  She's on Twitch.  This isn't the person that I traumatized last time, is it?  That was sound nice.
GYIOTNB4bO8,20200327,1806,Oh.  If this girl wanted to do it, I would.  No lefty will debate me over land lordship because they are so hilariously fucking stupid  when it comes to anything having to do with housing.  It's a fucking joke.  I'll teach you this.
GYIOTNB4bO8,20200327,1822,This is my hair.  This is my pretty point.  Holy shit.  Is there a way to block specific subreddit to my phone?  You can't.  Because there's like every single subreddit is a fucking Sanders subreddit.
GYIOTNB4bO8,20200327,1842,Politics is, world news is, our president, Sanders for president.  Feel the burn.  There's like 17 different Sanders subreddits and they've taken over all of the political  ones too.  It's so fucking stupid.  Holy shit.  What was it?  What did we see yesterday?
GYIOTNB4bO8,20200327,1858,A few days ago, it was like the top of our world news with some girl tweeting landlord  bad.  That was like the top post.  What are you doing?  What the fuck is this?  Sorry.  What are you saying?  I was going to say, I think if you want to block the subreddits, you have to do it on
GYIOTNB4bO8,20200327,1872,your PC and then it will block on mobile.  I couldn't find out how to do it on mobile.  Oh, maybe.  Oh, yeah.  Presidential race memes has turned into a Sanders cesspool.
GYIOTNB4bO8,20200327,1900,You know, liberals are the only safe haven.  Good one, Kat.  Are we playing, uh, Halo today?  Maybe.  Wait.  Moot.  If you read the actual Reddit post, his tenant organized to pay for maintenance themselves  and everything they're doing, a run-strict-from-out that organized from the pride of a lot.
