video_id,date,start,text
GYIOTNB4bO8,20200327,8364,I'm just molding who's the queen who's molding over load.  Yeah, who's got the better punch now?  s
GYIOTNB4bO8,20200327,8386,that with  us  I'm getting Freddy.
GYIOTNB4bO8,20200327,8420,are you  arrange  a
GYIOTNB4bO8,20200327,8441,Can I get that can front?
GYIOTNB4bO8,20200327,8471,I don't ever remember to use the heat blast therefore it's bad okay.
GYIOTNB4bO8,20200327,8501,Okay what am I meant to do now chat?
GYIOTNB4bO8,20200327,8523,You need to lose.  I didn't wait.  Oh, just federalied.
GYIOTNB4bO8,20200327,8552,Aw he article Tory the colt fence base.  I should have flame beer it in.  Whoa got nothing.  Really tryna to farm there, aren't you, Matt?  No, the Forcing
GYIOTNB4bO8,20200327,8572,Fuck  involved
GYIOTNB4bO8,20200327,8633,You guys use precision bolt or micromissors?  First precision bolt.  Microw missile?  Why do I need to glow orange?
GYIOTNB4bO8,20200327,8656,Are you serious dude?  Oh my god.  Fucking in my run dude.  I don't even need to.
GYIOTNB4bO8,20200327,8689,If they're far away, do they not actually glow?
GYIOTNB4bO8,20200327,8712,There's a time limit?  Maybe they go blue to orange and then they unglow.  He did glow orange?  My colorblind?  Wait link the clip.  They only glow orange if you do a lot of damage.
GYIOTNB4bO8,20200327,8737,I've never seen them in my life.  They're out of range.  Why don't you go for the glory kill?  Wait what?  Holy shit I did not know this at all.  Wait is that true?  I thought blue meant you're good to go and I thought orange meant like they're almost
GYIOTNB4bO8,20200327,8757,unglow.  They're almost done.  So true is the answer to everything.  Wow we.  Oh my god.  Oh that's an important game mechanic.  Brain.  What's going on up here?
GYIOTNB4bO8,20200327,8783,Wait what...  There has to be something here right?
GYIOTNB4bO8,20200327,8820,dumping sure  What is this?
GYIOTNB4bO8,20200327,8951,Th
GYIOTNB4bO8,20200327,8975,Whatever  Why wouldn't I be able to go that way?  There's some bullshit.
GYIOTNB4bO8,20200327,9022,Who is the genie girl?  Is she the new like Asian of the week or whatever?  I've seen like four- Okay, so I see like seven posts about her and LSF this morning. Holy shit.  What aren't there?  I don't know if it's just- I'm getting racist to my old age, but I feel like every time I turn on LSF
GYIOTNB4bO8,20200327,9038,there's like a new like Asian girl that barely speaks English.  That's like the new LSF mascot for like a week.  That's what it feels like.  Yeah, and then they forget about them like hot chubby?  Yeah, and like yeah.
GYIOTNB4bO8,20200327,9048,Well wait, is she still got decent beer shippers?  I don't know. I would assume so, but I just don't see her on LSF as much.  Why does it matter if she's Asian?  Because that's what people fetishize the fuck out of.
GYIOTNB4bO8,20200327,9068,I don't know if it's an anime thing or like a perceived disposition that like Asian waifus  are like submissive, quiet, docile, whatever.  Oh wait, that time it worked.
GYIOTNB4bO8,20200327,9089,Fuck you for wasting my fucking armor.  Yeah, I should have used the X to do it right now.  Fuck you for wasting my fucking armor.  Yeah, I should have used the X to do it right now.
GYIOTNB4bO8,20200327,9113,Fuck you.
GYIOTNB4bO8,20200327,9143,I'm not going to do it right now.  Reference does not equal fetish.  You can fetishize the fuck out of somebody's race with regardless of having a fucking preference.
GYIOTNB4bO8,20200327,9166,I've talked to two different Asian girls that have dated a lot like in the California area  that run into a lot of white guys where it's like as soon as you start talking to them,  they're like, oh, so where are you from?
GYIOTNB4bO8,20200327,9174,Oh, really China? Oh, I love blah, blah, blah, blah.  I do this and I know all about blah, blah, blah.  They're like so fucking excited to talk about fucking Chinese culture assumption.  Even though these women are like Chinese American who have never been to China lives
GYIOTNB4bO8,20200327,9188,and don't give a fuck about it.  I quit the fuck anything. Not, I don't know.
GYIOTNB4bO8,20200327,9211,Easy comeback.  It is pretty omega weird.  The L.S. option.  You're pretty omega weird.  Adam.
GYIOTNB4bO8,20200327,9235,Nice job, Moon. Thank you.  Take a moment to look around you.
GYIOTNB4bO8,20200327,9261,Oh, yeah, the alt-right fetishizes the fuck out of Asian women too.  Because Asians are like another superior breeding stock race or whatever.  Why? Because they have like a higher IQ?  Something like that.  They say that like Asian people have a higher intellectual IQ, but white people have a higher creative IQ.
GYIOTNB4bO8,20200327,9280,So it's okay.  So Asian and white people together are like the ultimate, whatever.
GYIOTNB4bO8,20200327,9309,What the fuck?  Wait, that, not political though.  That didn't mean that it didn't pull it away.  Man, all this talk about Asian people should have me hungry.  Anybody want to order some Szechuan chicken?
GYIOTNB4bO8,20200327,9331,Because if you order off a Postmates using my code, the first five orders get you $5 off.  And you get $100 in delivery credits for the first seven days you use it.  Amazing!  Did you see, uh, he called Oprah's husband a beta.
GYIOTNB4bO8,20200327,9355,Is he even the guest house?  Um, I did not see that, but that also doesn't surprise us.  Pretty good beta, man.  Well, it's because, yeah, we know.  Not politics, probably.  Of course that would go through the problem.
GYIOTNB4bO8,20200327,9396,Come over here, you...  What?  Steven, what's in my cheddar?
GYIOTNB4bO8,20200327,9416,What?  Wait, you cut off like halfway through that, what do you think?  Is Postmates work outside?  I think you're saying did Postmates work outside of the US?  Um, I don't know.  Does it?
GYIOTNB4bO8,20200327,9442,Sorry, my game was lagging, it was lagging me.  Do you think people have mic issues on Discord in 2020 should just be permanently banned from the Internet?  Yeah, 200%.  It took a lot of people who have this issue, it actually makes me question myself.
GYIOTNB4bO8,20200327,9461,It's super weird, it makes me wonder if it feels like I'm like, when I hear people that have the Discord issues,  I feel like I'm the main character in like a movie.  I don't know, there's one where like, there's a lot of NPCs.
GYIOTNB4bO8,20200327,9474,Oh, yeah?  Do you feel like an NPC, cause you're getting a Passable One?  Look at him, look at his head!  How many lives does the movie have, guys?  Ten?  Ten, that's it, that's pathetic.  How many times have you died?
GYIOTNB4bO8,20200327,9497,What the fuck do I do here?  I saw a streamer say that Postmates is only for the Bourgeois.
GYIOTNB4bO8,20200327,9518,It is, but you have a chance to join that Bourgeois by getting free delivery and $5 off your first five meals, guys.  Awesome, make sure to sign up, type in exclamation mark, Postmates and chat, sign up for it.
GYIOTNB4bO8,20200327,9536,Shall I play poker?  I will be playing in that poker tournament with you a lot, yes.
GYIOTNB4bO8,20200327,9556,That's what we need, thank you.  I'm not going to lose any armor to the bullshit barrels.  There we go, now we're getting it.
GYIOTNB4bO8,20200327,9578,Just got Chipotle with Postmates free delivery, that's a good job, good one, dude.  No one cares, bro.  I care.  I'm carrying the revolution.
GYIOTNB4bO8,20200327,9598,Remember, guys, the revolution will not be televised, so you need to get on the streets, you're going to be getting hungry.  Wait, not a political revolution, just a gamer revolution.  I don't know where the fuck you go.
GYIOTNB4bO8,20200327,9620,No, that's another one.
GYIOTNB4bO8,20200327,9649,You have other hallway, you have the key.  What?  I'm down and take the actual life in the red thing.
GYIOTNB4bO8,20200327,9684,I'm going to go ahead and take the rest of the game.  These are grenades, I just noticed that.  Oh my god, I realized we're taking so much mystery damage from spiders.
GYIOTNB4bO8,20200327,9713,No, I didn't mean to hit shit.  I'm laughing, we're laughing at you, Steven.  Look at your Twitch chat, they'll be laughing there.  I have the best emotes, don't I, chat?  I want it through.
GYIOTNB4bO8,20200327,9747,The new agency, I take the locker room to make a democracy.  I'm going to save our ammo somehow, boys.
GYIOTNB4bO8,20200327,9781,I see this run going differently.
GYIOTNB4bO8,20200327,9810,I'm going to start talking.  I can stop.
GYIOTNB4bO8,20200327,9847,I'm going to save our ammo.
GYIOTNB4bO8,20200327,9930,I just got to...  Okay guys, we're going to make some key strategic differences this run.
GYIOTNB4bO8,20200327,9957,I missed one extra life.  Wait, how?  If you say I'm missing shit and I'm not, you're trolling, I'm IP banning you.
GYIOTNB4bO8,20200327,9978,No, you won't.  There's a secret.  What?  Extra lives aren't secrets.  Oh my god.
GYIOTNB4bO8,20200327,10001,How many is he missed, chat?  Hold on, I got to pull up your channel and see the Pepe laughs.  Look at his fumble.  It's time for you to quit this one just like you did 80s.
GYIOTNB4bO8,20200327,10026,You can farm extra lives and mission select.  Is that true?  That'd be stupid.  That's a band meme.
GYIOTNB4bO8,20200327,10046,We're not allowed to do that in this run.  What the fuck am I supposed to do here?
GYIOTNB4bO8,20200327,10069,Fuck, there should be no puzzles in Doom.  I signed up for a shooter and not a puzzler.  Every Doom game has historically had puzzles in it.  Dumb move.  The monkey bar.  Remember playing the old fucking, was it on DOS?
GYIOTNB4bO8,20200327,10088,Doom, we'd walk around, mashing the space button or whatever on fucking walls to find the secrets.  Yeah, yeah.  Do headshots work on this thing?  Oh shit, I just blasted his head.
GYIOTNB4bO8,20200327,10108,Headshots do more damage this thing.  Jesus.  Eight head IQ.
GYIOTNB4bO8,20200327,10139,So often you 20 grand to play League again, would you take it?  No.  About 100%?  No.  About a million.  Maybe, huh?  Okay.  You have your price, chat.
GYIOTNB4bO8,20200327,10164,Am I having a date?  What the fuck is this, Spider-Bitch?  We're gonna do it, guys.
GYIOTNB4bO8,20200327,10187,Is this every time I jump, it doesn't have to recharge or anything?  The secret you always miss, wait, where are Dunebug?  Are you talking about the one that I went back and got last time?
GYIOTNB4bO8,20200327,10208,That's bullshit, chat!  What?  It's at the bottom of the screen recharging.  Left on the wall now.  What the fuck?
GYIOTNB4bO8,20200327,10236,I'm cool, me.  Oh, wait, this is so good, actually.
GYIOTNB4bO8,20200327,10258,What's the best one, chat?  Someone don't even know what to do, thank you.
GYIOTNB4bO8,20200327,10351,Dude!  It should, it does.  It doesn't seem like it.
GYIOTNB4bO8,20200327,10377,There's a Baron.  That's pretty fast.
GYIOTNB4bO8,20200327,10412,Wait, what?  Oh, okay.  I thought we fucked some horrible shit up.  It needed fast-warming through the tutorial though I think.
GYIOTNB4bO8,20200327,10450,I'll give you insta-kill things, you still get the armor.
GYIOTNB4bO8,20200327,10480,Oh, why did I even try?  So weird.
GYIOTNB4bO8,20200327,10504,Guys, you should be signed up for that ACR poker tournament.  It's a $2.20 entrance fee.  I don't have $2.  $1,000 guaranteed prize pool.  What if you're in the middle of that tournament and you need to eat?  You only get 5 minute breaks, that's not enough time to run out and grab something.
GYIOTNB4bO8,20200327,10522,But it is enough time to order something to be a postmates, guys.  Go ahead and type an exclamation mark postmates in the chat.  You know what's fucking amazing?  What?  You're drunk and you can't go anywhere.  You're having a good time playing video games with your friends and then you want to make
GYIOTNB4bO8,20200327,10539,flurry postmates at McFlurry too.  Yeah, what about those of us who don't have friends, like them?  That type of advertising is a little bit insensitive.  Yeah, you're right.  Why am I?
GYIOTNB4bO8,20200327,10584,It's so bad.  Asking.
GYIOTNB4bO8,20200327,10618,You know what I'm saying?  No, actually, no.  If you're there, it's not the pit because you're not going to make it there.
GYIOTNB4bO8,20200327,10639,Thanks for making this Brit-bong quarantine more bearable.  Ha ha, the only bear here.  Right through the ground.  The living eye bear is, can't bear to stand you.
GYIOTNB4bO8,20200327,10664,Oh.
GYIOTNB4bO8,20200327,10692,I'm not sure.  Don't you have to act like a sponsor to have an add on the title where some indication of  the sponsor's fans?  You don't technically need add on the title, it's just supposed to be blatantly obvious
GYIOTNB4bO8,20200327,10709,that you're a sponsor.  I'm pretty sure it's pretty obvious that I've said multiple times with postmates and  sponsors.  I'm not just broing it out of the goodness of my heart.  Wait, what's that sponsor?  I can believe in the product and why don't we buy it without any sponsor?
GYIOTNB4bO8,20200327,10724,I can believe in the product and be sponsored by it at the same time.  Are you a sponsor?  Yeah, of course.  Do you believe in the product?  Yeah, of course.  He's gone.
GYIOTNB4bO8,20200327,10754,Did the armor disappear?
GYIOTNB4bO8,20200327,10783,I didn't always forget the time, did it?  Go away.
GYIOTNB4bO8,20200327,10833,you
GYIOTNB4bO8,20200327,10858,What's the password again?  Epic Poker 3.  It should be in the title of my stream.
GYIOTNB4bO8,20200327,10879,So how many people are sent up for right now?  It's a sentinel power cord nearby.  If you use it to activate the map and clear a path forward.  Entrance 40 remaining for you.  So 40 out of 80?  Only 40 people signed up.
GYIOTNB4bO8,20200327,10900,Oh, hold on.  There's an extra life in here too.  Chat, I don't know if I want to go.  I don't want to go to the pitch, chat.
GYIOTNB4bO8,20200327,10929,Oh god no, this is going to be fucking irritating.  It is not in your title?  Oh, well the pass...  I'm in the pitch!  Epic Poker 3.  I typed it in chat.  That's the title to the...
GYIOTNB4bO8,20200327,10952,I...  Okay.  Oh, one life down.  Oh my god, please.
GYIOTNB4bO8,20200327,10979,Oh.  Okay.  I love how when I hold artists skip it.
GYIOTNB4bO8,20200327,11008,Always waste my flame power.  It feels good.  Good jumps.  Have you died on this run?  Basically, should I miss an extra life?  Shut up, move.
GYIOTNB4bO8,20200327,11033,Yeah, I'm going somewhere more.  Oh.
GYIOTNB4bO8,20200327,11055,keep talking when we send the pit where does he end the pit right now how many lives is  there blood how many guns you holding move  oh man
GYIOTNB4bO8,20200327,11090,holes  this  Was that the pit that was it chat?  That was really the pit?
GYIOTNB4bO8,20200327,11111,I thought there was gonna be like an hour long thing.  Oh god, he...  He's two lives, I think he's one.  What?
GYIOTNB4bO8,20200327,11131,Oh, he's one.
GYIOTNB4bO8,20200327,11152,Fuck it, I'll take one here.  Don't die, idiot.
GYIOTNB4bO8,20200327,11180,What level are you on?  He's a good-ass level, you know?  One of my favorite levels, so I thought I'd spend a lot of time on it.  How do you see what level you're on?  You just know.  It's the god gamer thing.
GYIOTNB4bO8,20200327,11200,Absolutely right.
GYIOTNB4bO8,20200327,11230,they  What?
GYIOTNB4bO8,20200327,11278,Am I missing something?  Nope, I don't think so.
GYIOTNB4bO8,20200327,11318,Oh wow.
GYIOTNB4bO8,20200327,11368,I don't understand why I can climb it now but I couldn't before.  Can I climb up here or is this later?
GYIOTNB4bO8,20200327,11405,Am I supposed to drop down?  Oh.  Are we doing the challenges?  I am.  Mr. Metamazak.  Bitch.
GYIOTNB4bO8,20200327,11426,Okay, so there should be something else, right?  Oh, with milliseconds to spare, I think.  Do I have a promo code for poker?
GYIOTNB4bO8,20200327,11447,I think if you use Destiny as a promo code when you sign up for your account, I think you should...  Something should happen?  Yeah, my buddy was asking. I said they asked for that.  God, I need to waste my flamethrower.
GYIOTNB4bO8,20200327,11487,They call me the God Gamer.  Well, do they really though?  Does anyone really call you that, though?  I don't know.
GYIOTNB4bO8,20200327,11511,Yeah, just fucking...  What is it?  What is that?  Oh, my God.
GYIOTNB4bO8,20200327,11533,Yes.  No, I don't know my info.
GYIOTNB4bO8,20200327,11576,Nothing missed.
GYIOTNB4bO8,20200327,11606,Fuck!  Who is that?
GYIOTNB4bO8,20200327,11629,Is that Lycan?  Goodness, ain't it?  That was it, chat.  So now I have the Super Shotgun.
GYIOTNB4bO8,20200327,11651,And before I have to kill it, we have to leave.  I'm just gonna send for our poker guys.  The game caught me so hard there.
GYIOTNB4bO8,20200327,11681,Did it, though?  What did you cook yourself?  Did I miss an upgrade, guys?
GYIOTNB4bO8,20200327,11702,Or is that right up here?  Oh, no, it's over here, I think.  I'm just not good at puzzles.
GYIOTNB4bO8,20200327,11730,Is he really on level 4, guys?  He's at the very end of 3, okay?
GYIOTNB4bO8,20200327,11774,Action is coming.
GYIOTNB4bO8,20200327,11801,How many shotguns?  Wait, is there some super secret shit over there?  Or is that where I came from?
GYIOTNB4bO8,20200327,11822,Wait, that looks like some super secret shit.  We're gonna try it, god damn it.  Oh no, wait, it's easy.  Just one of these, guys.
GYIOTNB4bO8,20200327,11848,We're gonna heme blast, get against these slow-ery things.  Hey.  Oh, okay.
GYIOTNB4bO8,20200327,11879,If I save my game here, is it gonna work?  Or is it gonna be really weird?  I'll just push this game.  Okay, stop, we have to stop right now.  Pause.  Pause here, I'm gonna put this in.  Well, okay, play some number of minutes.
GYIOTNB4bO8,20200327,11898,Keep track of the minutes he's playing, guys.  No, I'll pause.  Can I pause here, guys, and save or no?  Hey, guys, remember, if you're watching right now,  you're about to hop into this poker challenge, right?  Guys, listen, if you want to be able to do this,
GYIOTNB4bO8,20200327,11910,you're gonna have to order food.  You need fuel to keep your body running.  I'll talk about this new company, Riot Games, Incorporated.  Fair the.  Creators of the action-packed multiplayer online battle arena  game called League of Legends.  You should check it out.
GYIOTNB4bO8,20200327,11926,Remember, guys.  Epic Poker 3.  That's the password to get in here, all right?  $2,500 guaranteed prize pool.  Top three, third place.  That is $1,500, guaranteed prize pool.  $500, second place, $750, first place.  A cool $1,000.
GYIOTNB4bO8,20200327,11947,$100.  Got damn.  And $50.  Do you have to pay to get in?  Um, yes.  $2.50.  $2.  Chad, I have to go in the poker tournament, I'm sorry.  All right, guys.
GYIOTNB4bO8,20200327,11968,I'm gonna hold there.  I will be back.  Wait, you're...  Why not just cover your cam?  Because then I can't talk about my hand at all.  I feel like I'd rather be in a delay than not being able to say anything about my hand.
GYIOTNB4bO8,20200327,11978,So I have to mute, so I can't be in here anymore?  Um, you can be in here.  I don't give a f- Oh, you're not gonna delay your extreme?  No, never mind.  You can go to your own room.
GYIOTNB4bO8,20200327,11988,Yeah, fine.  Wait, no delay.  Delay is way better than hiding cards.  Oh, yeah, okay.  Wait.  Fuck the delay.  Wait.
GYIOTNB4bO8,20200327,12027,Okay.  The thing is, is that, like, if I talk about my hand, I can't talk about my hand at all,  and I can only talk about what I think my opponent has.  But then it's gonna become pretty obvious what I have.
GYIOTNB4bO8,20200327,12045,Okay, I mean, we'll try it, I guess.  We'll see how this goes.  What do I register on ACR?  Destiny, you're a conservative, apparently.
GYIOTNB4bO8,20200327,12067,Why do you guys trigger me with these dumb, lefty takes?  Progressive, left-leaning capitalists.  Destiny is a conservative.  That's, he's a conservative.  I don't, I don't care.  What he, it's kind of fizzes.  I don't care if you should.
GYIOTNB4bO8,20200327,12087,But, no, it's just like, it's bullshit, bad face.  Like, take down stuff.  It's annoying.  It's not fun.  I'd be so curious what my conservative positions are.  What a fucking, what a politically illiterate dipshit.  Sorry.  Who the fuck called you that?
GYIOTNB4bO8,20200327,12100,Some random dumb fuck from Twitter.  Oh, it's like, it's like wrapping, man.  He's gotta take jabs at the king.  Serious fucking.  If they ever want to chat, guys, bring them on.  I'll do it.  It's gonna be easy.  What a dumb fuck.
GYIOTNB4bO8,20200327,12114,Anybody that's politically literaterenum to think I'm conservative  is gonna be a stupid fucking conversation.  Oh, you re-raised me.  I raised free flop.  Any re-raised me.  Oh, it's Kobe.  The guy.  You gonna lose again?  Maybe.  First hand, just like I did last time.
GYIOTNB4bO8,20200327,12137,Oh, wait.  There's a lot of people here, actually.  Let's hang on for one card.  Let's see the things we can see.  Ooh.
GYIOTNB4bO8,20200327,12157,We have a third spade.  Ooh, that's a scary check, boys.  A scary check, boy.  It's just popping easy five-hundo over to the sky.  Let's see what he's playing with.  Let's see how confident he is.  Ooh.
GYIOTNB4bO8,20200327,12177,He snap calls.  How is he feeling now?  Ooh.  I'm holding.  I had an ace king off-suit, but I was one away from the flesh on the turn.  I can see your card slightly.
GYIOTNB4bO8,20200327,12197,Wait, how can you see?  What do you mean?  I'm looking at my stream.  What are you seeing?  Let me see what you have under here.  I'm seeing two sixes.  Under your cam?  Oh, your hand's not showing because your cam's over it.
GYIOTNB4bO8,20200327,12212,Oh, wait.  Can you see it when it gets dealt?  There is text under your cam.  Wait, where?  What?  Oh, but you can see it when it gets dealt.  All right, we have to delay then.  There's like no other way around it.
GYIOTNB4bO8,20200327,12232,Sorry, boys.  It says two pairs and stuff.  All right.  I'll be back.  Even more training?
GYIOTNB4bO8,20200327,12252,You're gonna hit off when I'm at home.  Don't need to stop.  Do that fast.  Unte cruiser kit.
GYIOTNB4bO8,20200327,12277,Can you remove the dealing animation setting somewhere? I don't know where  Show animations  You're back
GYIOTNB4bO8,20200327,12298,8-3 suited this is a premium hand oh wait you can get rid of animations
GYIOTNB4bO8,20200327,12328,There's some guy at my table who just keeps donking it yeah yeah  Finally is out  I think this will work hold on a read back one second actually
GYIOTNB4bO8,20200327,12374,You
GYIOTNB4bO8,20200327,12614,I  Have someone named Paisie boot shipping on every fucking hand he keeps rebuy I think they're bought like eight times and
GYIOTNB4bO8,20200327,12636,It should be probably one re-buy  Wait you can rebuy?  Yeah, I just rebut oh well I would have I would have called him oh my god  I oh yeah, he just rebuy he just went all in and lost oh to blamos blamos pick it up a big boy pot
GYIOTNB4bO8,20200327,12653,So what you could rebut the other day when you weren't that bad off  I  Don't know but yesterday, but I know today. No, no that was just like a small streamer  Okay, I tell my delay off what's up. It's like a streamer thing shut up moot. No one cares about your analysis
GYIOTNB4bO8,20200327,12669,You're facetious and sarcastic you're just tone  It's not this guy you shipped it with two six. What is he doing? Oh  I got ace two  I'm just kidding a face I'm shipping it Steven they call me shipping move
GYIOTNB4bO8,20200327,12695,Well, I should be moving and shipping it you be  Shipping it by shipping do you mean like you want Harry Potter and Ron to get together kind of thing like that kind of shipping?  No, like Lillian Michael Reeves
GYIOTNB4bO8,20200327,12709,Isn't that actually happening or isn't what  Why cover your cards if you're just gonna use to like I'm not using delay right now I turned it off you fool  You know what I want to ship. I'm in a good spot again
GYIOTNB4bO8,20200327,12729,Well, I'm in a good spot Steven well, thanks Tradix on  For gifting to folia dude, why are my sounds on I want to ship these nests to your mouth port  Hey, chill  Oh wait, why are my stream elements things fucked fuck
GYIOTNB4bO8,20200327,12753,Hey  Wait, I don't know if my donations aren't guys. Can you guys donate and sub to see if they're working no minor actually fuck mine  No mine are  How do I fix this?
GYIOTNB4bO8,20200327,12775,My overlays  Copy your all right can someone donate and subscribe I need to make sure they're on
GYIOTNB4bO8,20200327,12795,Chat I'm not in ting  What are these stupid stuff?  My kenzune this is so dumb you're there's like three people my table to shipping it someone is 13,000 right now  Thanks for you over the tier two sub. Thank you
GYIOTNB4bO8,20200327,12811,Destiny people are asking in your chat. Can they still join this?  I don't know try it if there's rebis is probably late with the  That's a password  Call him call who  Someone on my table and it's yelling it. Oh, I got aces. Oh
GYIOTNB4bO8,20200327,12833,I have to download this shit with the fuck down down a lot of you don't have a chance kid  I'm the guy that wins because I piss people off because I don't actually know what I'm doing  They don't know how to read me
GYIOTNB4bO8,20200327,12847,Three people in the pot I get the nine give me an ace. Oh my god. I've gotten bad beat twice now  I'm downloading this is so dumb poker malware
GYIOTNB4bO8,20200327,12868,Whoa, hey, hey, hey that's a sponsor you're talking about just  Getting jet my antivirus program said there's nothing wrong with this  Spain
GYIOTNB4bO8,20200327,12889,I want to come to your table Stephen  The wire there and she's unlimited so stupid you're so stupid
GYIOTNB4bO8,20200327,12910,Oh, I'm at the blame us table. Did you ship it in doubt? I?  Am a ship young ship young shipping. I'll do that. He never lose  That's all in baby nine and a 94 chips boy in  994
