video_id,date,start,text
GYIOTNB4bO8,20200327,4170,I'm on just chatting then make a goddamn editor work for their pay into a chat  True and change my shit. I mean editors my wonderful editors. Please a twitch chat. I  Just got the second shotgun upgrade how far behind are you?
GYIOTNB4bO8,20200327,4185,I'm already ahead of that actually. Why are you so loud? Am I loud you guys make me change my mic every fucking day  when I  Think it's EU versus NA years  It's fine fuck band that guy, okay
GYIOTNB4bO8,20200327,4207,Wait, why do I have four shots how am I supposed to kill the spider guy? No, I have the wrong weapon he quit I'm gonna die  I'm restarting
GYIOTNB4bO8,20200327,4245,Oh  Man guys we gotta wait I don't get these reflexes back what  I don't what work computer exits the main menu except
GYIOTNB4bO8,20200327,4268,campaign Oh  Actually mode  Oh really dog
GYIOTNB4bO8,20200327,4299,Should we let maybe we should let moat running on a lower difficulty guys, what do you think?  He mad boys getting mad or matter  Just you wait just you wait
GYIOTNB4bO8,20200327,4326,Come on open the door he's so mad right now guys wait  You can hit the bell  I didn't know you could I don't know why makes this different picture between headed but  Does the extra toy I found you mean extra life yeah, dude, just keep picking them up
GYIOTNB4bO8,20200327,4361,That's isn't it true, thank you see by your offer the three months  Guys we need your twitch primes and chat right now more than ever  With the coronavirus coming up we may need to go on more vacations. No don't hit me
GYIOTNB4bO8,20200327,4378,Well pick up a toy  Because they're cheaper than ever yes vacations are cheaper than ever all twitch prime subs right now going towards my next vacation  If we can what those fuck if we can raise enough twitch prime subs all going to vacation goddamn tonight tomorrow tomorrow night
GYIOTNB4bO8,20200327,4401,Dude you're not good to stop jumping around  That's an extra life  How'd you get one you gotta get all the secrets dude  You're swapping weapon mod and then you pick up the toy it skips the animation whoa what
GYIOTNB4bO8,20200327,4425,shooting  another Benelli skip  How is he shooting through that go on that vacation Steve thank you
GYIOTNB4bO8,20200327,4448,Thank you your funds have been appreciated. I'm ready to go on a vacation  Any other vacation supporters in chat you have to put hashtag add your title or else I will even oh well  Watch out guys. That's the FCC camp fuck with me or something because I'm an emollary ago
GYIOTNB4bO8,20200327,4489,So plus makes you got more drivers that are actually usable. Oh, there might be right now. They might be assured  They actually stream the vacations I'd be fine listen if internet was stable fucking anywhere, okay  The stable in Miami. Yeah, you say that how much you do. Oh, we did stream a little bit
GYIOTNB4bO8,20200327,4515,Stop running around so much  Thank you  What oh my god, this is game is gonna be so easy  Why'd you lose no, I have like 20 fucking lives now  Oh, why did I fall maybe we should go back
GYIOTNB4bO8,20200327,4539,Shut up moose  Crying before you oh, I can't do it. It's not possible  I want to be scared yet  Oh, we don't want to go back tonight
GYIOTNB4bO8,20200327,4566,Wait, but there's like no armor now what the fuck wait is there no armor is it all replaced with extra lives no  Wait, what did I miss back here? Oh, I remember which one I missed it was the doll
GYIOTNB4bO8,20200327,4584,I'm not gonna lose yet. You've already lost though  No, I have an extra you have that's why it's cringe for you to say that you're not gonna lose
GYIOTNB4bO8,20200327,4625,People are gonna make fun of us. They're gonna be like only nightmare lol  Well, I'll try to beat it on this one and don't lose a single life then  True, but they'll say you had the safety net lol
GYIOTNB4bO8,20200327,4637,Just like rich people are pretending to be poor for a month or two. Yeah true  Actually if you were to beat it on this mode and not die a single time technically  That would be even harder since a lot of your armor picks have been replaced with extra lives
GYIOTNB4bO8,20200327,4653,True  X you see played it on journalists. No, he did not on journalists. That means like I guess  Oh sure
GYIOTNB4bO8,20200327,4676,I knew I was be over now the fucking five  Hey, where do you get them all like every armor pickup is replaced with like an extra life? Oh  I just handle oh
GYIOTNB4bO8,20200327,4708,Oh, sorry see you  Oh no, yeah, shut up. It's never time to see you
GYIOTNB4bO8,20200327,4746,The Moo Tony skip  Are you going for a positionable or micro  I always go for a little I would go micro missile for you though. It's a lot easier for people that can't aim  I got baited boys micro missiles vastly superior
GYIOTNB4bO8,20200327,4770,I'm stuck  You have the extra life wait was there one back there? No, I have five the only five. I've got seven
GYIOTNB4bO8,20200327,4795,Can I break this window I can break these cuffs  Your sarcasm a facetious tone don't fool me mr. Mooten  Oh  Oh my oh my
GYIOTNB4bO8,20200327,4828,Wait, oh those guys I don't fuck with spiders anymore. You'd save your chainsaws for him. Amen brother
GYIOTNB4bO8,20200327,4849,They died of one shotgun shot. Oh, I shouldn't be wasting my chainsaws on them the worms  Of course they do I've been chasing them every time I see them  You're stupid  Stupid good  Good all right, I figured out the weight kill spiders with the chainsaw now that and
GYIOTNB4bO8,20200327,4889,The missile you had or the not the micromets the other one  Okay
GYIOTNB4bO8,20200327,4918,Okay another easy kill  I'm a gun door  I'm  I'm coming Steven no you're not
GYIOTNB4bO8,20200327,4957,I  Spider-man fucker still a while  What did you die again almost caught up you died again I just finished the moat room
GYIOTNB4bO8,20200327,4980,I'm doing the room right now now you're not even close to the moat room
GYIOTNB4bO8,20200327,5011,Oh my god, I just missed a shot  Don't care  I'm  What fuck are you doing up there? Oh, thanks for the amount bitch
GYIOTNB4bO8,20200327,5054,I  Six lives moon what the fuck this feels so dumb true, it's the safety net it makes it all easier
GYIOTNB4bO8,20200327,5087,I just finished the moat room about you I  Did finish with the moat room  That did not kill it  Idiot I just wasted fucking 50 armor. Oh my god. I should have changed sawed it  And I just wasted so much I had a full I a fuck me
GYIOTNB4bO8,20200327,5134,Oh  I already blew that thing up oh
GYIOTNB4bO8,20200327,5166,I can't  Are you  How did I catch him after recirting I'm restarting if I die here I will restart fuck this  You having trouble on the spider  Oh wait, it's actually impossible. I can't beat it cuz I only have one chainsaw thing. I can't kill him. I
GYIOTNB4bO8,20200327,5197,I'm done on the head  How do I just jump over there and and do what?  There is another tentacle I  Hit it just an easy victory for me
GYIOTNB4bO8,20200327,5224,Against all the evil that hell can conjure oh  Oh how the turns a table we will send  It is done trying to feel like the near did you restart yes, oh my god
GYIOTNB4bO8,20200327,5251,I'm like one of your cringing in the chat I just needed to get my bearings  Guess I got my bearings we quick I'm on level two yeah for the first time in fucking two days good job
GYIOTNB4bO8,20200327,5271,No, well, I'm still here before you  Too easy Dave  Come up second level
GYIOTNB4bO8,20200327,5292,Level two is what they call me you know they call you level one tutorial Andy  Oh my god
GYIOTNB4bO8,20200327,5329,What is what is happening what is happening today? Okay  actions
GYIOTNB4bO8,20200327,5351,Chad how does last oasis look look like any good or not again it's way too hard for you  What was it on console or PC last oasis is a switch game
GYIOTNB4bO8,20200327,5373,You're not good stop acting like you are no the imp I like to think I'm pretty  good not either whatever I miss the secret last time get it now not having a fast
GYIOTNB4bO8,20200327,5396,travel I'm scared you should be  Wait you've gotten a level two before right yeah I just the thing didn't spawn oh  there is
GYIOTNB4bO8,20200327,5420,wait I was switching my weapon attachment and it's still fucking to the animation  fuck you whoever said what
GYIOTNB4bO8,20200327,5440,your  fuck you  Oh
GYIOTNB4bO8,20200327,5463,Don't look what I just got fucking nothing  Wait, how do I use my you can't because you're bad and you're gonna die
GYIOTNB4bO8,20200327,5500,Oh  No, okay, survive one death blow I
GYIOTNB4bO8,20200327,5522,Think we gotta go that one you already died once  He died once  Stop  I'm not talking. You did die. Just own it moot own your dad. Okay. No bullshit. No bullshit. All right
GYIOTNB4bO8,20200327,5545,But you keep bringing him up does he live right for in your mind that guy's name is the noble shit  Why did you assume that no bullshit means that no bullshit? Oh my god. Oh, what are you thinking about him?
GYIOTNB4bO8,20200327,5560,Get fuck where do I go chat  Okay, this guy's pissed me out
GYIOTNB4bO8,20200327,5592,Now what is what don't worry about it
GYIOTNB4bO8,20200327,5623,Dude my armor  Why what just don't worry about it
GYIOTNB4bO8,20200327,5655,I  Mean you guys think we can do another Benelli skip right here. Do you think you could reach this?  Nope
GYIOTNB4bO8,20200327,5676,Close  Answer rush tapping out of this game is a nightmare. What do you want Raj through am I if you're making me tab out  I better be for some important shit  What the fuck just hit me
GYIOTNB4bO8,20200327,5708,Let me join voice chat words for voice chat are we in the super secret room or we are and I'm not sure I  Don't know so talking to me he died  Love fail limi limi fail one mood to life down
GYIOTNB4bO8,20200327,5732,Because anytime a monster died to I didn't die I had this slow down life thing so  There's no shame it does. Oh, he's monster really hard especially for you  I'm a god gamer unlike you so I don't have to worry about dying
GYIOTNB4bO8,20200327,5764,Oh, I love a duck  All right, is there a secret in here chat?
GYIOTNB4bO8,20200327,5785,Even if there was you wouldn't be good enough for it. I don't like the control grenade launcher. It's fucking hard to use
GYIOTNB4bO8,20200327,5816,Oh  You can use the middle mouse button no no I don't mean like the button to activate it  I just mean like it's hard to like aim it's weird
GYIOTNB4bO8,20200327,5840,Just bragging the bag of me  Kill and take their shit  Oh fucking kidding  Oh, oh, oh you got like achievements or such thing
GYIOTNB4bO8,20200327,5878,Wait, I don't unlock like a better grenade launcher some shit by kill more enemies with it. Do I?  Shut up moose you're not funny when you lie to me  So funny when I don't lie
GYIOTNB4bO8,20200327,5902,Stop chasing me. I don't want you  Someone is a drag russian. Well, make fucking disco Dan do it  Yeah, you're sarcasm facetious tone you're not fool me  Wait, what was that from from the train clip when he's trying to jump through the window? Oh?
GYIOTNB4bO8,20200327,5918,Oh this spider is skippable. I'm killing it out of spite which one this one fuck you  Okay, you're making me fuck up my whole plate the garage hold on
GYIOTNB4bO8,20200327,5938,No  What we're in the  Okay, there  He comes in and doesn't even speak
GYIOTNB4bO8,20200327,5959,Raj we're in the room you better fucking join because you just made me tab out and pause my run. I'm losing ground and moot  You're always gonna lose ground to me no dad  No, I didn't mean to hold it twice Lin Fao. Why is like in messaging me now? I gotta all tab and look
GYIOTNB4bO8,20200327,5985,It's gonna be some dumb shit boys destiny rush from the rush. How are you? What do you want look today?  We are kind of don't want to advertise it, but I was wondering if you'd be free  About an hour or so. We're gonna do a maybe a show with the soda pop in Greek and S fan doing what?
GYIOTNB4bO8,20200327,6004,It's a reverse show. Just I don't know. I just got a wild hair. I  Don't want you to do it. So I guess that's okay  I would but I literally have a sponsored thing and I have to do today. I'm sorry
GYIOTNB4bO8,20200327,6015,Like it's a poker tournament thing coming up. I damn it. Sorry fuck  All right  Well, maybe next time I'll be more than just like a last-minute mention for you  You'll think about me. No, you're not a last minute mention literally everybody's a last minute mention
GYIOTNB4bO8,20200327,6029,It's it's literally like an hour and a half past when I normally start anyway  So  That's right. Yeah, thank you. Thank you for making yourself available. Bye. Bye  Wait, don't leave  Don't leave I'm not leaving. I can't tab out. I'm your prisoner in here. Oh, okay
GYIOTNB4bO8,20200327,6061,Thanks for the four months  Oh  Don't make noises while I'm trying to concentrate you want to play you want to play college duty later  Maybe rush maybe okay. I'll play I'll see you in college. You later. Okay. Okay. Bye. Bye. Bye
GYIOTNB4bO8,20200327,6083,Oh  Yeah, it seems like we're just gonna exit training cool things. Well, I mean, it's it's a game breaking spell so
GYIOTNB4bO8,20200327,6106,See what I feel like there's too many fucking lives  Oh  How many you down to I have 10 right now you have 10 lives  No
GYIOTNB4bO8,20200327,6126,Oh, I need you to never talk to me again. Oh, what's happening? What's happening?  Against all the evil that hell can conjure
GYIOTNB4bO8,20200327,6146,He restarted. Oh my god, you're two levels behind now  We will send  Hey, what can I just say one thing no?  You're gonna get a lot of extra lives throughout this run. It's okay. If you die. Don't have to keep you starting on the first mission
GYIOTNB4bO8,20200327,6164,No  Okay, I tried I love you Chad. Bye. Good people were saying there's one life per level. No, there's at least like  I think it's like a minimum to I've never found like less than two that's anecdotal so I can't like guarantee that
GYIOTNB4bO8,20200327,6179,Okay, oh, yeah, don't freak out so hard. I love you buddy. Let it be no Narnate  You got me killed  He's down to 15 lives boys. We're coming back. All right. I'm sorry  You ever just fucking hate RNA like he's just the dumbest fucking stupid like you wish you would have done
GYIOTNB4bO8,20200327,6205,In a video game, why would you say that what?  Okay, why would I say what?  Stop fucking  Signaling your fucking military shit in here. You little cuck. No one cares. Okay. You're not cool. I care  I am cool. You're not you're definitely not cool. What why is the ground hurting me?
GYIOTNB4bO8,20200327,6229,Because the ground hates non-cool people  They confirm for his service right now
GYIOTNB4bO8,20200327,6249,Stop shooting at me  Thank him or you're a big it  More like a big dick  Boom  The Revenant is a heavy artillery heavy aerial demon. How are you that far? What?
GYIOTNB4bO8,20200327,6281,Okay, I'm not really I'm not dying. I won't restart, but I also just won't die  I don't know why I've been dying guys. We don't know what happened. I'm trying to move over here. Can't make it past level one
GYIOTNB4bO8,20200327,6294,Level one Andy over there  Yeah, that's got it kind of like a secret monster killer some shit right guys  Okay, I should get an achievement for that
GYIOTNB4bO8,20200327,6335,Move dumb  Stop your turn. You're gonna die over and over again. You're not ready for this level. You're not ready. You can't hack it  Okay  Okay, I'm not ready for this level one  No, I hit the barrel into damage me
GYIOTNB4bO8,20200327,6381,We're going guys I'm reloading  Shut up, okay, everybody's laughing everybody was laughing look there they are  Wait did I get the one secret back there guys? Oh my god, what do I always forget that one?
GYIOTNB4bO8,20200327,6409,Get this  I'm
GYIOTNB4bO8,20200327,6438,the  was a like a punchline coming or like a joke or  back  just recycling the fuck out of old means  the name mr. Mooten and I'm here to say I'm a meme recycler and I'm not
GYIOTNB4bO8,20200327,6460,you're not what okay you're not okay  I'm upset we know  oh
GYIOTNB4bO8,20200327,6480,fuck you  wait what am I doing  stop oh my god I don't know  I had three chainsaws but I have to pick up the one out there for
GYIOTNB4bO8,20200327,6502,I have to pick up the one out there for  that's what I was looking for
GYIOTNB4bO8,20200327,6525,I will give you one thousand dollars if you can be this game on ultra nightmare with no extra life  hundred thousand dollars  hundred thousand dollars oh peach you know you're gonna be practicing for  next two months  this is shot does the shotgun sound in this game sound specifically like anything to any other Doom players
GYIOTNB4bO8,20200327,6548,the shotgun and the reload sound  oh uh pudgy again  it might just be like generic and maybe it's maybe they all sound like this  I was looking at my chat and I just lost fifty armor for no reason
GYIOTNB4bO8,20200327,6572,yeah
GYIOTNB4bO8,20200327,6603,everyone here agrees that it's kind of dumb that melee does literally no damage right oh I  everybody agrees with that  I'm so greedy I deserve to die
GYIOTNB4bO8,20200327,6623,I'm restarting restart incoming boys it's right here
GYIOTNB4bO8,20200327,6653,I have just too big of a fucking brain  you don't  moat
GYIOTNB4bO8,20200327,6687,what  oh yeah just spun him right on top of me while I'm down here that's what I wanted to see
GYIOTNB4bO8,20200327,6708,I'm molding  oh this is the pit aren't it isn't it you're nowhere near the pit dude you know you're telling you're in the pit when you lose at least six lives
GYIOTNB4bO8,20200327,6735,chat what is this what am I in  two people recently have been insanely fucked by twitch
GYIOTNB4bO8,20200327,6756,I'm sorry Jenny Jenny I'm sorry Jenna and Casey where as a scuff podcast man about the double standards really makes you think boys  oh I was fucked training by me to go in last night but I was busy you know wanted to watch movie with who your mom okay
GYIOTNB4bO8,20200327,6794,direct shotgun blast direct shotgun blast dude it's not reliable  I'm about to just fuck this spider up homie aim at the base
GYIOTNB4bO8,20200327,6831,I still on the first level yeah I just wanted to get moon a little bit of a head start  this one's never been at level two before I wanted him to know what it was like I guess to be a little bit ahead
GYIOTNB4bO8,20200327,6866,of me  do you know
GYIOTNB4bO8,20200327,6912,get me out of this fucking level soon
GYIOTNB4bO8,20200327,7032,that's me a secret around here  you're not even gonna get any of the secrets why you're pretending to try  my head of steve  barely in the grand scheme of things
GYIOTNB4bO8,20200327,7054,no  i don't believe in the map okay  i just don't believe in it what map  i don't know what it's i don't know how to tell if i haven't found a secret
GYIOTNB4bO8,20200327,7075,that  give me the fuck out of this level  become maker is nearby  she is inside that demonic citadel  i will mark her location on your heart
GYIOTNB4bO8,20200327,7102,the  wait why can't i fast travel  or show my friends
GYIOTNB4bO8,20200327,7123,wait what did i forget that i forget the one thing again  the walk inside  would you guys mind if i insert myself into this competition
GYIOTNB4bO8,20200327,7145,you sure i was right here trying to stream it  but you're not gonna make it like an let's be real but  oh no dude you will get no pushback from me there and i fucking  you guys are way better at this game than i am at every game like
GYIOTNB4bO8,20200327,7161,you know what you're fucking right i'm not gonna push back on that either  like a pushback of something  no  i am self-aware  so we have these maximum fighting the demons dude
GYIOTNB4bO8,20200327,7196,oh yeah our president that's a good god there's a twenty different bernie bro  subreddits  why do you need fit why do you need feel the burn our president  sanders for president why do you need all these different subreddits for the
GYIOTNB4bO8,20200327,7206,same candidate  it's fucking cring totally shit guys  yet and political hammer and politics and world news and news that they've  taken over jesus  wait you get all of your armor
GYIOTNB4bO8,20200327,7228,no politics by the way  i'm trying about reddit  what is it  politics
GYIOTNB4bO8,20200327,7264,what what do i do here chat  my country i'm confused  uh-oh my dad is a runny nose coffee for an headache  uh-oh you're dead  wait what just happened
GYIOTNB4bO8,20200327,7286,hope he's okay  i think both my parents have like two or three of the comorbidities for  the flamed out like i know they both have hypertension high blood pressure  uh... and it is both are diabetic  but they're being safe
GYIOTNB4bO8,20200327,7306,i have no idea  my mom thought it was a hoax for the beginning so  so do my  one of the hoax but not that serious
GYIOTNB4bO8,20200327,7335,the portal is activated and ready when you are  this is an arc broadcast  there are reports coming out of the quarantine tell-off i'd zone near the san  andrea's chasm  so what are personnel  so what's the uh... the game of
GYIOTNB4bO8,20200327,7355,look at how sick the doom guys ship is what the fuck is this  or the law some day guys  i'd like a fucking floating cast out we beat the game will come back and play  on journals  and
GYIOTNB4bO8,20200327,7378,as much as we got to the slayer in a yet on level two  i think i'm past that  did you do this you did the slayer in a  no he definitely didn't we would be knowing  trust
GYIOTNB4bO8,20200327,7404,trust me well now will know  will know will move  all my biggest weakness puzzles
GYIOTNB4bO8,20200327,7424,no  does it matter  how you kill something if you use the plan for our we always have the same  armor like should you be shooting with little weapons  if you should more like every hit makes it to the radar
GYIOTNB4bO8,20200327,7446,sure  they've heard like if you just killed out right you get  yet when i killed it is not right i get you a lot of armor  if  actually killed them or you get
GYIOTNB4bO8,20200327,7470,it's the same no matter how you kill it or how  far  yet that's kind of what i think  as long as you're a max health all health  i'm on level three  how far are you
GYIOTNB4bO8,20200327,7492,all remember to turn back on uh... tutorial to be a mom
GYIOTNB4bO8,20200327,7522,for any broughs want that woman to have gotten late  are never mind up on the skin guys are you waiting for important stories to  come out you know the computer your constantly mashing f5
GYIOTNB4bO8,20200327,7543,why don't you guys go ahead and check out my post mates offer  guys
GYIOTNB4bO8,20200327,7567,the  in  that  is
GYIOTNB4bO8,20200327,7593,really giving up competition  are just what we're doing  focusing on  with  a really giving politics  one of just while we're doing this much issue we should, we're not  How you should
GYIOTNB4bO8,20200327,7614,Oh  Unpopular opinion inbound  Unaware
GYIOTNB4bO8,20200327,7681,That's new bait. It's not good normally, but if you have like one target you need a DPS down like all quick  It will annihilation it
GYIOTNB4bO8,20200327,7717,Where's my night guys somebody tell me  That the motion centers in artillery  Is moving farther than I was yesterday. Oh wait, you're at the slayer gate. I passed it. Oh, that's where I died yesterday, so  I
GYIOTNB4bO8,20200327,7738,I'm gonna make up some ground guys
GYIOTNB4bO8,20200327,7768,Shut up I'm watching more  Is this another doom guy chat  I
GYIOTNB4bO8,20200327,7797,Give you any help on me  That's the betrayer what does that mean
GYIOTNB4bO8,20200327,7830,Chat where's his HP at?  What do you think I lost?  No, I just know that the tray is hiding HP  Fuck he's using white Helen demons where we'll fight off the Sunnels
GYIOTNB4bO8,20200327,7852,Keep your trade  And to the name of the tray  Don't him for his HP  I  I did you wasted some I don't know
GYIOTNB4bO8,20200327,7898,I  Know we're on the same difficulty. He's just bad  My friend is just skipping slayer guys guys. That's why he thinks he's good. Don't worry guys. We'll catch up to him
GYIOTNB4bO8,20200327,7926,Wait, how am I skipping? Oh shit, you guys think my stream got this extra line? Doubt it
GYIOTNB4bO8,20200327,7956,What  Hold on my throw is okay  Oh
GYIOTNB4bO8,20200327,7986,Hello shotgun ammo, thank you  10 lives I didn't know we were playing animal browsing here drew  I just wasted my quadruple damage no
GYIOTNB4bO8,20200327,8017,Oh how can one run go so disastrously oh my god
GYIOTNB4bO8,20200327,8047,All right guys remember it's a marathon not a sprint got all the time in the world, baby
GYIOTNB4bO8,20200327,8077,I  Got that blurb up there I can get  Stop shut up  There goes one life you've only lost one pretty sure you're too down move
GYIOTNB4bO8,20200327,8110,Come on how how is it even possible  I
GYIOTNB4bO8,20200327,8133,Looks like it pulls from the extra lies before  Death rune might be bad at least I get the pulls from the actual life before I choose to slow down  Yeah, I think the death rune was a mistake level three
GYIOTNB4bO8,20200327,8156,Back to the fortress of doom  You man  You man did he die again chat
GYIOTNB4bO8,20200327,8179,I  I'm restarting going back to the very beginning guys  Fast travel you can't take it to the very end
GYIOTNB4bO8,20200327,8209,Look at his lips  Oh, I was at the original doom guy armor chat
GYIOTNB4bO8,20200327,8233,Just kill them in a machine god they take so much ammo though. I don't know how to can can you  With him  This is what I was trying to do before it should be this easy so stupid how hard this was
GYIOTNB4bO8,20200327,8247,Oh fuck  I  Nice ball
GYIOTNB4bO8,20200327,8283,old  quotes  on
GYIOTNB4bO8,20200327,8311,the the former  Okay boys, we have to pray that our upgrade to make this ship worth it.  Upgrade the launch, you have three points?  I only have two motherfucker, shut the fuck up.
GYIOTNB4bO8,20200327,8337,I'm on the doom shit.
