video_id,date,start,text
KdYKb9b1pNc,20200318,4974,Anyone nearest cleanest washing your hands with soap and water.  Jesus Christ.  God, bidet shitters are the worst.  Bidet shitters are the number one fucking epic.  Bidet shitters, when you, you know what?  You know what a bidet shitter has in their mind
KdYKb9b1pNc,20200318,4989,every time they sit down.  You know what they're thinking?  I want to win the narwhal bacon.  It's because you just fucking Reddit memeers.  you disgusting fucks, okay?
KdYKb9b1pNc,20200318,5024,So all we do for this is it's called pocket jams and we just jam out.  Yeah, we roll it.  We are rolling.  We are rolling.  We just kind of make you sound as you go.  So there's the cutoff.
KdYKb9b1pNc,20200318,5042,Oh yeah.  If you want the chord, just kind of jump down to this.  And that's your octave right there.  Yeah.  Oh, you know, this is how much money...  Oh, yeah, yeah, so I'm just gonna tap.  I am gonna get a bidet now. Thanks!
KdYKb9b1pNc,20200318,5088,How are you just gonna admit to the world you gotta do to be booty like that like it  How are you just gonna admit to the world you gotta do to booty like that like it ain't  No.  Thanks!
KdYKb9b1pNc,20200318,5146,Okay, I'm gonna be totally honest with you and I'm gonna trigger the fuck out of some  like professional musicians in here.  This is the part where I was at music school where I would be standing around and everyone
KdYKb9b1pNc,20200318,5159,was like, oh god, this is so cool, right?  This is so cool, right?  And I can't tell if everybody else around me thinks it's actually cool or if they're  all just some part of some fucking club and they all just want to feel like they belong
KdYKb9b1pNc,20200318,5168,into each other.  Like, this sounds like ass.  I'm sorry.  I said it.  Okay.  Are these people actually grooving to this?
KdYKb9b1pNc,20200318,5235,What a load of malarkey.  This music sucks my a boogah.
KdYKb9b1pNc,20200318,5278,Destiny more like crusty and peb laugh at least.  Use wet wipes to clean your dry ship from.  Sounds like a jam?  ECH.  Listen.  I  Just don't like Jacob Collier. I said it. You know what I said it. He knows a lot about music theory
KdYKb9b1pNc,20200318,5295,I don't like his vocals in any of the songs that he does. Okay  What is his most famous one the one where he's like oh  This is this one, right?  I  Don't like his music  Fuck him please fucking stop also yee I
KdYKb9b1pNc,20200318,5325,I like snarky pups. I can't wait to hear. I'm sorry. Okay, I think we're waiting for these people to set up the thing. Hold on.  One second. I'll be back.  Same to be honest. I also never knew you went to music school.
KdYKb9b1pNc,20200318,5346,Oh shit, some guy in my subreddit was like, Destiny gave these cringe fucking takes about how Hiden's music was simplistic.  and he's such a fucking loser.  He thinks his low-fi hip hop is more intricate and complicated  than fucking Mozart.
KdYKb9b1pNc,20200318,5359,Like dude, he needs to fucking slow your roll.  I ban that dude so fucking fast.  Hold on, I'll be back one second.  Here's another life tip.  Do you ever have a lot of trash collecting at your desk?  You know what?
KdYKb9b1pNc,20200318,5388,When you stand up, just take one, just take one container with you.  Just take one thing and throw it away. You don't have to do it all. Just little by little piece by piece. Make it a habit. Okay. There you go. All right.
KdYKb9b1pNc,20200318,5422,No.
KdYKb9b1pNc,20200318,5452,you
KdYKb9b1pNc,20200318,5512,of mercury destiny more like crustony.
KdYKb9b1pNc,20200318,5542,you
KdYKb9b1pNc,20200318,5572,you
KdYKb9b1pNc,20200318,5602,All right guys, are you ready?  It's time for your favorite goddamn D&D session, okay?  Empires.  I'll be right back.
KdYKb9b1pNc,20200318,5633,Destiny, why are you all linking Rajaship? Oh nice cute  Did you see all the Chinese couples getting out of quarantine and immediately filing for  divorce?  That's the truth, I would be fucking late.  Okay, be back one second.
KdYKb9b1pNc,20200318,5687,you
KdYKb9b1pNc,20200318,5717,Whoa, whoa, whoa.
KdYKb9b1pNc,20200318,5747,Waiting for them to set up the Zoom call.
KdYKb9b1pNc,20200318,5777,you
KdYKb9b1pNc,20200318,5807,you
KdYKb9b1pNc,20200318,5837,you
KdYKb9b1pNc,20200318,5867,you
KdYKb9b1pNc,20200318,5897,you
KdYKb9b1pNc,20200318,5927,you
KdYKb9b1pNc,20200318,5957,you
KdYKb9b1pNc,20200318,5987,you
KdYKb9b1pNc,20200318,6017,you
KdYKb9b1pNc,20200318,6047,you
KdYKb9b1pNc,20200318,6077,you
KdYKb9b1pNc,20200318,6107,you
KdYKb9b1pNc,20200318,6137,you
KdYKb9b1pNc,20200318,6167,you
KdYKb9b1pNc,20200318,6197,you
KdYKb9b1pNc,20200318,6227,you
KdYKb9b1pNc,20200318,6257,you
KdYKb9b1pNc,20200318,6287,you
KdYKb9b1pNc,20200318,6317,you
KdYKb9b1pNc,20200318,6347,you
KdYKb9b1pNc,20200318,6377,you
KdYKb9b1pNc,20200318,6407,you
KdYKb9b1pNc,20200318,6437,they really feel the  I like your home too.  I have a green room.  Oh, yeah.  The screen which by the way is the  beginning to have ever done.
KdYKb9b1pNc,20200318,6467,I can't believe you paid the ceiling green.  I'm going to switch to space.  There you go.  Thank you.  Thanks for coming.  You're welcome.  All right.  Now I'm in space.  Boys.  Dude, how are you doing, Khleibu?  Life is good.
KdYKb9b1pNc,20200318,6481,Are you quarantine?  The difference.  I'm quarantined like every day,  all day, every year.  Exactly.  My life has to change at all.  Yeah.  It's like, I like you.  I like all the time now.  Like for me, it's like, Oh, dude, you can't go outside.
KdYKb9b1pNc,20200318,6498,You have to stay in and play Path of Exile.  And I'm like, just same as every day.  That's the best thing about this.  Is that now like to live room and just eat is enabled to feature, like leave a door.
KdYKb9b1pNc,20200318,6507,I don't even have to see people anymore to pick up food.  It's even less interaction.  That's fantastic.  Holy.  I'm not gonna lie, driving around LA  has been a fucking just, oh, bliss.  Like I can move like, it takes me like a minute and a half
KdYKb9b1pNc,20200318,6528,to go a mile now,  as opposed to like five or six or seven minutes sometimes.  Like drives it would take me an hour and 25 minutes.  I can make him like 25 minutes.  It's unreal.  This traffic a lot less.
KdYKb9b1pNc,20200318,6537,Yeah, no just insane.  And then coming back, like I feel like I'm driving  in a normal city.  There's like a little bit of traffic at the lights.  I feel like I'm in Omaha, Nebraska again.  There's like cars, but it's like normal.
KdYKb9b1pNc,20200318,6546,You know, there's like, oh my God, it's so good.  Oh, I love it.  But like awesome.  Yeah, they still drive like LA drivers though,  even though it's like small traffic.  So shit is getting done.  People are turning left.
KdYKb9b1pNc,20200318,6556,It's good.  I like LA drivers.  Okay.  People make fun of the way people drive in LA.  I don't like the way people drive in the fucking Midwest.  Okay.  Or in the fucking South.  Holy shit, Florida is crazy.  Or at least Miami is.
KdYKb9b1pNc,20200318,6566,But like, yeah, everything is just smooth as fucker.  The airport, there's nobody I walked through  There were more security people than there were fucking customers. I love that I went right to the front of the line got through security immediately
KdYKb9b1pNc,20200318,6576,The plane I had a whole road to myself. There were no motherfuckers on that plane. Oh my it was just amazing if this is apocalypse  Huh?  Not that I would ever champion that let me be very clear twitch
KdYKb9b1pNc,20200318,6588,Not that I'm saying that anybody because I don't want to catch one of these bullshit random fucking bands that are going through this site  No, holy shit. Can I get F's in the chat real quick for Casey Tron? God damn. She'll be back. Hopefully
KdYKb9b1pNc,20200318,6600,There's no way you'd think so right, but oh my god  Pretty smoothie. Yeah, yeah  Virus is the real deal, I guess  Hmm  How are you Trump?  What's up?  Well, you know what? I think the virus is a little...
KdYKb9b1pNc,20200318,6622,It's not all good news of the virus. I had to cancel one of my board game meds, so that's a bummer.  Didn't you do it online? Is that a...  Steven game?  Yeah, yeah.  And I'm doing other board games too to make up for it.
KdYKb9b1pNc,20200318,6636,But, you know, this is serious stuff. I have to not play board games sometimes.  Well...  Well, what are you gonna do about it?  I don't know, man.  I still have to play more computer games.  My people tell the same story.
KdYKb9b1pNc,20200318,6655,Dude, my business has completely changed.  I had to take an entire day off to work for the agency today, which I almost never have  to do because everybody's moving all their marketing plans to digital because they're  not doing anything in person anymore.
KdYKb9b1pNc,20200318,6669,So they're all calling us up and asking how to do it.  So I'm like busy as fuck suddenly.  I thought that we were gonna be slow, but it's weird how some businesses they like go down  and other businesses are inverse.
KdYKb9b1pNc,20200318,6682,Like we're trying to help a bunch of local businesses with marketing right now because  they're having so many problems with getting anybody in the building or even to order from  it.  It's crazy.  Well, because we're in center of Seattle where basically everything kind of started,
KdYKb9b1pNc,20200318,6697,I guess, in the US.  Yeah.  this  rooms while  said  there were no way in there told a failure of house and housing in other  because they just came from um...  grand canary or something like would you know would
KdYKb9b1pNc,20200318,6719,could be good crazy um... fucking shit they're doing in the u.s. for screaming  people when they come back  yeah when i came back from them because i was just in sooten and  I was coming back to the United States at the front.
KdYKb9b1pNc,20200318,6731,They asked you if you've been to any of the European areas or China, any of the affected  areas.  And then when you tell them, like I had to tell them I was, and then they sent me through  to like the extra screening area.
KdYKb9b1pNc,20200318,6741,And the security dude asked me, like point blank.  He was like, do you feel sick?  And I was like, no.  And he was like, okay, welcome to America.  I was like, oh, that was it.  What the fuck would have happened if you answered?
KdYKb9b1pNc,20200318,6751,Yes.  I don't know.  I just thought it was funny how easy I got it.  I was ready to be quarantined for like two days.  Like fuck, I'm fucked actually.  then um they probably have like a secret door and like the fucking special forces comes out
KdYKb9b1pNc,20200318,6762,yeah  ex-kater on the spot  Like in China the lever he pulls the floor opens underneath you and you're like a  It's like a coin-boost style dungeon dude like if they have a green dragon pops out of the piece of his breath left
KdYKb9b1pNc,20200318,6778,It's with a litty. It's 40 feet 20 or whatever yet  like  Kind of they got those loudspeakers that are like do not leave your house. It's crazy shit like that  Well, shall we um hop into game maybe we're down. Yeah, let's do it. Okay, we're not even in combat. This is great
KdYKb9b1pNc,20200318,6803,finally  All right, where last we left our party was about to speak with the dwarven thing  I  Recall correctly yes  Is that true  Isn't it true I believe it to be true  You're always hard when we miss two weeks because we need to do like a recap for the audience because a lot of people come in
KdYKb9b1pNc,20200318,6827,And they don't know what we're they don't even know what we're doing. They're just like I agree  Let's do a recap for the audience  Go for it Devin you got this shit. Oh fuck  I'm like, I'm like, I'm like super Alzheimer's.
KdYKb9b1pNc,20200318,6843,So I'm like the worst person to do this.  Okay, I know that we were led through an area.  We were all blindfolded to or not all of us, but the humans are blindfolded.  We walked through so that they couldn't see anything.
KdYKb9b1pNc,20200318,6851,I think we were walking to the thing guy through the mountains or whatever.  Right.  We arrived at him.  I don't remember if we were about to have our conversation and then we cut it off or what.  We left on a cliffhanger of some kind where they said we were looking for permission to
KdYKb9b1pNc,20200318,6871,go through to go into the tunnels so that we can free up the area between is it on?  Are you?  Are you?  Up there?  And and Yaka because we're trying to we're trying to clear out those tunnels so that we
KdYKb9b1pNc,20200318,6890,we can establish a trade alliance between those two places, right?  And to do that, we had to go to the thing and ask him for something.  What though?  Just to ask whether or not we can set that up since he's the leader of all
KdYKb9b1pNc,20200318,6907,these mounts. Yeah. OK.  Yeah, we've got to give the OK for you guys to go clear out those tunnels and  re-establish that trading base.  Right. And then we are going to do some work with  all the dwarves and like get some trade going between those two places because this is a this is an empire building campaign
KdYKb9b1pNc,20200318,6924,What we're trying to do is we're trying to unite this big island  We're on and we're trying to make it into like one big capital  And then we're gonna make like a bunch of empire based decisions on that and it's all to fight a really big monster
KdYKb9b1pNc,20200318,6935,That lives in the sea called the Kraken  And we build one great wall around our empire  What we're covered we have ocean on all sides of us why we need to build  We don't know what else is out there
KdYKb9b1pNc,20200318,6947,there. Well, I imagine if anything else is out there, it's  gonna fly in which case a wall probably would be very effective.  No. Can we call it the greater wall? The greater wall of  Arcadia. And we'll have Trump as our leader. Exactly. Can
KdYKb9b1pNc,20200318,6963,try to build the greater wall. I was thinking I was like, I  waste the money. Sorry for the aside, I was thinking I was  like, did your brand change significantly when he became  president. No, it didn't. Let's start the campaign.
KdYKb9b1pNc,20200318,6982,All right. So you are about to meet up with the dwarven  fame. The other thing you got to get from this dude is this  is acts. Right? Yeah. So you were brought into the great  Your position here is to negotiate access to Langport,
KdYKb9b1pNc,20200318,7003,which is that dwarven outpost right here  that would allow you to easily move from  Yaka to the dwarves and then theory out here  and then over here and then over here.  You added mountain names, thank you.  Yes, every mountain is now named just for you.
KdYKb9b1pNc,20200318,7020,Ah, except the one in the top right  that we don't know what's called yet.  No, they're all named.  You might have to scroll to see the name somewhere.  Oh, except for the elven one.  Yeah, elven name is missing.
KdYKb9b1pNc,20200318,7033,So you were brought before the Dwarven thing.  Does anyone remember his name?  Oh.  Oh.  Does that mean we asked who his name was  in order to get in here?  Einhart Blue Steel.  No, that was the name of the other dude, right?
KdYKb9b1pNc,20200318,7050,That's the king that disappeared, you know,  a couple hundred years ago.  He never gave us his name.  Yes, you did.  Well, well, well.  Grim gore.  That's the one.  Wait, what?  Oh, nevermen.  I just have 400 IQ.  Yeah.  Thank you, McSack.
KdYKb9b1pNc,20200318,7068,You need 400 IQ to read which.  I was like, what?  I did not open, dude.  I don't know what you're talking about.  Grim gore blue steel.  He has promised you an axe.  And you are about to promise him that you're
KdYKb9b1pNc,20200318,7081,going to, for of you, slay anything that might be in the way of opening this new  Dwarven mind.  Nougat.  Most things.  Post.  Anything, right?  Anything.  Well, not slay.  Just get there.  I don't like your idea of anything.  We can, right.
KdYKb9b1pNc,20200318,7098,I think we just have Trump kite.  How fast can a light?  Deep spawn, possibly run.  Right.  Deep spawns and Portias.  Oh, yeah, that too.  We have to, well, we have a lot of things to promise.  Yeah.  You have a few quests going on right now.
KdYKb9b1pNc,20200318,7111,You've got the get the dwarven hammer to unite all the dwarves.  That seems to be maybe a little bit pushed out though.  There is open the passageways to allow trade with IU.  There is collect the spell books that are the brass plates.
KdYKb9b1pNc,20200318,7130,There's get that nymph, but all they've done on that so far has been given an amulet of  what was it called?  that's supposed to like silently judge everything you do and let the elves decide  based on your actions whether or not you're good enough people to help supply this.
KdYKb9b1pNc,20200318,7145,Such an element item. It's a nymph spawner. It's a nymph spawner. What it does is  that we do X amount of good deeds and when the bar fills up a nymph spawns.  That's how they would probably do it in a CRPG. Yeah. Yeah. It's an incubator.
KdYKb9b1pNc,20200318,7164,Yeah, it's like a Pokemon going  Uh-huh, uh-huh.  Or certain steps.  But it's, you know,  plotted by morality instead of, uh, stepping stones.  But it's a good thing trustworthy, not me.  We've been very good at this campaign.  There's been a lot of campaigns that are a lot worse, trust me.
KdYKb9b1pNc,20200318,7183,That is true.  And the grand scheme of D&D campaigns, you guys are as good as it gets.  I think.  Yeah, this has been, this has been,  we haven't killed anyone's son or anything.  Yeah!  No murder of children, where?
KdYKb9b1pNc,20200318,7196,Yeah.  Well, you were brought before the Dwarven saying,  Grimgor Blue Steel.  His guards are around him.  You see a pair of clerics with him.  Dwarves in full plate wielding heavy axes.  There are a lot of guards in this room.
KdYKb9b1pNc,20200318,7212,If you were to try and make a move on the sky,  you get the impression you would be dead in a heartbeat.  There are probably a few heartbeats.  They are dwarves.  It takes them a few minutes to get anywhere.
KdYKb9b1pNc,20200318,7222,They're kind of slow.  And the thing looks down upon you  and you see beside him is a long wooden case  with a big head on the end.  Like it might fit a massive axe.  But the case is closed.
KdYKb9b1pNc,20200318,7241,I say, hello Grimgore.  I did not think that your beard  could become any more magnificent.  I'm very impressed.  Your flattery gives your intentions away.  I appreciate your kind words.  Mink's keeper of Boo.  And here is Boo.  He is very glad to see you.
KdYKb9b1pNc,20200318,7271,I suppose you are here for your acts.  I have promised.  I am very excited to gaze upon the great  dwarven craftsmanship.  He signals to a nearby dwarf  who puts down his own axe, picks up the box  and walks over to you and opens it before you,
KdYKb9b1pNc,20200318,7289,revealing a massive steel axe,  superb quality, but when I say massive,  I mean, this thing is going to be unwieldy  for people that don't have enough strength.  So if you have less than eight strength,  you can't effectively wield this at all.
KdYKb9b1pNc,20200318,7307,If you have less than eight.  If you have less than 14 strength,  you have a penalty of two to use it.  If you have less than 18 strength,  you have a penalty of one to use it.  Otherwise, if you have 18 strength, the greater,
KdYKb9b1pNc,20200318,7322,you can use it with no penalty.  What's your strength?  Eighteen.  All right, that's gonna work out for you then.  The damage die on it is not D12, it is D16.  Oh, shit.  Nice.  As they open the case and you see this thing, coming with it is a strange radiance.
KdYKb9b1pNc,20200318,7346,You did best acts in the game.  But Neil, they don't make these 16 dice.  Well luckily we don't have to roll physical dice.  We have digital dice.  And you can also, there are D16 dice.  look a little funny they're non-standard but you can get them. Do we are they able
KdYKb9b1pNc,20200318,7368,to make a handle for the flame sword? What do we ever decide to do with that?  Oh, we haven't talked about them about them yet. We should talk to them about it.  We might be able to get something better or trade for some people. We have a lot to talk about.
KdYKb9b1pNc,20200318,7381,And what's that? And the hit dies the normal, right? It's just the damage die.  It's just the damage die that goes up right since your strength is so high you don't have to worry about the hit change.  The other thing that they'd like to mention to you about this axe is that it has been enchanted by one of their clerics to always produce bright light.
KdYKb9b1pNc,20200318,7407,you weren't already in this chamber,  you would see that it glows for 60 feet  in all directions with a bright light,  which is maybe good, maybe bad.  You get to figure out what I'm about.  It's got MTX?  We need a hat for it.
KdYKb9b1pNc,20200318,7426,Ask for a hat.  What do you put on?  I have a name it, Tormundrend.  the king smiles very pleased that you are so obviously thrilled with his work the item has already been added to your character sheets and don't worry about it.
KdYKb9b1pNc,20200318,7447,And, um...  Okay, so I say...  Great thing on our adventures. We found this!  And I, in a non-threatening way, bring out the flaming sword.  You draw it bursts into flame as it goes.  There is a gasp of breath from one of the apprentices nearby, one of the smaller, less experienced storms standing by.
KdYKb9b1pNc,20200318,7475,How do the High Quarix react? One's behind him.  Why don't you give me an insight check, Grub?  And I will tell you.  The usual six. Oh, but never mind. You don't know anything.  I called it out specifically about to look at the High Quarix to know.
KdYKb9b1pNc,20200318,7496,Yeah, and I have magic, but you decide.  I think that you go to look at the high clerics,  both an insight check of six.  Like the sword is sort of distracting you.  So like, oh, Claire, whoa, that sort of sucks.
KdYKb9b1pNc,20200318,7512,Oh shit.  That sounds like the clerics are kind of like.  That sounds like something I would do, okay.  Yeah.  Did they say anything?  Did dwarves gaze upon your sword?  Did you ask them a question?  I forgot.  It does not have a hilt, and we do not quite know what to do with it.
KdYKb9b1pNc,20200318,7532,We only know of its majestic power.  A fine looking weapon.  Is there any way to put this inside the axe?  Regretfully there is not.  Would this be better than the axe?  Do you live in a world of absolute, better and worse?
KdYKb9b1pNc,20200318,7562,Yeah, I do.  Things are usually asymmetrically balanced,  better or worse as usually a matter of perspective.  Would you be able to forge a hilt for this sword?  It is a doable thing.  When it is finished, we would possibly be open for trading this for another item of
KdYKb9b1pNc,20200318,7595,similar standing.  Hey, Ponderous.  Well, if we were to make a hilt on your behalf, we would have it designed differently than  if it was for one of us.  Tell us now if you wish to trade it or not.
KdYKb9b1pNc,20200318,7624,Well, if we end up trading, then you can just remove the hilt and pop another one back on.  Well, wait, hold on, just checking.  He gives you the look of like you're giving me busy work bitch  Does the can the monkeys any weapons ever or does that totally ruin everything for your characters, eh?
KdYKb9b1pNc,20200318,7642,How do you use simple weapons? I was actually thinking of the quarterstaff again  I probably should have been using it for this for this flame sword is the blade such a way that the only thing  I could be constructed into is like a like a short sword or an arming sword or something or
KdYKb9b1pNc,20200318,7656,It is the arming sword longsword that it is now and it you couldn't reshape it or change it without ruining the magic on it  You make like a double wave sword like Ruar any tension which it does it's a blunt blade because he decided not to slay anymore
KdYKb9b1pNc,20200318,7669,Well, no so like for for an arming sword does it always have to be like a strength sword or could this theoretically be like a deck sword?  No, it's gonna be a strength sword. Oh, okay. Yeah, so ideally I'd want to trade for something else useful for the group
KdYKb9b1pNc,20200318,7681,Okay, the good news though is one side multi class the fighter. I could use a longsword. Oh  Oh, army sword rather.  Would that be better for you?  If it's a magical flaming fucking sword, probably.  We should keep it then.
KdYKb9b1pNc,20200318,7696,We'll keep it for Trump.  Okay.  Everyone's gotten something cool besides Grub.  You are cool though.  Aw, thanks.  Oh yeah.  And in exchange for making a hilt to match such a magnificent weapon,  What will you offer my people?  I've been pondering about this for quite a while.
KdYKb9b1pNc,20200318,7723,A lot of different...  What are the other dwarves called?  The dwarves of Blue Mountain, right?  The ones that aren't in this case?  Other dwarves has also asked us for the great hammer.  We would like to commit to recovering the hammer in your name.
KdYKb9b1pNc,20200318,7745,And that is why we are trying to obtain as much power as possible because we have discovered that it is guarded in fact by a deep spawn  When you say the great hammer  you mean  The great hammer of blue thing
KdYKb9b1pNc,20200318,7767,Blue steel a a heart I know it blue steel  the hammer of Zorin, you have the hammer of Zorin.  We know of its location and what guards it,  and we want to help grow cover it  in order to secure our alliance and our friendship
KdYKb9b1pNc,20200318,7786,with your majesty.  Give me a check.  I  Think this is a persuasion Jack  And you need to touch me  I would think it'd be a little bit weird to do it right now inside of everyone  Oh, I could touch him
