video_id,date,start,text
KdYKb9b1pNc,20200318,0,Okay  The worst part is we almost fucking got him  Oh, I reset my gold.  Five in.
KdYKb9b1pNc,20200318,30,My uterus is killing me.  Why would you do it?  No.  It's not what she did.  It's what I did.  Are we the only land winning? I'm getting a meds with you.  Did you kill him?  You kill him?  Sorry, we're listening to some out in cringe.
KdYKb9b1pNc,20200318,49,Guys, give me the iron nukes' clip.  Which one was that one?  What we just listened to?  Yeah.  That was called Mr. Mooten the uterus destroyer, apparently.  You drew.  so  my uterus is hurting  his own hair over now, we should get this bought an active
KdYKb9b1pNc,20200318,81,rider  Oh my god dude, I almost had it too.  Oh, yeah.
KdYKb9b1pNc,20200318,121,Okay.  What does our team do when we're just having four bots?  What if I ran Nukesus?  Do you think that uh...  Hold on, hold on.  Is it the Nukesus clip?  What if I ran Nukesus?  Do you think that Koi-boo will cancel us?
KdYKb9b1pNc,20200318,139,What do you what?  What if I ran Nukesus? Do you think I'll cancel our D&D?  What the fuck is Nukesus?  I ran Nukesus!  What if I ran... Oh!  Oh, the country! What if I ran Nukesus?  Yeah!  Oh! Do you think D&D would be canceled?
KdYKb9b1pNc,20200318,157,What if I ran Nukesus? Do you think that Koi-boo will cancel us?  What if you what?  What if I ran Nukesus? Do you think I'll cancel our D&D?  What the fuck is Nukesus?  I ran Nukesus!  What are you doing?
KdYKb9b1pNc,20200318,173,Oh!  I ain't no fucking beta.  Draven in the bot lane going up insane.  Gonna kill them all.  Oh.  DUNDINGEE! HE DOTS ME!
KdYKb9b1pNc,20200318,203,Goddamnit, there's too much fucking-  He's-  UNTARGETABLE SHIT IT IN BORORBILLITY SHIT  He's be-  REMOVING THE GAME  And he's be-  He's be-  He's be-  He's be-  He's be-  He's be-  Just need to be-  Tomorrow  You'll never be able to push a button and-
KdYKb9b1pNc,20200318,212,Oh, you can't hit me.  It's so fucking stupid.  Yeah,  Yeah,  It's so fucking stupid.  Yeah,  Yeah,  God, I hate all of those abilities.  There's all so bad.  There's so many of them too.  the  one  her  total
KdYKb9b1pNc,20200318,245,He's gonna end  Run it down  Why why would I why would I know one of the great mysteries of the mean birds fuck was I doing?  What am I thinking there?  Nice.  Or legit just fucking anti in the whole fucking game way.
KdYKb9b1pNc,20200318,272,Alright, I'm just gonna wait and stock up with you.  Yeah, that's good.  Alright, Warwick is a brain dead fucking papaga.  Go, five men.  I'm waiting on you.
KdYKb9b1pNc,20200318,313,You initiated it?  Yeah, a normal work be able to do more damage than I can.  that's a good all  you don't have a  okay what are you why are you pathing  way ,
KdYKb9b1pNc,20200318,344,a  if  a  change  that  Rugged .
KdYKb9b1pNc,20200318,381,Okay.  Moot, why are you fucking killing the CS?  Alright, I'm here.  Okay, just you and me.  There's four people here.  We're not gonna fight though, okay?  Can I have one? Oh master? Sure.
KdYKb9b1pNc,20200318,414,Yeah, so you're trolling me. Okay. Good troll, Mooten.  Okay, just defending mid. Okay, can I go in or no?  Yes, on her you can. If you think you can hit her with the ult,  without her jumping away.
KdYKb9b1pNc,20200318,444,You heal up? I'm gonna go.  Yeah, yes, yes, yes. I don't have it up.  Yeah! Fuck it!  Caitlin's there too.  Are you fucking kidding me dude?  Oh, thank God she got okay, let's go  It's baron time easy easy 20 minute Baron
KdYKb9b1pNc,20200318,478,Yeah  Oh my god, top of the morning to you, Kled, I forgot I had one of you on my team.  They're just like jacking off fucking top.
KdYKb9b1pNc,20200318,511,Wait! Top of the morning!  Y-You wee lad.  Haha!  Ready then!  When does the narwhal bacon eat now?  Oh dude good meme.  Moot you and me brothers who are lovers okay ready
KdYKb9b1pNc,20200318,542,Okay, come back come back come back yeah our team is okay, okay right here  in my stream there. Any- any of your hair follow me follow me follow me. Nice. Tell  him if he cares as you again. He should have known. We have 14 deaths okay let's go
KdYKb9b1pNc,20200318,565,We ran it about a bit.  one  of the
KdYKb9b1pNc,20200318,597,Oh, my monitor went all the way down.  Oh, from slamming.  Now is the other one, chat.  Nice flash.
KdYKb9b1pNc,20200318,630,What?  Our clan has zero assists.  Nothing in the world pisses me off more  than not participating.  Come here.  You have this now, Zeke's.  You know what that does?  Is there more attack speed in life speed or something?  No, it ignites your to deal.
KdYKb9b1pNc,20200318,651,I don't know if it does something.  It's up Stephen hope you're okay  I'm here nice  Fucking alt moot good job  oh  That's the sound they make when they can't be targeted
KdYKb9b1pNc,20200318,681,it he over the wall and get her yeah I'm going oh wait what okay let's just  back, which is back, but they're there. Wait, if they keep coming, unless. Oh, wait, hold
KdYKb9b1pNc,20200318,718,on shins here ready kinda  ah ready to end  my bin  what do we blame for that one we know we don't make mistakes so it wasn't us  Jeff. Good thing Ben's on up. Oh, we have to get the next dragon.
KdYKb9b1pNc,20200318,754,What?  He's about to eat!  Yeah, no shit, dude.  He's one and three and zero.  In a game with over 60 fucking kills.  Oh sorry, 57.
KdYKb9b1pNc,20200318,787,Moot get in there.  Moot ready?  Ready?  Oh wait, here you wasted his ult like a fucking moron so.  Do you have Moby's?  Yeah, I do.  Go ahead and run him down.  Fucking turn on.  What a shitass game dude.
KdYKb9b1pNc,20200318,812,I don't know what to do when you have a one in four clean I think the most important to do a row  We ran down the bottom.  Nah, I think it's jungle.  I think jungle is like the role that you have to have.
KdYKb9b1pNc,20200318,829,That's like the most important one.  They come to objectives.  They even Darius, he's like unironically platform.  It's like fucking like it's so much easier when you do it with a jungle.  And they got to the...  And they like by far like over the first 15 minutes have like so much control over the
KdYKb9b1pNc,20200318,841,game.  It's insane.  are controlling the game on their own like the jungle is.  i think we can win the fizz is really fucking fed
KdYKb9b1pNc,20200318,883,the problem is the fizz is fed the only person who is a lot but we are ready  shut down katelyn  but it may be doesn't matter in this game the problem i was like you know  she didn't kill her that's pretty good and then the hecker is the next problem
KdYKb9b1pNc,20200318,893,which is really do much about  nice all warick you're very very good  Hi, do you want to do?  How do you?  Can you make fun of how many chromas?  No, man.  The answers now.  Can I read who what?
KdYKb9b1pNc,20200318,919,Nothing. Nothing.  This loser fuck-clad who's 1-4-0, actually, another one.  Fuckin' DC'd.  What a worthless fucking cunt.  Holy shit.  If you get two more assists, you'll have this meme's fine.  Give me three more assists.  For how many chromas they have, chat.
KdYKb9b1pNc,20200318,945,Oh yeah, eight plus three is still 11.  Okay, I'm running it up.  Running it down top line.  I want to play a champion with like massive speed boost in like massive fucking dashes.  Maybe I should just play like a calling and shit.
KdYKb9b1pNc,20200318,968,Oh, home to see you again.  Should we come again, man?  five head skill champion
KdYKb9b1pNc,20200318,1019,Just put billy on I should you're right  Okay, I'm moving stuck on my we're gonna win this one, okay?  Yeah, come here.  I told you to get in with my knife.  Gets the reports out, baby.  Ha ha, I've let it know.
KdYKb9b1pNc,20200318,1051,Let's go around here. Oh, oh, oh, oh, oh  Coming and Cooney  I'm going to Caitlin back here  I'm like permafuckin whatever.  I hope that Clyde has bad luck for a hundred years.
KdYKb9b1pNc,20200318,1087,100 years of bad luck on him.  And the Warwick, fuck him, dude.  falcon  wave
KdYKb9b1pNc,20200318,1117,That's kind of shit, it was close.  I'm gonna play some card.  I'm gonna chat politics for a second.  I gotta do D&D in like an hour or so.  It was fun.  Have fun.  Have a good one.  Wait.  This guy.
KdYKb9b1pNc,20200318,1146,Local  Check his pin tweet you've seen him before.
KdYKb9b1pNc,20200318,1188,Wow, how edgy.  the  the
KdYKb9b1pNc,20200318,1222,I'm fucking need to get food. Does Uber Eats work right now?  Flat in the curve travel only if necessary. Okay, cool  Uber Eats is free delivery for local food, really.  How do I get to Uber Eats from Uber?
KdYKb9b1pNc,20200318,1250,Oh, order food.  Please, I need a Chipotle.  El Pollo Loco.  Oof.  No.  Panda Express.  Fucking no, what a god of a shit ass restaurant, people that over-height Panda Express are the fucking worst.
KdYKb9b1pNc,20200318,1299,Wait, you don't think Chipotle is closed down right now, do you?  the  order to pull it to their app or door dash i don't know if it's has a way i have to download it  Oh, a chili Mexican girl, okay.
KdYKb9b1pNc,20200318,1321,All right, burrito bowl, chicken.  Rice, brown, beans, black toppings, we get  the red chili sauce that was at the quote unquote hot one  The heat of veggies.  Add to order.  $7.30
KdYKb9b1pNc,20200318,1355,And in your room.  Wait.  Oh, well, well, well. Hello.  Hold on.  I'm really mad right now.  Chill, hold on to your madness, okay?  Don't beat your man.  Your tip is under the core of one hour after delivery.  I'll give him four dollars, so he doesn't fuck my shit.
KdYKb9b1pNc,20200318,1377,Hold on.  Or I need some goddamn Chipotle, okay?  That's a priority, I don't blame you.  Thank you.  Okay.  Place order, why can't I not?  I
KdYKb9b1pNc,20200318,1410,Spent a rival 20 minutes hell fucking yes  Okay, I have to go down in 20 minutes to pick my food, okay, okay, all right  right? Pixie, we're treating some real crazy stuff. What's going on? Talk to me.  Okay, to start to under Sam, where I'm coming from, like, we have to start from the perspective
KdYKb9b1pNc,20200318,1432,of like, I guess history, right? And I know that we talked about this in the last podcast and we  disagreed. But I truly believe that right now the closest, like the closest point in history,  America has ever been to like right now, like the closest parallels is seen like in 1920s, right?
KdYKb9b1pNc,20200318,1451,Where you have big economic differences between like rich and lower class, where you have like,  you know, a great depression recession, where the world, you have rising ideologies of like  fascism and authoritarianism, and where at least in the US, what I think like curved out or didn't
KdYKb9b1pNc,20200318,1470,and let it take place was a whole implementation of like FDR's policies that I think today  would even be considered socialist just because of how much like the term socialist has kind  of shifted in a sense. So I look at what we have now and I get really scared because
KdYKb9b1pNc,20200318,1489,I think you know I think Donald Trump has fascist tendencies. I think that he does talk  about a lot of nationalist rhetoric. He blames minorities, Hispanics, specifically targeting them.  Same time, the whole idea of this powerful enemy at the same time is all-powerful but all-weak.
KdYKb9b1pNc,20200318,1511,He sees them, I would say, as degenerates. I look at the recent Donald Trump policy that he put  into place where he suspends evictions and foreclosures, which is like a policy that  not even Obama took into place in 2008, right? So this is considered what I would consider
KdYKb9b1pNc,20200318,1532,like a lefty policy. And then I see, talk about implementing perhaps like a UBI. And  I think like, yeah, if you have a, you know, candidate that's about as like nationalism,  Now suddenly passing a couple of lefty policies that I would go as far as to say considered
KdYKb9b1pNc,20200318,1553,populist that the Democratic establishment did not pass, then you're going to have populists  who used to be for Bernie Sanders, right?  Because they're like Bernie Sanders with a lot of populist policies as well, who care  more about populism than progressivism.
KdYKb9b1pNc,20200318,1568,So I think those people are going to be much, much more inclined to vote for fricking Donald  Trump than for Joe Biden.  That's really scary to me because I think like,  Trump is honestly a pathway to fascism.  So that's where the new comes.
KdYKb9b1pNc,20200318,1583,So, okay, so a few things to keep in mind  so that we can kind of be a little bit careful  where we're, where we're,  where the comparisons that we're drawing.  So my understanding of the Great Depression  is that the entire world's economy lost 25% of its GDP,
KdYKb9b1pNc,20200318,1601,that it was like an unimaginably horrible thing.  Yeah, whereas by comparison, I think 2007 was like a couple percentage points  It was definitely bad  But nowhere near the level of economic  destitution that the Great Depression left us  2007 was like that
KdYKb9b1pNc,20200318,1620,And GTFO and GTFO right now  I don't think that this coronavirus is gonna be like that. It's gonna suck for a while of course  But I mean maybe we'll get there. We'll see  I'm sorry 2008 not 2007  First thing to keep in mind, in terms of like suspending foreclosures and whatnot, Obama
KdYKb9b1pNc,20200318,1638,took a ton of actions, including TARP, to kind of make it so that the economy doesn't  completely and totally die during the 2008 financial crisis.  It wouldn't really have made sense to suspend foreclosures during that crisis, though,  when the crisis was literally a housing crisis.
KdYKb9b1pNc,20200318,1655,Like overvalued property and everything was like a huge driver for what actually caused  everything to collapse.  sure if the government intervening on behalf of people  to stop those properties from work closing.  I don't know if that would have been a good idea or not.
KdYKb9b1pNc,20200318,1668,I'm not sure.  In terms of implementing UBI, I don't think Trump is going  to implement UBI.  I think he's probably just going to do a one or two time  cash stimulus, which I mean, even George Bush did that.
KdYKb9b1pNc,20200318,1681,That $600 check rate, whatever that went on to everybody  for that stimulus.  And I think, was cash for Clunkers?  Was that under Obama?  I think it was.  You're a little young for that, but I  I think I remember that we basically could take like any old car and and trade it in for like like it was a lot of money
KdYKb9b1pNc,20200318,1694,I think I don't remember what but it was to get old cars off the road  So I mean like people have like implemented these types of cash transfers before they're not completely unheard of  Yeah, I don't think that Trump is like doing some like I don't know to call Trump's economic policy like lefty
KdYKb9b1pNc,20200318,1706,I guess like you could call it lefty strictly speaking maybe but definitely not progressive in any sense of the word  I don't think so I don't think there's a huge worry that like  like progressives are gonna vote for Trump
KdYKb9b1pNc,20200318,1717,just because, you know, he's trying  to keep the economy afloat.  So there's a couple of things here, right?  I get like earlier on, I was like tweeting,  I definitely got confused with the word like progressive  and like populist, right?
KdYKb9b1pNc,20200318,1730,So my argument is not that progressives are suddenly  gonna start voting for Trump,  as much as it is that the populist who used to align  with like Bernie Sanders because of his populist policies  and used to align with like progressives
KdYKb9b1pNc,20200318,1743,are going to see what Trump is doing and then go for it.  I think, yeah, it really depends.  I think if it's a one or two time cash stimulus,  I don't think that's going to be enough  to declare a populist policy.
KdYKb9b1pNc,20200318,1758,But I do think if it is implemented,  I was like, I don't want to say standard thing.  I don't really know the right word for it.  I'll use standard because I can't think of another word.  As a standard thing, then I do think it's something
KdYKb9b1pNc,20200318,1771,to maybe worry about.  I mean, if that was the case, then that would be a win then.  I mean, strictly speaking, there's two ways to look at it.  It's one, you would be forcing the current president  to endure some form of what we would consider
KdYKb9b1pNc,20200318,1782,a left-leaning economic idea, which would technically be good.  And then two, I think something that's more important  than that.  I don't think that there are that many hard-line populists  that are voting for Bernie.  I know that online, it seems that way,
KdYKb9b1pNc,20200318,1795,that there's a lot of socialists, there's a lot of populism.  I think that the main, like, Bernie shared  a huge coalition of voters of working class,  uneducated or lack of education, people that with Biden,  like Bernie Biden shared that coalition of voters.
KdYKb9b1pNc,20200318,1810,I don't think that all of these people  are like insane populists that are ready  to just vote for Trump.  I think that's, yeah, I don't think that'll happen.  That doesn't seem to be the case at least.  You're right that I'd have to look at the numbers,
KdYKb9b1pNc,20200318,1822,like Bernie and Biden and supporters that overlap that way  because like I'm kind of, I guess still stuck  in like 2016 logic.  I just sent you like an article  about like Bernie supporters like in key states,  like key swing states that voted for Trump.
KdYKb9b1pNc,20200318,1837,But you're right that I would have to look at  Biden Bernie supporters and where they overlap.  Sure. And I mean like Bernie,  so this article has to do with the title of this article  is The Bernie Voters Who Defected to Trump
KdYKb9b1pNc,20200318,1847,explained by a political scientist.  So these Bernie voters did defected Trump.  But one thing we have to be careful of,  and now we have a little bit more information  because of how the current primaries are around,  we don't know if these voters defected to Trump
KdYKb9b1pNc,20200318,1858,because they had a populist band  or because they were anti-democratic party or whatever,  versus how many of these voters just really  didn't like Hillary Clinton, who was a super-ultrated politician.  Because states that Bernie, either won overwhelmingly  last time, like I think Washington or Michigan,
KdYKb9b1pNc,20200318,1875,or like Rust Belt states like Michigan,  he lost pretty handily to Biden this time.  So it seems like maybe it was less about populism  and maybe less about that type of political ideology.  And more just, Hillary Clinton was a deeply unpopular politician
KdYKb9b1pNc,20200318,1888,due to the years and years and years of relentless attacks  on her by the FBI, by the media, and then  by Republicans in Congress.  Then, yeah, I definitely have to retake that into consideration  to decide if I still keep my standpoint or not.
KdYKb9b1pNc,20200318,1909,I don't know exactly how we find the numbers  until after voting about the amount of people  who like defected from like Bernie to like Trump  or kept with Biden.  Well, I mean, even if they did, like what's the alternative?
KdYKb9b1pNc,20200318,1922,I mean, it's not like, I mean,  some people that were going to vote for Bernie  will probably invariably vote for Trump.  I mean, I'm sure it's the same.  A lot of Yang supporters will move too.  And in some percentage of voters
KdYKb9b1pNc,20200318,1932,from everybody else will probably move around.  But I mean, that's just the nature of a primary system  and the nature of the elections.  Like some voters move around,  like there's not much you can do about it, no?  Yeah, no, it's just my biggest fear
KdYKb9b1pNc,20200318,1942,is that the whole idea of passing populist policies  that are appealing to the left is going to bring  voters who were populist who used to align  with progressive ideals to the other side.  That's, I guess, my biggest fear.
KdYKb9b1pNc,20200318,1959,Yeah, that's definitely possible.  But I mean, what are you gonna do?  A populism is brain rot.  I mean, I've said this over and over again.  It's one of the reasons why I caution people on the left  that kind of push for this anti-id-pol,
KdYKb9b1pNc,20200318,1970,anti-liberal, in-Paul ideology is pretty scary,  because when you start throwing away stuff like,  all identity politics are all intersectionality,  it's pretty easy to go either hard left or hard right,  if literally the only thing you care about  is economic policy.
KdYKb9b1pNc,20200318,1984,It's possible that Trump could implement a few things  that deceptively appear left-leaning.  But the reality is, is that new conservatives  aren't really hardcore married to capitalism.  Tariffs, that's a highly anti-capitalistic idea.  Locking down the border,  that's a highly anti-capitalistic idea.
KdYKb9b1pNc,20200318,2001,I don't think that Trump is a hard line capitalist.  And I think that he'll pretty easily implement  these different types of left-leaning policies  if he sees them as popular ways to win an election.  Well, yeah, then the question is like,
KdYKb9b1pNc,20200318,2011,to me then the foremost priority is convincing  Biden or establishment Democrats or whoever it is,  like trying to warn them like,  hey, you know what, like this can be like a real threat  if this happens.  Like you should-
KdYKb9b1pNc,20200318,2024,What's happening, Nick and do?  I mean, it's Trump is president right now, right?  Well, no, no, but I mean, like the whole idea of like,  you know, maybe it would technically be all talk,  but trying to adopt those policies as well.
KdYKb9b1pNc,20200318,2036,Um...  I mean, I'm pretty sure every Democrat is like,  Biden has his form of universal healthcare.  Biden has his form like 15 an hour minimum wage.  Like, these are policies that I'm pretty sure  Biden's administration would already be willing to do.
KdYKb9b1pNc,20200318,2047,I didn't Biden himself, did he tweet out anything  about the cash transfers about like a 1000 a month  UBI thing or something or...  Not from what I saw.  Okay, I mean, I'm pretty sure that like any mainstream  Democratic politicians should be on board with this. I mean they all happen. I mean there was even home refinance except under Obama
KdYKb9b1pNc,20200318,2062,Like it's unlikely that Biden would be unwilling to consider any of this  Okay, well, yeah, I guess that's it. Yeah, that's a good argument. I just like I'm just nervous  I  Guess like what matters to me the most is that yeah either
KdYKb9b1pNc,20200318,2080,Makes it more clear or tries to I guess campaign more on those fronts  Well, he can't campaign on the ultra progressive fronts because those fronts are loser policies  for winning elections, right?  Like we can't just because we're like regardless of how we feel about how the primaries turned
KdYKb9b1pNc,20200318,2096,out, like Bernie got crushed.  It doesn't make sense that Biden would now adopt Bernie's entire platform when he got  absolutely annihilated.  Well, I'm not saying to, okay, I have to refine the numbers of healthcare because like I remember
KdYKb9b1pNc,20200318,2109,like at least in Michigan, the people who pulled out did agree with universal healthcare.  But the problem is like nobody really knows what universal care means like even today  We pull on it like nobody has any idea what that entails
KdYKb9b1pNc,20200318,2119,I think there was a KFF poll that came out showing that like there's a million different ways  You can ask the question people still don't know like what exactly it entails hold on give me like two minutes  I gotta run out of my food. Sorry
KdYKb9b1pNc,20200318,2135,Hi GG how y'all doing?  and how's your day? I'm gonna I'm gonna go full-griff now. I'm gonna convert you guys.  reasons very straightforward.  Oh fuck tankies.
KdYKb9b1pNc,20200318,2169,Go.  You guys are going too fast for me to read.  I'm fucking slow as fuck.  I, you know what?  I'm just, I'm waiting to be canceled.  You know that's actually a dream of mine.  The train.
KdYKb9b1pNc,20200318,2213,What does the train...oh is that biting with like laser eyes?  What the fuck is that?  You guys are giving me a fucking headache.  Honestly, I'm not going to do the boomer meme.
KdYKb9b1pNc,20200318,2245,No, I wish I had as much confidence as Boomer Girl.  Hey Pixie, how's it going? Hi, what's this? Wait a second, let me check. Is it just  tell me? Is that I have to go scroll back? What do you mean you don't know who it is?
KdYKb9b1pNc,20200318,2260,Mind waves? Of course. Mmm, you think I'm gonna vote for fucking Trump? It sounds like  it the more you talk. I definitely am not gonna vote for fucking Trump. What? I do think-  What's going on in here?  Mind waves during the battle.
KdYKb9b1pNc,20200318,2278,Well, I just want to know, like, if you really  met populace in that instead of progressive,  when you said that, which populace are you talking about?  Because I hope you know that left-wing populism  is much different than right-wing populism.
KdYKb9b1pNc,20200318,2292,Is it?  They function in similar ways, but they value different things.  Right?  I'm not completely sure about that, right?  because isn't the whole idea of populism in general  is doing like, well, I guess then we would have  to define populism exactly, right?
KdYKb9b1pNc,20200318,2308,Because when I think about populism,  I think about like what's best for like  your own population most of all.  So my understanding of populism is,  populism is essentially when you have a candidate  that identifies that every establishment is the enemy,
KdYKb9b1pNc,20200318,2323,and that candidate is promising like salvation  through them and them alone basically.  like, so Trump and Bernie are both populist because Trump and Bernie both say, look, the  media is against you, the politicians are against you, the establishment is against you, and
