video_id,date,start,text
KdYKb9b1pNc,20200318,15973,work for us right now.  me and probably trumped from laying them in mailing.  I think if you transform right now, they're just going to be spraying you down from range.  Okay, so you want me to go behind you and support with spells?
KdYKb9b1pNc,20200318,15989,Probably even your cantorplay infinite flame if we're getting them one at a time,  this is going to be an easy fight.  All right, I'm going to do that.  All right, so grub, you were here.  Okay, so you moved back there.
KdYKb9b1pNc,20200318,16003,Everyone is in those positions.  I can't I also have some bad ass shit I can do if I'm if I'm spell-sporting yeah, okay?  monsters turn  The first one is going to run in start to climb up on the side of the wall and climb like over you guys
KdYKb9b1pNc,20200318,16021,Through this ten foot tall passageway to behind you  Back absolutely  from everyone  Uh, through everyone who has a melee weapon in hand.  Okay, sure.  I'll try to whack it.  What else about me?  Sorry.  Whoo!  Critical miss.  Uh, Minksk.
KdYKb9b1pNc,20200318,16048,Uh, Grub, can you hit it first?  Yeah.  What does it matter?  It's attack of opportunity.  It's got to be Minks that hits it first because otherwise Minks is a actually grub will get  an attack of opportunity because it never leaves his square, nor both Minks actually.
KdYKb9b1pNc,20200318,16061,Wait, wait, wait.  What?  Right here.  It's still adjacent to both of you.  It never left your threatening reach.  That's how attacks have opportunity to work, right guys?  But it entered it.  It doesn't matter.  You don't have Sentinel.  Or it's still there.
KdYKb9b1pNc,20200318,16075,You still have like the alarm master, whatever, yeah.  It's still in.  Right, right, right.  So it's when it walks away from your range  that it provokes the OA.  So this one calls behind you guys  without provoking the attack from Trump.
KdYKb9b1pNc,20200318,16089,This next man on the wheel.  Scamper over to here on the wall.  This one's Scamper's over here onto the wall.  This one will scamper up and over behind you guys.  This one will provoke an attack from Minks, though.
KdYKb9b1pNc,20200318,16110,With the one that's far on the right,  should have provoked at this point, right?  This one right here, no, he's still a kitty corner to Minks.  Their corners are touching.  Okay.  11 to that guy. This one down here minus 11.
KdYKb9b1pNc,20200318,16129,We done.  We done.  Give this guy it's hard to position him, but he's on the ceiling.  I'm going to give him like a heart plus to show that he's on the ceiling while  these other guys like on walls.
KdYKb9b1pNc,20200318,16142,And this one will just come here.  is this winnable?  I think we have to pull out all the stops here.  I mean, I can just piece this out.  Rob, it's time for Plan C. Plan C.  Are you sure?
KdYKb9b1pNc,20200318,16161,No.  As you guys are completely surrounded by these bugs,  we will take our break and when we come back,  we'll see the battle on the other side.  Alright, we're back in a second.
KdYKb9b1pNc,20200318,16201,you
KdYKb9b1pNc,20200318,16231,you
KdYKb9b1pNc,20200318,16261,you
KdYKb9b1pNc,20200318,16291,you
KdYKb9b1pNc,20200318,16321,you
KdYKb9b1pNc,20200318,16351,you
KdYKb9b1pNc,20200318,16381,you
KdYKb9b1pNc,20200318,16411,you  you
KdYKb9b1pNc,20200318,16446,you
KdYKb9b1pNc,20200318,16476,you
KdYKb9b1pNc,20200318,16506,you
KdYKb9b1pNc,20200318,16566,Well, everybody and welcome back to Handpars of Arcadia.  It is the party's turn.  Don't they look excited?  All right, some state storm.  Scatter, yeah.  As I go attack the back,  I try to clear path with my quarter staff.
KdYKb9b1pNc,20200318,16581,Okay, you've pushed into the space.  You're surrounded by bugs.  Make me some attack rolls.  Yep, got one on the back.  Okay.  That's what I'm looking for.  Nine will hit the one in the back, slaying it.  Great.  These two are on the ceiling and or on the wall.
KdYKb9b1pNc,20200318,16604,One's on the ceiling, one's on the southern wall.  Can we get this late to start down first?  Would you say Trump?  And they both consider it adjacent right now, tell me?  Yeah.  Okay.  I will attack the one on the wall with a quarterstaff.
KdYKb9b1pNc,20200318,16620,20 wall and we'll hit it for six points of damage.  Roll out a concave also.  There's a stunning strike on that.  Point of six, it gets a con save, four.  All right, it's done.  It is done, Mark.  Yeah, and then I jump up, mil fast,
KdYKb9b1pNc,20200318,16641,and kick the bug on the top.  I kick it right in the gut, and I try to stun it.  Ooh.  It will...  Consave pass. So the one on the top is the one that is not stunned, right?  Yeah.
KdYKb9b1pNc,20200318,16657,Okay, the one on the wall that is stunned.  Alright, and after that initial volley I go another...  I go around the bend.  Are you sure we want to do that?  Yeah, we need to know where, but...  So that the spray doesn't hit us all.
KdYKb9b1pNc,20200318,16674,No, no, no, no.  We'll get an attack of opportunity on you.  16 to hit.  No, I attack both of them, so they see you right yep. I we're holding here. Yeah, we're holding here with the seat storm  That's why we just discussed
KdYKb9b1pNc,20200318,16688,They're just gonna spray us all then they won't be able to spray in the sleep storm. No  Of course they will  They can't see  They're in our general direction anyways go for it wait are we flare have have we casted sleep storm yet?
KdYKb9b1pNc,20200318,16704,I have not we haven't but there are a lot of bugs. I don't think there's time to talk you had a whole break to chat actions  Cassie some slave storms  I  Koibu  Can can I?  Can I transform into a creature a giant ant?
KdYKb9b1pNc,20200318,16722,Yeah, I think you've probably seen giant ants before uh-huh  Because I think well they can climb on walls correct. Yeah  Yeah. So, so, so the giant spiders. I don't know which one you want. The giant  answer stronger because it's a it's HP is 80 10 plus 16. So, um, but it's AC sucks.
KdYKb9b1pNc,20200318,16741,But okay, um, I want to, I want to um, cast lead storm first. Okay. So, so I am  going to cast lead storm and the area I'm going to cast it is pretty important.  Um, but I want the AoE effect to reach out here.
KdYKb9b1pNc,20200318,16764,So we're going to center it on the end of this arrow just about.  Uh, sure.  I can't find an entry for giant ants.  Is that a standard monster?  Giant ant soldier is a 5e creature.  As far as I know.
KdYKb9b1pNc,20200318,16779,Um, it seems like he's, uh, a form acid.  Yeah.  That's the guy.  I'll link it to Pope Undisport.  There's a high angle here.  This guy's a opponent.  Yeah.  I'll link it to fibon this part  of
KdYKb9b1pNc,20200318,16811,present is the  only  Love you too,
KdYKb9b1pNc,20200318,16854,Cult of madness, total of madness.  Is this even an official creature?  I think so.  Total beast.  I don't have an entry or a stat block for this.  So I want to pull something that I do have on hand.
KdYKb9b1pNc,20200318,16871,So there's a lot of books, a lot of somewhat source material.  That's not in any of my sources.  So what can we do instead of a giant ant?  Well, there's a couple of options.  I can become a swarm of poisonous snakes and then get-
KdYKb9b1pNc,20200318,16886,You can't become a swarm.  Okay. Okay.  Perfect.  Oh, what book is T.O.B.?  Tome of Beasts?  Tome of Beasts page 23.  Well, I don't have Tome of Beasts.  I don't know if it's a...  I'm gonna skip it.  If I don't have the books and I haven't read through them yet,
KdYKb9b1pNc,20200318,16904,I don't want to start pulling shit from whatever.  It's like life or death for this fight is the problem.  If I we're gonna stick to the books that I have that I've read through that publish this spider  By the two times weaker than this thing. It's a week has sleepstorm yet. Nope
KdYKb9b1pNc,20200318,16924,chicken  Can't what can you get at least give me an idea then of something that can climb a wall of Sierra to this cool  Because I I'm like I'm fishing bro. Okay. I will dig through this  you can do beasts that have climb, right?
KdYKb9b1pNc,20200318,16942,Yeah.  We've got scene and you want something that's CR2.  Not a giant shark.  Not a scorpion.  We can't climb wolves, they're too high.  Snakes, octopus, hyena, lizard.  It's only a quarter.  Okay, go.  There's some dinosaurs like monster manual dinosaurs like an allosaurus.
KdYKb9b1pNc,20200318,16974,They don't have climb though.  Oh, okay.  Right?  That's what you want is you want the wall climbing.  Yeah, I think so.  I think giant spiders probably your best.  Actually, hold on.  Are these guys?  These guys are CR2.  What?
KdYKb9b1pNc,20200318,16990,If they're, I don't get eggs.  If they're beasts, then you can turn yourself into an on-cake.  I'm just like a, then I'm like a shitty,  there's like 80 of those and like I'm one of them.  Huh.  Well, I mean, if it,
KdYKb9b1pNc,20200318,17004,CR two, CR two, right?  Yeah, that's true.  Yeah.  Uh.  Double check, make sure they're beasts.  They are large,  velocity,  not beasts, unfortunately.  Mm-mm.  That was a good one to turn to,  and to do the AoE attack.  Yeah, it's true.
KdYKb9b1pNc,20200318,17020,Yeah.  Um, OK, I mean, I got the only thing I can do is giant amp,  but that's twice as weak.  So if that's the that's the play, that's the play.  But I mean, it has 20 HP.  I'm basically dead.
KdYKb9b1pNc,20200318,17034,What about spider then?  I mean, I just said that or giant spider.  Yeah, it's it's a what about snake then?  Look where we are.  Can't transform.  OK, so spider it is has to be.  So I will I would like a sweet storm in this area.
KdYKb9b1pNc,20200318,17052,I don't know what Trump's doing.  Like the like the runaway is not good.  OK, so you sleep storm first 40 feet wide.  You wanted to put it here?  Yeah, ish.  Is that right guys?  I think that's right.  One more in our direction.
KdYKb9b1pNc,20200318,17070,Yeah, like this one.  Does it stop chlorine from doing anything?  Yeah, you tell me you tell me where you want I'm sorry. I'm just reading the spell. Yeah  The voice of raises your surgeries heavily secured a Swiss first spells area first turns it starts there
KdYKb9b1pNc,20200318,17089,Yeah, yeah, where it is is fine now  and and  Then I will transform into a giant spider that walks on walls  Or I  I don't really have like a large it's even if I become a large creature at this point. I'm still gonna get squeezed
KdYKb9b1pNc,20200318,17109,Yeah, because it's so tight  There's creatures above you and on the walls and allies nearby. It's gonna be a tight squeeze quick question  What about that open area to the right? Can he be a snake there if he were to run over there?
KdYKb9b1pNc,20200318,17121,He could probably open up into a snake  So  Once I cast a spell I have all my movement right yep, but disengages an action. Yep  but Nimble Escape is not for goblins so I can actually I can actually disengage
KdYKb9b1pNc,20200318,17138,so you can because this is a bonus action and run over but then I have used my  bonus action so I cannot transform right the problem is we if I yeah yeah all  right okay we're just gonna declare that action is done that no we're not because
KdYKb9b1pNc,20200318,17153,I know it's really important where we move I'm not gonna move there I'm gonna  move here okay because I want to yeah and then that's it that's all I can do  Okay, next player did he provoke attacks of opportunity or no
KdYKb9b1pNc,20200318,17165,No, I didn't use him. Oh, yeah, that's why I disengaged  Okay, I'm going to be moving so this is 30 feet of what?  Wait, well, I guess you didn't start your turn in the sleep storm  But you did sort of start your turn in the sleep storm. You didn't move until after it hit
KdYKb9b1pNc,20200318,17181,So I think it is difficult to rain for you. Okay, and you will need to make a  Dexterity saving throw or full-fro  Dexterity saving throw 24 I'm good. Yeah. Can you move? Can you pause on your movement so I can
KdYKb9b1pNc,20200318,17198,Advantage on the one above me  You're not gonna have flanking on the one above you because you'd have to be on the other side of the creature  Right you have to be able to draw a line totally through it
KdYKb9b1pNc,20200318,17208,We're only looking at the 2d model, but it's actually a 3d picture  So the one above you need to be above the ceiling to get the advantage on  Okay, can I I can move here? Yes. Hello. Yes. Are we good? I get one or two attacks opportunity
KdYKb9b1pNc,20200318,17223,Who's stunned the one of the south to Sun? So I get one attack of opportunity me, right?  Yep, hit me  24 you take 15 points of damage  I wanted to I  Reduce it by the 2d6. Oh reduce me
KdYKb9b1pNc,20200318,17239,That takes your reaction to do right. Yes  Five.  So that means you don't get any reactions, no opportunity attacks, no ready to actions  during the next round.  Sounds good.  Okay.  This guy to the south, he's stunned, right?  Yeah.
KdYKb9b1pNc,20200318,17254,Okay.  Big boy attacks are coming out.  I will take a shot at him.  Okay.  So 28 easy hit.  28 to hit.  Okay.  I'm going to roll this damage here.  That's 12.  I'm going to throw a 1d8 trip attack.
KdYKb9b1pNc,20200318,17272,I guess it's loading right now. Don't know why hold on. Okay for damage with the trip attack and it has to make a strength save or fall prone  It falls off the wall and slides to the ground stunned and upside down now
KdYKb9b1pNc,20200318,17287,Exposing its tender underbelly. Okay. Can I take another shot?  yeah  Crit  You crit it and kill it and it dies. Okay, I would like to use my action surge  There's another creature here at full HP  Wounded but sure wound it. Oh, sorry. I can't there's a lot of people on the kick
KdYKb9b1pNc,20200318,17311,Trip attack it does it fall down and take damage?  What are the rules are they stuck by their feet or what happens?  You have never encountered a well we are countering it right now, so I would like to add a 1d8 to that for a trip attack
KdYKb9b1pNc,20200318,17322,Oh, okay. Roll me some damage. Seven. And the regular damages.  Um, I clicked it. Sorry. Eight. So 15 damage all day.  Okay. And it makes a strength saving throw. Seven. Bails.  It will tumble off the ceiling and land on its back.
KdYKb9b1pNc,20200318,17340,It's feet are 10 feet in the air, but its back was only like, you know, six feet in the air, so it doesn't take falling damage.  So it doesn't take any damage? No, but it does fall down.  get advantage on this way is laying on its back yes and the 30 this is added
KdYKb9b1pNc,20200318,17357,again corn yeah that's a good tree all right you will kill it  mink okay the one above me I am going to attack twice with inspiration all  right inspiration only works on the first attack roll but go ahead and take it
KdYKb9b1pNc,20200318,17377,16. Good job on the inspiration. You  flap it twice. I forgot to say I  rage. Oh no. You can rage. It's  fine. Okay. I understand that. It's  a normal thing to do.  Torment.  I have 12 plus lamp plus four.
KdYKb9b1pNc,20200318,17402,16 for 25 damage. No. 25 then.  25 damage excellent and what do you do at the end of your shirt anything yeah  but I don't have control in my character maybe I have to refresh oh it might be
KdYKb9b1pNc,20200318,17419,awkwardly positioned I should move back right now the loading make sure to spread  out man I moved as far back as I can there's I don't how much  there we are  but are you gonna be fucked if I'm in further than that this guy takes an
KdYKb9b1pNc,20200318,17451,opportunity to choose you back away doing 11 points of damage to you have  because you're actually only the slashing is halved.  So that's gonna be three and four, still seven points of damage.  If we're back too far out, there's no point to the sleep zone.
KdYKb9b1pNc,20200318,17463,You shouldn't back up, Mins.  You're in the perfect spot.  Should I just stay here?  Let's go.  Get back in there.  OK, I'll just stay here.  I was in my really dumb area.  I was trying to see how to move.
KdYKb9b1pNc,20200318,17476,I'll just stay.  OK, just gonna get super surrounded.  That's fine.  It is the OnkGeg's turn.  I'm gonna just delete these corpses down here.  Great for impactable.  One on the wall, crawls over here, staying nice and high.  See, these guys need to make deck saves or fall prone.
KdYKb9b1pNc,20200318,17498,Is that what it says?  Yeah.  Rollo cover.  Rollo roll.  Four, five.  Oh, sticks of these guys.  One, two, three, four, five, six.  Wow.  Those are my bad rolls. Holy shit  And Devin your safety is 14 so only one of these guys gets out of here without a problem
KdYKb9b1pNc,20200318,17526,the other ones fall prone have to use half their movement to stand up and  Then this is  What do you call it difficult terrain so this guy is down to?  45. Okay, 45. 35. And then he will scamper over here. He's gonna be above you. This guy is,
KdYKb9b1pNc,20200318,17553,he's used 15 plus this other stuff to get over here. No problem. He's gonna use his 15, climbs onto  the wall. This one will climb up and over. Right here.  So we can go to 20, 50, 20, and 50, 50, 50, 50. You can just barely get to there.
KdYKb9b1pNc,20200318,17582,It's there. And you little guy, if you stick to the walls,  no, you're not gonna be able to get any of these places. You're gonna have to stop  right here. Okay, so most of these people have used all of their movement. Most of these creatures
KdYKb9b1pNc,20200318,17601,have used all of their movement to get out of the sleet storm and surround you, except for this  last guy who just moved in, who will just take a regular bite at Minsk with a 24 to hit. He will
KdYKb9b1pNc,20200318,17612,do an amazing almost max damage on everything you will take half of the 15  which is 7 plus the full 5 from acid so you'll take 12 points of damage as this  oncig grabs you these other guys actually this guy can do it too but he
KdYKb9b1pNc,20200318,17627,doesn't want to spit acid on you right now this awkward and so he's not going to  and that is going to be the monsters turn PC's  Can you give me an honest no bullshit assessment if I can use the spell call whitening here?
KdYKb9b1pNc,20200318,17642,Absolutely not okay, you need to cast it like a hundred feet above you in your indoors. Yeah, okay  What if he lays horizontally and that's I'm just gonna say  Okay, I'm moving back right here provoking one attack of opportunity hit me
KdYKb9b1pNc,20200318,17656,Yeah.  Alright, we will take a new deck of opportunity on you.  Yes.  12 to hit is a miss.  I think Devin moves into the opens for intern since I think they're starting fighting  the one above.  Yeah.  Is this one almost dead right here, Kweibo?
KdYKb9b1pNc,20200318,17677,Just everything is layered on top.  I can't see that one.  Yeah.  Ed was should be.  Yeah, yeah.  That one looks maybe almost dead.  Okay.  I'm going to take one shot at it.  my elven longbow 29 to hit I will drop it it is dead it is how did you know I
KdYKb9b1pNc,20200318,17693,don't know how I know these things see this guy right here on the wall mm-hmm  I'm gonna take a shot as well with my bow 21 to hit gonna add a 1d8 to it to  knock it prone it needs to make a saving throw and then it's also going to take
KdYKb9b1pNc,20200318,17709,some damage fails fails pro wait I click the damage okay so it's taking 11  damage this guy right here is prone so he should have advantage on it if he  hits it right mix well yes so you have advantage on that one mix and then I'm
KdYKb9b1pNc,20200318,17726,gonna back up another 15 feet and I'm done okay all right here I am going to  cast I'm popping my second one too quite a bit but okay I do get second  wins back on short rests yep I do okay all right we're doing some real shit I
KdYKb9b1pNc,20200318,17745,am going to cast conjure animals oh yes and I want eight CR one four creatures  fuck so this is the problem with conjure animals is when you do eight CR one  creatures combat rounds take days then don't put things in the game that are
KdYKb9b1pNc,20200318,17765,gonna insta kill us on an on an encounter because I have no choice to do  this if I don't even out the actual economy we're dead so that it's we are  killing this so easily this is like one of the easier encounters we've done I
KdYKb9b1pNc,20200318,17777,don't understand it's not okay we're we're thinking very carefully about it  because if we like if we we so far been playing pretty well but there's and we  I also don't know if there's more behind them too.  Okay.
KdYKb9b1pNc,20200318,17790,Yeah.  It is actually a pretty dangerous encounter.  Yeah, it is.  It's right.  Conjure animals.  Imagine if we had to fight all of them.  Like without killing the first class.  If you're going to swarm us, I'm going to swarm.
KdYKb9b1pNc,20200318,17805,I think that's the world.  Sure.  It's just it's going to take a while to play out the game.  And that's fine.  That's fine.  There.  four D8.  And we'll generate macros for you.  Is that a frog?  Yep, this is a giant frog.
KdYKb9b1pNc,20200318,17833,And a cave?  Eight of them.  Hi, the token is now almost set up.  Let's just you were going for.  On 4, yeah, cool.  1, 2, he chooses the type I choose the  number, 2, 3, 4, 5, 6, 7, 8.
KdYKb9b1pNc,20200318,17860,Right.  Are you gonna summon them on me?  I can't choose what some of them he can  They in free space around you  We want to let me get to truth where they were he I don't  Can I come here? What's the last time you chose where they were area back here is too
KdYKb9b1pNc,20200318,17881,Sleepy so you can't see in it and this area is has no free spaces to conjure the creatures  I'm only open area and not to not to fuck myself  But actually the sleaze storm would cancel because I believe country animals is a cost
KdYKb9b1pNc,20200318,17896,So and the storm dies so we can summon them behind yeah, but  Yeah  Perfect and then I am going to move back and then I will transform into a giant snake  All right, you back up and become a giant snake.
KdYKb9b1pNc,20200318,17920,Roll me giant snake HP.  AD 10, AD 12.  All right, plus eight.  Okay, all right.  Okay, and I can't attack because I cast spell this turn.  So that's the end for me.  54 HP.  Do you want to go before me?
KdYKb9b1pNc,20200318,17944,For me. I will move up here real fast.  Do you intend to hit it and then come back? Feel free to do what you want.  Hit it and quit it Trump.  Okay, I'll just take my turn now. I'm gonna attack it twice with the core staff and then punch it with unarmed strike.
KdYKb9b1pNc,20200318,17963,Hit, hit.  Punch, punch. Is that thing at full health there?  Yes, it was.  I'll throw a stun check strike at it.  Alrighty.  Uh, no, it should be con check, right? It's the same thing.  Uh, it should roll 14 if it's con check.
KdYKb9b1pNc,20200318,17981,15 if it's a strength check.  Uh, 14 for the con check, just barely fill.  It's a...  No, alright.  It is stunned.  An arm strike at an advantage, that's 18 or six.  Oh, right.  And then I...  Easy.  I go back to where I was.
KdYKb9b1pNc,20200318,18001,Okay.  Okay.  I attack.  You are swarmed.  Yep.  I attack with my Darwin Grey tech twice on the one below.  There should be something that gives you advantage.  If you fight next to the Frogs.  I think there's no reason for me to attack the Stun one, right?
KdYKb9b1pNc,20200318,18017,That will lose this turn anyway.  No, no, no.  He's only knocked prone.  Attack.  Attack the one on your, right in front of your character is facing because the Frogs  because the frogs flank it.  Get advantage.  You should attack this because you only have flanking on it.
KdYKb9b1pNc,20200318,18030,While it's knocked over.  Yeah, I can kill it as well.  Yeah.  All right.  I will.  I attacked the south one.  South one gets struck.  Critically struck.  You've been rolling a lot of 20s today, I mean.  I think it's that 42 points of damage.
KdYKb9b1pNc,20200318,18045,Yeah, you slaughter it.  What do you think?  Oh, right.  Plus the rage.  OK.  and the frogs roll their own initiative,  and they come in after the onk eggs, whose turn it is now.  This one is stunned until the end of your turn.
KdYKb9b1pNc,20200318,18067,This one's dead, dead, dead.  So we have one, two, three, four.  This guy is going to spew acid in a line, sort of like that,  clipping five of these guys, I think.  I'm just gonna do one grub.  Will you give me one deck save for your frogs?
KdYKb9b1pNc,20200318,18091,I know it gets a little swingy,  but I don't want to keep track of so many things.  Yeah, I totally respect that.  Yeah.  No problem.  They will all take half damage from this.  It is 12 points of damage
KdYKb9b1pNc,20200318,18109,the evil, which will take six. You go down.  Oh, I thought they would all die.  Down. Down. Down.  Down.  Down. This guy on the wall is going to do his own acid spray through  um, he'll scramble so he can spray like these for.
KdYKb9b1pNc,20200318,18136,We'll get the top left one. Give me another dex save grub. This is 12 points of damage again.  If it fails, it passes another six to these guys. Well done. Sixty here, that one will die.  This one will take six. This one will take six. The onk eggs hiss in anger and terror
KdYKb9b1pNc,20200318,18159,is frogs around them.  Or maybe hunger?  Hunger might be better.  Yeah.  Palzodes.  Those are some old memes.  And this guy will spray these three.  Give me one more deck save.  And does 11 damage on a fail.  Sorry.  That's all right.
KdYKb9b1pNc,20200318,18185,Wow.  That's a crazy roll.  This one dies. This one lives. This one lives. Those are the  other ones that get hit. You have also used your weapon. And  this guy in here is going to wait on the one that dies. I
KdYKb9b1pNc,20200318,18205,could actually save it with because I have my reaction bike.  I know you just use your reaction. Didn't you just use  Nope, I can't remember before that. Okay. Yeah, you want to try and prevent some damage to one of these froggies. Yeah, I want to say one frog
