video_id,date,start,text
KdYKb9b1pNc,20200318,11926,What's that effect on this that is his rage effect. Oh, okay  All right, I see one  All right, I see two honk eggs turn  The next one scuttles down some steps and over towards in front of you  there's three and
KdYKb9b1pNc,20200318,11948,And then it spits acid or sprays acid in a line that is 30 feet long and 5 feet wide  Provided that it has no creature capital each creature not lying must make it you see 13  Xterity saving throw
KdYKb9b1pNc,20200318,11962,So it will  Cue  skewer spewer spew  Acid like this through the two of you. Would you both make me dexterity saving throws minks?  Of course danger sense uncanny dodge whatever it's called gives you an extra  advantage on your save. Not so care. You will both pass and you will take half
KdYKb9b1pNc,20200318,11987,damage from this. 3, 4, and 6 is 13 divided by 2 is 6 damage to each of you and  makes you'll take another half because you're raging. So you each sizzle with  the acid burning on you. This guy, I should probably mark you as acid sprayed. This one
KdYKb9b1pNc,20200318,12010,will scamper over here as well and get an acid spray. Ooh, not quite. We'll do it this  way then. We will just scamper to this tile. Nope, no, no, no, this one. And we can spray.  There is a tile where all three get hit. I'm trying to, I'm trying to take cover under
KdYKb9b1pNc,20200318,12031,that thing that's why I moved there yeah and that's why he moved here is to try  and shoot you with his acid spray but I'm like hidden underneath that the alcove  I'll give you advantage on your save you've got a wall to press up against
KdYKb9b1pNc,20200318,12046,that might be able to splash it aside good shit what's it with the three of  you give me dexterity saving arrows or suffer 10 points of damage pass pass  pass you each take five except for minx who takes two and this one has acid
KdYKb9b1pNc,20200318,12066,sprayed and the last one will come on over to here standing with its friends  and acid spray the front two of you again give me another dexterity saving throw  Just the front two.  Uh, okay.  Oh my god.  Your saves are so high.
KdYKb9b1pNc,20200318,12089,Uh, it would be five, six, seven divided by two is three,  divided by two is one for Minsk.  Heh heh heh heh heh heh.  Okay.  Alright, party's turn.  Okay.  Um, hmm.  Grub is gonna go.  Become a giant snake
KdYKb9b1pNc,20200318,12111,Up over here  Yeah, it's close enough yep, you will giant snake whoa grab us 30 feet of movement, right?  The snake has more  He transforms us what?  The snake has no 30 feet of movement. Okay. Never mind. Yeah
KdYKb9b1pNc,20200318,12133,Yeah  so here  Or here?  Yeah, we do this.  It's awkward, right?  Because you don't want to be clipping too far into there.  I guess you could maybe clip them a little bit.  You are a snake. It's fine.  I'm going to put Grub Grub in the darkness.
KdYKb9b1pNc,20200318,12150,Um, if before he attacks, if I move here,  then we're both flanking, right?  Well, I'm trying to block Grub's token from seeing anything.  Magic, give me a moment.  I don't want him to see everything.  All right, if you yeah, now you're flanking the one dude. Yeah. Yeah
KdYKb9b1pNc,20200318,12173,And I constrict it  Wait an annual HP red oh, yes, you've read yourself through the creature you have 80 12 plus eight for hit points  Fuck  Damn, that's a lot of HP  Wait, is it okay? It's not yeah, I I wrote two ones all right I
KdYKb9b1pNc,20200318,12196,Could strict it I  Don't you try to grab it  But your new shapes changed snake form is a little slow to move  We haven't quite warmed up to being a snake and the oncag just kind of crawls all over you dripping little bits of acid on your shiny
KdYKb9b1pNc,20200318,12211,Green scales  Minks flanks the oncag  Oh, I'm not kidding.  Fuck kicking for goodness.  Uh, 22, 27.  Wow.  Wait a minute, you're not bare totem warrior.  Are you?  Uh oh.  No.  You should have taken this.  Yeah.  So you're raged only reduces non magical bludgeoning slashing piercing damage, right?
KdYKb9b1pNc,20200318,12237,And also acid.  The player characters aren't the only one treating Twitch chat.  Watch out.  You should have taken the same damage as Trump.  Wait, what the fuck, guys?  You're supposed to be on our side.  I have 14.  What's going on here?
KdYKb9b1pNc,20200318,12250,Mutiny.  Six.  Man, that guy.  I have my sandwich.  Wait.  There we go.  There you go.  You should be at 40.  OK.  Yeah.  That's fine.  You hit.  I can't roll on the crit there.  Did I roll on one?  The crit rolled a 7 plus 4 and a 6.
KdYKb9b1pNc,20200318,12267,There should be an extra 16 on that one.  Roll me one.  Now you don't do extra deep crit damage to you.  That's another character, it's another campaign.  All right, yeah, so you do 20 and 17 damage to this.
KdYKb9b1pNc,20200318,12282,So 37.  Plus range damage.  37, all right, so another two?  No, four.  Okay, perfect.  Four? Okay, another, there we go.  Perfect.  Almost slangly on gag.  Okay, anyone else want to go?  Yeah, I'll go next.  So I'll move 5, 10, 15, 20, 25, and I will start taking some attacks with this one. First one.
KdYKb9b1pNc,20200318,12311,21 is a hit for 5 points of damage which slays the oncag.  and then the top 30, 35, 40, 45, 50, 55.  I think I can just keep counting.  Let me hit this next one with a little number of stripes flanking.
KdYKb9b1pNc,20200318,12331,Not quite. He would need to be here, but 15 will hit.  I'm sure, 60.  You only have 55 feet of movement.  Oh, this had my limit, 55.  You've reached it.  card. I have a 15 hits anyway.  That is.
KdYKb9b1pNc,20200318,12354,Sorry, I'm not. You crack it in the back. It's  kiteness plating breaking open slightly.  Bottom creature. I'll take two shots. Yep. It's a large  creature, so minks doesn't really give it any cover.  Both of your shots will hit for 21 damage.
KdYKb9b1pNc,20200318,12375,Right. The onk eggs, turns, roll around.  Oops, that is not the right button. We want this button.  Neither of them recharge. This wounded one hisses cries out and will take a disengage action  and scamper down this tunnel over here, running that way.
KdYKb9b1pNc,20200318,12396,Okay.  This larger guy.  Do I not get an attack of opportunity?  He took a disengage action.  To full disengage, so.  Yep, so he like backs away from you,  hissing and like scrambling up those steps,  swiping at you with his front legs
KdYKb9b1pNc,20200318,12411,until there's an opening for you for it to back out.  This next one will just come up  and bite the crap out of his eye.  With a 22 to hit,  it sinks its pincers into you  six slashing and four acid damage.
KdYKb9b1pNc,20200318,12426,Uh, I use Spirit Shield to reduce the damage by 2dc.  Ooh, go for it.  Is the music supposed to end?  Oh, it never meant it just changed.  Yeah, it's been made for me.  Roll 20 has been having a tough week.
KdYKb9b1pNc,20200318,12442,It's okay.  Yeah, you just take the four damage then.  Lovely.  And that is not the end of the onk eggs turn because directly above this spot here,  there is a hole in the ceiling.  You'll notice that this is like a lowered area
KdYKb9b1pNc,20200318,12457,with kind of a rise around it.  We probably can't see that.  A rise around it over here like this.  That's because there's additionally  like another layer above you.  And it's dropping down from that layer  that we have two more onc eggs arriving on this turn.
KdYKb9b1pNc,20200318,12477,The first one will come over here to grab Zai.  The second one will come straight for the giant snake.  It'll bite the giant snake with a 21 to hit,  eating you for 16 damage,  and the other one will go after a zai.
KdYKb9b1pNc,20200318,12491,Ooh, does it have enough movement to do that?  It's probably about 10 to get here.  Yeah, it'll actually go all the way behind zai.  Flank him and bite him from the backside.  They 19 to hit.  Yep, I think that hits for 14 damage.
KdYKb9b1pNc,20200318,12508,Oh, it's okay.  And it becomes the PC's turn.  All right, and I think you have to take out the NK  that run away.  Take out the what?  There's one NK, like south of me.  I think you have to take it out so you can't ask it's first.
KdYKb9b1pNc,20200318,12524,Okay, hold on.  I don't know how much movement I have.  I'd have to get all the way over to you, right?  You can move below me.  If you move like there.  Okay, I'm moving 25 feet.  Oh, I see him, okay.
KdYKb9b1pNc,20200318,12536,I'll take one shot to the south.  Yup.  15 to hit.  15 hits.  6 damage.  Here sits Rump and it dies.  Okay.  I am going to move here.  And I attack twice with my red eye.  Bring it forth.  You critical and you hit.
KdYKb9b1pNc,20200318,12561,for 29 plus 19 is for 29 plus 19 is then 20 or 30 plus 20 plus two is 52 damage.  That right?  Yes.  No, 54.  Right.  Wait.  46.  That's a lot of damage.  52.  Yeah.  52.  No.  It's 39.
KdYKb9b1pNc,20200318,12591,It's 52.  I just calculated it.  My trust truck is actually the most.  It's 52.  OK.  Yeah, we were at the first time.  You break it in half.  Oh, sorry.  First one cuts off the back end of its thorax.
KdYKb9b1pNc,20200318,12606,The second one splits the front of it down into two pieces.  There's no way this cockroach is still  be running around when you're done with it.  Do the other ones get like an intimidation check?  They will make morale checks as necessary.
KdYKb9b1pNc,20200318,12626,I move here and I can strike the one on the right.  You wrap yourself around him slithering in and around but the Ankiks scurries over you.  your big snake body is just too slow for these fast insectoids.  I'm gonna use this.
KdYKb9b1pNc,20200318,12645,All right, I'll just make a quick recorder staff attack,  blow one in front of me.  Mm-hmm.  Oh.  Critically it for 15.  All right, time for me to make use of my mobile feet.  So since I hit it, I don't have to take an attack of opportunity from it.
KdYKb9b1pNc,20200318,12665,I'm going to move 5, 10, 15, 20.  533, 5 right here and I will attack this thing.  Excellent.  There, one of these.  15 will hit for five points of damage.  All right, then with mobile I will back off over here.
KdYKb9b1pNc,20200318,12692,I will go over here and look menacing.  As it goes over to look menacing,  I've got one more attack I can fire because I only fried one to kill that one creature.  Mm-hmm.  22 hits home.  Well hit.  Six points of damage.
KdYKb9b1pNc,20200318,12704,Easy.  Right.  The oncigs are in maybe a bit of a tight spot.  The remaining ones make morale checks.  They do okay, especially when their friend comes down to play.  And two more dropped from the ceiling above.  Let's see.
KdYKb9b1pNc,20200318,12721,How are we going to do this?  This one is right next to Trump, so it's going to just do its thing here and attack you.  Can real quick, just so my theater of mind is working correctly.  How are these?
KdYKb9b1pNc,20200318,12735,When these are coming down the ceiling, we look up, do we see a bunch of them crawling  around up there?  No, there's a hole up there that goes to what looks to be another floor about that.  Oh, okay.
KdYKb9b1pNc,20200318,12745,And can you, is the floor like this whole thing is like a giant hole or?  But if we can see them at the moment, shouldn't it take them more?  Yeah, because what I'm wondering, if you've got them dropped down and attacked?
KdYKb9b1pNc,20200318,12760,Because if you've got like one hole right here, it's got to use like at least 10 feet of movement,  well 15 probably to go through the hole and come down and then once it's down on the ground from 15 feet of movement to like however much harder to go.
KdYKb9b1pNc,20200318,12769,Yeah, last time I used 15, 10 feet of their movement to just jump off the ledge where they were positioned at the end of the previous round.  round. The hole is about yay big right above this area.  Oh, okay, okay, okay.
KdYKb9b1pNc,20200318,12781,All right, that would have been good to see that, but okay, gotcha.  Of course, this one next to Trump makes a bite with the 15 to hit.  The this one next to the snake bites at the snake with a 15 to hit as well.
KdYKb9b1pNc,20200318,12793,That'll hit the snake though. Snake will take 11 points of damage,  and this other one that has just dropped down.  Did Trump knock a hit?  No.  Okay.  Uh...  Ah.  Yep.  And this one will kind of scurry down to this spot and bite the snake as well for 20 to
KdYKb9b1pNc,20200318,12814,hit or 12 damage.  I reduced the damage by 2d6.  Roll it.  7.  7.  So 5 and the 11 from the previous attack.  Are you marking damage?  Yeah, I got it.  Wow.  Excellent.  Player turn.  Okay, I hit once first to the one to my left.
KdYKb9b1pNc,20200318,12838,No, let me kill that.  Wait.  You crit it.  Because you have advantage on both attacks if you hit the so I should be hitting the ones.  Because I can't ever have advantage.  You gotta go and slay it.  And I'm over here and I hit the one that was attacking Trump.
KdYKb9b1pNc,20200318,12855,Mm-hmm.  19 will hit home. The axe lands for 12.14 points of damage.  I'll start wailing on the one in front of me.  Where's Staff? 5 and 12 to 17 are hits but no kills.  And then I'll finish it off with a kick.
KdYKb9b1pNc,20200318,12883,which will finish it off and it dies.  Blah.  Ah.  Then I turn tell and I screw this way.  I am trying to find  my ability that I had  because I want to eel.  Isn't it?  What the fuck?  about Wild Shape 5e. Circle the Moon. Sorry, just a sec. Okay. I'm going to construct the
KdYKb9b1pNc,20200318,12922,one that's flanked with Minsk. Good. You do. Okay. Wrap him. Consider him constricted.  And then I'm going to burn a level two spell slot to heal 2d8 as my bonus action on combat  wildshake.  There you go.  That's a bonus action.
KdYKb9b1pNc,20200318,12953,Yep.  You gain nine hit points.  Hmm.  Do you get your wisdom mod to that at all?  Uh, it just, it just says,  expend a spell slots or again,  1d8 hit points per level of the spell slot expended.  So yeah, I don't think so, yeah.
KdYKb9b1pNc,20200318,12969,All right.  Okay, so this constricted creature,  I do have advantage against those,  on those shots, right?  On over strength creature?  Yes.  All right, I believe I will be taking a double shot.  21 hits, 18 hits.  Oh wait, I'm just gonna roll another 1d20.
KdYKb9b1pNc,20200318,12987,Oh, right, right.  And then another one day 20.  Okay, so another minute, okay.  Damn it, John, oh geez, sorry.  It's like 22.  Yeah, 22.  Almost dead.  Is that all the players?  I believe so.  Oh, all right.  This guy has grappled unrestrained,
KdYKb9b1pNc,20200318,13014,so he can't turn around, I'm gonna say.  There's no real facing in fifth edition,  but I think that's kind of dumb.  So I'm gonna say he's stuck facing you  because you were like holding him in position  while you're restraining him.
KdYKb9b1pNc,20200318,13028,This guy will scurry to this spot.  There you get no tech.  A chain of acid like this.  There you get an attack of opportunity as he moves past.  No, he never actually leaves a threatening square of yours.  Well, wait.
KdYKb9b1pNc,20200318,13044,He should kind of have to, right?  Isn't this guy occupying four squares?  Can they stand on top of each other,  or when you have to make an out of the radix tricks?  So he can spray and then like end his round
KdYKb9b1pNc,20200318,13054,while finishing moving through this, right?  So he scammers.  But how does he move through the other hand, okay.  Or his allied friend.  Yeah, you move through each other squares all the time.  All right.  They do it too, yeah.
KdYKb9b1pNc,20200318,13063,So he scrambles over the guy who's being restricted  by the snake, scrambles over the snake  from on top of it breathes acid on you guys  and then comes down to a better position for combat.  Hmm.  Okay.  of you in this line, make me dexterity saving throws, or suffer, or suffer nine points of damage.
KdYKb9b1pNc,20200318,13087,You will both take four points of damage instead, and this guy has had his acid.  This other one is just going to spray his acid at the giant snake. Giant snake please make me a  dex save. Um, what's the second?
KdYKb9b1pNc,20200318,13103,My life on snake though. Huh? 13 damage to the snake if you fail your dex save.  How do I, how do I see the hang on? Sorry. Okay. My dex is plus two on the snake on grub. It's
KdYKb9b1pNc,20200318,13118,three. Yeah. Okay. I will, um,  I will wait. Yeah, I will dodge.  I think you have to use the snakes thing.  I can use either one. It's a very specific.  The statistics are replaced by the statistics of the beast, but you retain your alignment,
KdYKb9b1pNc,20200318,13146,personality, intelligence, wisdom, and charisma scores.  You also retain all of your skill and saving throw  proficiencies.  So if you're proficient in decks, you retain your dexterity  proficiency to the throw.  But the stat, you keys off of the stink stat instead of your stat.
KdYKb9b1pNc,20200318,13162,I specifically remember looking into this and reading  like an official thing that said that a big part of Moon Druid  is you can choose which one you want to roll  in terms of your save, whichever is higher.  I need to go find it.
KdYKb9b1pNc,20200318,13175,That are written right here in the book.  You know, if we want to play about the rules,  then we should use what the book says right here on page 67.  That's a, that is a, that doesn't have to do with saves though.
KdYKb9b1pNc,20200318,13187,Um, in terms of, yeah, it says you also retain all your skill and saving  throw proficiencies in addition to gaining those of the creature.  It doesn't apply to saving throws.  Yes, it doesn't.  Uh, Moondra can choose their saves, but it'll take me a long time to find.
KdYKb9b1pNc,20200318,13202,It doesn't matter.  You were going to pass whether you use the snakes role or your role.  I'm just being a pedantic asshole.  It's what I do best is just argue pointlessly.  I see you will damage Devon take by two to six.
KdYKb9b1pNc,20200318,13216,Eight thirteen, so you take half of 13,  which is six reduced by 12 to, can you reduce to zero?  Yeah.  And you can reduce any source of damage?  Yep.  Wow.  Maybe you should nerf that too.  Looks kind of powerful, Kalebu.
KdYKb9b1pNc,20200318,13234,That I'm actually okay with that one.  It's done.  OK.  Super natural protection.  You have to check into it.  Like, that takes up to level six.  It's not a first level cantrip.  I teched into my entire class.  OK.  I fucking am it.
KdYKb9b1pNc,20200318,13248,It's the whole thing.  That's all I have.  And you took it away from it.  Reaching the creature, take damage.  You're that much awesome cantrip.  You want to replace your useless thing with you, Tom?  I'm still deciding.  How many captured are they to choose from?
KdYKb9b1pNc,20200318,13266,Six.  Wait, really?  Yeah.  No, five, 10, 11, 12, 13, 14, 15, 16,  and he already has two of them.  OK.  And one of them is the other one.  So 13 to choose from.  Ziya's gone.  Everyone's gone.  The pancakes gone.
KdYKb9b1pNc,20200318,13284,The players go.  That's what we are.  But the players go.  Right.  I will.  I'm gonna slap the one above me.  Did you say slap?  Yeah, with my Dwarven
KdYKb9b1pNc,20200318,13318,dies crumbled in snakes here bony body  but haven't described snakes all right i try to construct this one now before destiny goes  give me you have advantage so you grapple the crap out of it thank god yeah i just knew this was
KdYKb9b1pNc,20200318,13337,gonna happen 29 is a hit 27 is a hit give me the extra d 20s just in case destiny and you did 14  damage to it and you do 22 damage to it. The oncangs are dead but something tells you
KdYKb9b1pNc,20200318,13357,this isn't the last of them. Are we out of combat? For a short moment only because we're  gonna go to our break right here. I have some there are things happening you hear the sound  of skittering feet when we say skittering feet and when we say for one second do I have
KdYKb9b1pNc,20200318,13376,when I have time to retrieve my arrows, that's what I'm asking.  Only if you want to risk having the enemies get  to drop on you, literally.  OK.  Well, if we feel like things are coming, right?  And it's basically the nice turn.
KdYKb9b1pNc,20200318,13390,I want to move here.  And I want to ready on a time.  We're on break.  We can figure that later.  We're not on break yet.  We're still live, boys.  Do we want to go on break?  We're going to break, OK?
KdYKb9b1pNc,20200318,13397,We're on break.  All right.  We'll be back in a bit.
KdYKb9b1pNc,20200318,13428,you
KdYKb9b1pNc,20200318,13458,you
KdYKb9b1pNc,20200318,13488,you
KdYKb9b1pNc,20200318,13518,you
KdYKb9b1pNc,20200318,13548,you
KdYKb9b1pNc,20200318,13578,you
KdYKb9b1pNc,20200318,13608,you
KdYKb9b1pNc,20200318,13638,you
KdYKb9b1pNc,20200318,13668,you
KdYKb9b1pNc,20200318,13698,you
KdYKb9b1pNc,20200318,13728,you
KdYKb9b1pNc,20200318,13758,you
KdYKb9b1pNc,20200318,13788,Hello everybody and welcome back to Empires Over Katie.  You can hear that the hive you're in is alive.  you through the hole, you can hear the sound of wings beating and kite-ness plates scraping
KdYKb9b1pNc,20200318,13822,over each other. Small little heads peer over the hole down to this flare of carnage.  How many can I estimate in terms of 10s, hundreds, thousands? You are guessing right now  in the realm of tens, but it could very easily be in the realm of 100.
KdYKb9b1pNc,20200318,13847,I mean, you have no idea, right?  You can just see like, you know, five or six faces looking down at you and hear about everyone.  Let's get out of here.  Yeah, we should leave.  How much time has passed?
KdYKb9b1pNc,20200318,13857,I want to pick up my arrows.  I'm just curious.  You can start walking around and picking up arrows.  No, no, I will like, what does it sound like?  Do they sound like a scaring for far away?  I hear him like right above me or like give me an update. I should be able to hear this
KdYKb9b1pNc,20200318,13871,There is just the one hole directly above that middle section  I'm worried don't worry about it. I'm gonna is powering down from town  You see face there are faces peering down right now. How many faces?  There are five or six faces peering down at you right now. Well sounds like we're gonna get the fuck on out of here then coy
KdYKb9b1pNc,20200318,13890,Yeah  crap  You guys begin to back up and as you do  three of them will squirt one last round of acid in your direction. I think not three. I think  probably just two of them will squirt some acid in your direction. Can I get one dex save for the
KdYKb9b1pNc,20200318,13909,snake and one dex save for Minsk as the creatures squirt. Minsk, they will do ten if you fail, five if  you pass, you fail, and Grub, they will do 11 if you fail, five if you pass, and you pass.
KdYKb9b1pNc,20200318,13928,You guys back out and head down to pass the way somewhat.  So we have a big problem.  We promised the dwarves that we would clear this place out, and there's a hive of hundreds  of bugs.  Okay, but you're saying hundreds.
KdYKb9b1pNc,20200318,13948,You're a Mr. Always Worst Case scenario, so there might only be like another 10 to 12  how many do we kill here, like 11?  Right, there's also the idea that it seems now the threat of a giant, whatever, the worm,
KdYKb9b1pNc,20200318,13965,I guess a worm wouldn't have dug this, it's too small for a worm, it's just these guys.  Yeah, these guys dug it.  Yeah, okay.  So we, here's what I suggest, we rest, come back and finish the job and be more prepared,
KdYKb9b1pNc,20200318,13976,better position. Not above their layer. Yeah, we can do that.  I mean. So, okay. These guys are dumb, so we can just  lure them out to this area and just come one by one, but they  can shoot acid. We should angle it so that we should, well,
KdYKb9b1pNc,20200318,14003,look at me, but look at the size of this.  Look at this right here.  This tunnel, if we angle ourselves here,  then they can't spray in a straight line around  or something like that.  Geometry or some shit.  Yes, people that are smart to be helped.
KdYKb9b1pNc,20200318,14023,But now let's go anyway, let's go.  I think we should go back all the way to the doors.  Go outside, have them lock the cave again,  and then we rest with the doors.  We went over this, they aren't going to let us do that.
KdYKb9b1pNc,20200318,14034,Wait, they should?  Well, they said they would periodically be checking the area, so we'll chill there.  They said they'd only help us if we weren't being chased by a thousand bad things.  Let's go back all the way to the entrance to where the dwarves led us in.
KdYKb9b1pNc,20200318,14049,Yeah, I mean, at the very least, I guess we can rest there.  How long did it take us to get here?  Pretty close, right?  was really close.  Was that like an hour or something, right?  I thought.  Yeah, it was like 20 minutes from the main passageway
KdYKb9b1pNc,20200318,14064,and then the main passageway you guys walked through  for maybe an hour or so.  Let's do that.  Okay.  Was there anything obvious around that would let us barricade  a tunnel with?  Just the earthen tunnel itself,  which you could try and collapse down on them.
KdYKb9b1pNc,20200318,14081,If we ever feel like taking the nuclear option, do you have some sort of like big sound effect  or big thundery type thing?  Grop.  Yeah.  I do.  I could do some crazy shit.  Like we're talking collapsed the entire on keg nest type of stuff.
KdYKb9b1pNc,20200318,14108,Oh, I'm doing that while we're in here.  I can do it.  to risk you right we'd have to be back on the main table or whatever right I'm  saying that's a last ditch nuclear option well that's like the suicide nuclear
KdYKb9b1pNc,20200318,14118,option right I mean we do it and then we run away into the tunnel and then like  as it's collapsing we get out that's I can do it that's like plan C but I'm  just saying that's plenty I could do it just say the safety word okay
