video_id,date,start,text
lsL88Xgv1fg,20200318,0,And we have also alerted a variety of field and expeditionary hospitals to be prepared  to deploy as well as needed based on direction from the Commander in Chief.  Today, leadership from the Army Corps of Engineers is in New York, meeting with Governor Cuomo
lsL88Xgv1fg,20200318,13,and his team.  I spoke with Governor Cuomo yesterday and other governors.  I will be speaking to more in the coming days to make sure that they know what DOD can provide  through our system to address their needs.  In my conversations with governors and members of Congress about DOD's resources, I've been
lsL88Xgv1fg,20200318,29,made it clear that we will continue to support the  administration's comprehensive efforts and the country  every step of the way while ensuring our nation's  security remains the top priority.  I want to conclude by thanking all of our service
lsL88Xgv1fg,20200318,42,members and their families who have been affected  by this outbreak.  They are all great heroes.  We are continuing to support them throughout this.  We are all in this together.  Thank you all very much.  Thank you very much.  Thank you.
lsL88Xgv1fg,20200318,53,Thank you.  Thank you.  So yesterday, the President made a very important  announcement about telehealth and this is allowing our 62 million seniors to be  able to get some medical services from the safety of their home reducing their  risk and without any co-pays. But we're also making sure that the health care
lsL88Xgv1fg,20200318,71,system is prepared and that those on the front lines have the support that they  need. The reality is the stakes are high and we need to preserve personal  protective equipment for those that are on the front lines of this fight and to
lsL88Xgv1fg,20200318,84,that end we have put out guidelines over the last two weeks to expand the types  of masks that can be used in routine care and saving those N95s for the most risky situations.  Conserving personal protective equipment is also essential to combat the virus.
lsL88Xgv1fg,20200318,99,The today CMS will announce detailed recommendations to further promote this needed conservation,  specifically by limiting non-essential, elective medical and surgical procedures, including  dental procedures. We believe that these recommendations will help surgeons, patients,  and hospitals prioritize what is essential while leading the ultimate decision in the
lsL88Xgv1fg,20200318,124,hands of state and local health officials and those clinicians who have direct responsibility  to their patients. And we urge providers and clinicians and patients to seriously consider  these recommendations. They will not only preserve equipment, but it also allows doctors
lsL88Xgv1fg,20200318,140,and nurses to help those that are on the front lines.  And it will protect patients from unnecessary exposure to the virus.  We fully appreciate that this is going to have a major impact on the healthcare system,  but the shared sacrifice is essential to help those that are on the front lines.
lsL88Xgv1fg,20200318,157,And I want to thank the medical societies such as the American College of Surgeons and  the American Dental Association that took a proactive approach and already posted these  recommendations.  And we've also talked to the American Medical Association,  and they have fully indicated their support
lsL88Xgv1fg,20200318,172,for this recommendation.  We now invite the entire health care community  to join us in this effort.  Thank you.  Thank you.  Thank you.  Robert, please.  Thank you, Mr. President.  My instructions from the President were very clear.  I was to do everything imaginable as aggressively
lsL88Xgv1fg,20200318,192,as possible to protect the 9 1-1-half million veterans  who are part of the Department of Veterans Affairs.  Last month, we established 19 emergency operation centers  across the country.  We began to limit the number of visitors  who entered our facilities.
lsL88Xgv1fg,20200318,209,We began, I think, the first system to begin triaging  across the country in our 170 hospitals,  the entrance of anyone into our facility  without being questioned or tested.  We expanded those restrictions to those  in our 135 community living centers,
lsL88Xgv1fg,20200318,228,which have about 7,800 veterans who are in acute conditions  to make sure that they were protected.  We also took the next step and made sure that  we limited the dental surgeries that we were provided.  We've cut back by one third the number
lsL88Xgv1fg,20200318,248,of routine appointments we have had,  and we have canceled elective surgeries.  These were all part of the President's directive to be as  aggressive in a public health sense as we could be.  And I think we have set the pace for the entire country.
lsL88Xgv1fg,20200318,264,I will say we've often said that we work the most noble  mission in the federal government.  Our veterans have been in the toughest spots in the world.  They have been put in conditions that are unimaginable to most  Americans, and they have responded.
lsL88Xgv1fg,20200318,281,They have responded clearly.  They have responded with passion and also the 400,000 members of our department who  are out there on the front lines.  The last thing I will say is that you have heard a lot about the fourth mission that
lsL88Xgv1fg,20200318,296,VA has.  Our first three missions are health care benefits and memorial affairs.  Our fourth mission is to support the federal government in times of natural disasters and  pandemics.  We are the buttress force in case that FEMA or HHS calls upon us to deploy medical professionals
lsL88Xgv1fg,20200318,315,across the country to meet crises.  Wait, hold on.  Some guy in chat is, I can't tell if this guy is controlling it.  People still refer to it as the Spanish flu, they just need it to be somehow China virus
lsL88Xgv1fg,20200318,325,is racist, makes me wonder.  I don't know why the Spanish flu is called the Spanish flu.  I don't know if they didn't have the naming conventions for viruses that we do now.  And also Spanish is like, well, I don't know in this case,
lsL88Xgv1fg,20200318,339,Spanish referred broadly to like Spanish people of the Spanish country or whatnot.  But like we know what the virus is called now, right?  We have like COVID-19 is like the medical designation for it.  Corona virus is like the classification of virus.
lsL88Xgv1fg,20200318,348,There's literally no reason to call it a Chinese virus unless you're racist.  There's just no reason for it.  I don't know when the naming conventions were.  Yeah, I don't even know if the Spanish who came from Spain or why it was called the Spanish
lsL88Xgv1fg,20200318,362,who have no idea.  But I do know that we have the naming conventions now  for how we name virus, Vyri, Vyri.  Yeah.  Well, we plan for that every day.  We are gaming out emergency preparedness scenarios.  And we stand ready when the president needs us
lsL88Xgv1fg,20200318,383,to expand our mission.  Thank you.  Thank you very much, Robert.  Thank you.  There is no reason to call this manager either  when you can call it N1H1.  Was it called N1H1 back in the early 1900s?
lsL88Xgv1fg,20200318,418,H1N1, I mean, and no, but you could call it that now.  I mean, I guess you could, but I don't know if people would know because usually when you say H1N1 people  There was like a recent outbreak of H1N1 that people usually associate that with
lsL88Xgv1fg,20200318,434,Oh, and then the swine flu was 2009  I didn't even know about viruses when Spanish was raging in.  Thank you all.  That's very nice.  Any questions, please?  Thank you.  Thank you.  Two questions, if I may.  Your Treasury Secretary was on Capitol Hill talking about the potential for what could
lsL88Xgv1fg,20200318,466,And he said that unemployment could skyrocket to 20%  Are we looking at that?  Just pointing out it's logically inconsistent.  I guess, I mean, I guess like if I felt like people used  Spanish flu as a way to be like derogatory towards
lsL88Xgv1fg,20200318,480,Spanish people, if I had that vibe, I would probably be a  lot more concerned with it.  Yeah, I mean, I guess if you have a formal name for it,  that's it's probably better to do it.  But it seems like with the Chinese virus, with the dirty
lsL88Xgv1fg,20200318,493,Chinam and eating rats and bats in the markets, like I've  heard a lot more racially charged language being used  about the Chinese virus.  It's a way different tone than the Spanish flu.  What about Wuhan coronavirus?  I think that's okay.
lsL88Xgv1fg,20200318,513,I've heard some people say the coronavirus in China  or the Wuhan coronavirus or whatever,  is a little bit better than the Chinese virus.  Thank you.  Right.  Well, I don't agree with that.  No, I don't agree with that.  No, I don't agree.
lsL88Xgv1fg,20200318,525,That's a absolute total worst case scenario.  But no, we don't look at that at all.  Thank you.  No, wait a minute.  Why do you keep calling this the Chinese virus?  There are reports of dozens of incidents of bias against Chinese Americans in this country.
lsL88Xgv1fg,20200318,533,Your own aid secretary says he does not use this term.  He says ethnicity does not cause the virus.  Why do you keep using this?  It's not racist at all.  No, no, no.  It comes from China.  That's why.  It comes from China.
lsL88Xgv1fg,20200318,543,What do you have here?  Yeah, it's done.  It's behind you.  I have a great love for all of the people from our country, but as you know China tried  to say at one point, maybe this stuff now, that it was caused by American soldiers.
lsL88Xgv1fg,20200318,556,That can't happen.  It's not going to happen.  Not as long as I'm president.  It comes from China.  China.  Two questions like Mr. President, first of all, on the defensive procurement act.  Yeah, so it sounds like it's like a nationalistic, also a nationalistic instead of xenophobic
lsL88Xgv1fg,20200318,567,or racist, but there are also Chinese people in the United States today whose businesses  are being harmed because people don't want to eat Chinese food because they think that  the Chinese virus is going to come from them.  We have to take a look at the
lsL88Xgv1fg,20200318,577,agenda.  On the floor a short time ago, the  urgently needs to be put into  action to produce medical supplies,  particularly ventilators.  Do you have some targets that you  would like to see immediately  spooled out of the agenda?  We do have tremendous numbers of ventilators,
lsL88Xgv1fg,20200318,586,but there's never been an instance like this.  No matter what you have, it's not enough.  That would be the case.  And we will be, it's being signed.  It's essentially going inside it and  just going to look well.  If we need to use it, we'll be using it at full speed ahead.
lsL88Xgv1fg,20200318,593,He says he needs to be used.  He says he needs to be used.  He has to target.  We have to target for certain pieces of  equipment.  We have targets for masks.  them, but we need millions more.  This thing like this has never been requested, and it's never,
lsL88Xgv1fg,20200318,602,we've never had even think in terms of these numbers,  but we need millions of masks and all of that will be ordered.  We need respirators.  We need ventilators as a big thing because it's a complex piece  of equipment.
lsL88Xgv1fg,20200318,608,So we have a lot of ventilators, but we're going to be ordering  one.  And that's a question.  What size will the checks be that we set out to?  To be determined.  We're working with the Senate right now.  We're working with everybody on Capitol Hill.
lsL88Xgv1fg,20200318,615,There's been tremendous.  There really has been, I mean, with some exceptions, obviously,  because it's always the way it is.  But there has been getting on very well Republicans and Democrats.  It's a nice thing.  Very bipartisan support.  I don't want to get into that right now, John.
lsL88Xgv1fg,20200318,623,We are looking at different numbers.  We're looking at timing that would be different, splitting the time, splitting the payments.  We're looking at a lot of different things.  It hasn't been determined yet, but it will shortly be determined.  And people want to go big, as opposed.
lsL88Xgv1fg,20200318,630,Everybody seems to want to go big, and they want to get to the recovery.  The big thing we can do is get rid of this horrible, I call it the unseen enemy.  You call it, there's a thousand different terms to work, but it's not about us.
lsL88Xgv1fg,20200318,638,And it did 128 countries.  I think it's in something like that very close to that.  Think of that.  So it spreads violently.  It's a very contagious, very, very contagious virus.  You're an American to be on wartime footing in terms of fighting the virus.
lsL88Xgv1fg,20200318,647,I do.  it was a very early stopping people coming in and could be very heavily infected and it was a very good move and it was very early very early when most people  completely like professionals they didn't want us to do it, that really saved our lives and yeah, I look at it.
lsL88Xgv1fg,20200318,658,Wasn't the United States one of the last people to start the travel restrictions?  Am I remembering my timelines incorrectly? When I was overseas I thought I heard about Europe stopping a lot of travel restrictions like Italy and stuff way before the United States did.
lsL88Xgv1fg,20200318,670,and my understanding also, I could be wrong, but my understanding also is that the reason why Canada was delayed and announcing that they were going to restrict travel to the U.S. and Canada was because the U.S. was dragging their feet on it.
lsL88Xgv1fg,20200318,681,That was my understanding of the recent Canadian announcements regarding travel.  They, uh, in a sense, I'm the work time president.  I mean, that's what we're fighting.  It's a, uh, it's a very tough situation.  You have to do things you have to do.
lsL88Xgv1fg,20200318,691,W.A.A.R.R. HR, HR, HR, HR, HR, HR, HR.  We're going to defeat this enemy.  And, uh, what we're doing, and we're doing it well,  and I tell the American people it's been incredible.  Four of the most part, they've been really incredible.
lsL88Xgv1fg,20200318,701,Yeah, please, Gabe.  I'm wondering if you can have one because I'm very well.  I'll start with you.  You just said there are a tremendous number of military  that we have, but for weeks, hospitals have been  worried about critical shortage.
lsL88Xgv1fg,20200318,706,They say we are not the hero.  long to note that the infrastructure.  The hospital is supposed to have regulators, too.  And when we have thousands of ventilators,  it sounds like a lot, but this is a very  unforeseen thing.
lsL88Xgv1fg,20200318,713,Nobody ever thought of these numbers.  Nobody ever saw numbers like this.  Even with regard to testing, nobody would be doing testing  and they decided to do it very, very hard to ramp up.  Now we're getting highly sophisticated tests,
lsL88Xgv1fg,20200318,719,and it's going very well.  But nobody's ever heard of testing and the kind of quantities  that you're talking about.  What do you believe when you need more ventilators?  Well, we do.  It depends on how it goes.  Worst case, absolutely.
lsL88Xgv1fg,20200318,726,Best case, not at all.  So we're going to have to see where it goes.  But we are ordering thousands and thousands of ventilators.  And complex, these are complex machines.  But we're wondering, does anybody have a mic, maybe a new
lsL88Xgv1fg,20200318,733,new company do we have?  And we're like, yes, please, do you know the number?  We have a specific number of ventilators in the stockpile.  It's in excess of 10,000 and these are from the Department of  Defense, the other one thousand and that.
lsL88Xgv1fg,20200318,741,But President, even this morning and yesterday afternoon speaking  of the largest company in this country, we're hearing a  tremendous spirit among industry leaders who are ready to  step in and to that volume.  The stockpiles don't count all of the ventilators that exist
lsL88Xgv1fg,20200318,751,today in the marketplace and in healthcare facilities around  the country.  But the President has given us a direct and to make sure that our  stockpile is just as important working with industry leaders  that we're securing the increase in ventilators, the increase in
lsL88Xgv1fg,20200318,758,the increase in mask gloves, eye-protected care,  garments that are all necessary to lean forward.  And we're confident we'll be able to accomplish that  with the incredible cooperation of the supply chain  that exists in America today.  The Press And the Secretary?
lsL88Xgv1fg,20200318,767,The President?  We can do that a second.  We're ordering a lot more.  We're ordering a lot more.  Okay, go ahead.  One second.  One second.  One second.  One second.  Thank you.  First question, Mr. President, thank you.  First question on the Canadian Board.
lsL88Xgv1fg,20200318,779,What was the big one?  Friday, we talked about it that Monday you said no one  to answer any questions.  I said not yet.  I spoke with the Prime Minister, Mr. Trudeau.  Very good relationship, obviously, between us and our two
lsL88Xgv1fg,20200318,784,countries.  And no typical one.  contact because that's the way we're going to win this one. That's so important. And we both  thought it was not affecting trade. It's not essential. It's not essential crossings. It won't affect  trade at all. And it was just something we thought we'd be good for both countries.
lsL88Xgv1fg,20200318,794,Just please.  I'll give you the trade.  I can be sure the trade and everything that's being shared from one side.  They don't get in a very careful manner. You can only be vigilant and very professional. But it's not
lsL88Xgv1fg,20200318,803,pretending that there's one with the trade between the two countries.  Yeah, please.  All three candidates going to die of the COVID?  For the airlines, $150 billion in loan guarantees from critical sectors of the economy.  $250 billion payment on April 6th, directly to individuals, another $250 billion payment
lsL88Xgv1fg,20200318,820,on May 18th, again, directly to individuals and as well, $300 billion for small business  loan guarantees.  Is that in the general sense what you're looking at?  It could be.  It could be.  And we're also playing with a lot of numbers, a lot of very big numbers and a lot of very
lsL88Xgv1fg,20200318,837,small numbers, frankly.  We want to take care of it.  We have to help everybody who's nobody's fault has happened.  I mean some people could say it was did you download the final fantasy 7 really hit no yes fault and certainly none of these
lsL88Xgv1fg,20200318,851,Wait, did he just blame China on this?  Directly to individuals wait hold on  There are two hundred fifty billion dollar payment on May 18th again directly to individuals and as well  300 billion dollars for small business loan guarantees is that in the general sense what could be it could be and we're also
lsL88Xgv1fg,20200318,867,Playing with a lot of numbers a lot of very big numbers and a lot of very small numbers frankly  We want to take care of it.  We have to help everybody.  It was nobody's fault.  This happened.  I mean, some people could say it was somebody's fault, actually.
lsL88Xgv1fg,20200318,877,But it was nobody's fault.  And certainly none of these companies that all of a sudden had no passengers and planes  and had no passengers and cruise ships and all of the things that have happened.  But I will say that they can't be blamed for this.
lsL88Xgv1fg,20200318,885,And we want to keep those companies vibrant because it's going to be a comeback very,  very quickly.  So this has solved and it will be solved.  We will win.  And it will take place very quickly.  The $50 billion there is give or take $3 million Americans or so.
lsL88Xgv1fg,20200318,894,Just do the math lab about $750 per cent, $4 million.  That would be about $3,000 on average again, rough math.  Which is that?  I understand that because it's a moving, these are all, every number that you mentioned, yes, we talked about those numbers, we're also moving those numbers in both directions.
lsL88Xgv1fg,20200318,903,So we'll let you know, it'll be, it's moving on fast. Again, there's a great bipartisan effort going on that I haven't really seen before to this extent.  We have the best virus folks, everyone, what is virus?  They look, it's down the line and they're looking at it very seriously. And I think it would be a great thing because the others, to use a nice word, it's very inconvenient.
lsL88Xgv1fg,20200318,923,It's very tough.  You tweeted this morning about your approval rating amongst Republicans.  You have said that you give yourself a 10 in terms of handling this crisis.  How do you reassure Americans at home who don't trust you to handle a crisis of this
lsL88Xgv1fg,20200318,940,magnitude?  Well, I think we're doing a really good job.  We started off with a termination of the border, the people coming in from China where  this oil started.  That meant I took it very seriously.  When I use the word calm, calm doesn't mean that I'm not taking it seriously.
lsL88Xgv1fg,20200318,955,Calm means, and we should be calm.  We should be extremely calm.  But yeah, 95 percent within the Republican Party and over 50 percent.  And I also have, we have very great approval numbers.  I mean, people like the job that we're doing.
lsL88Xgv1fg,20200318,970,And when you compare this to other epidemics or if you want to use a different term,  you can.  But within this country, and you look at what's happened over the years.  This is being handled very, very professionally.  We have the greatest professionals in the world.
lsL88Xgv1fg,20200318,985,We're doing a good job.  Nobody's ever been swamped like this.  Nothing's been so contagious.  The level of contagion has been incredible, actually.  Nobody's seen anything quite like this.  Peter, go ahead.  The Press Secretary for a second.  If federal officials have shipped millions of tests as you
lsL88Xgv1fg,20200318,1002,and your colleagues have said why is the federal government  says of only 59,000 tests been processed to this point.  We just heard from the Atlanta Public Health Director  saying that they have fewer than 50 test kits  for more than 900,000 citizens.
lsL88Xgv1fg,20200318,1018,Where are the tests?  I'll let Mike go ahead.  Go ahead, Mike.  So that's a very critical question,  and thank you for asking.  That's not Mike.  So the test kits that we put out last week  through the approval, the rapid movement of that meeting
lsL88Xgv1fg,20200318,1034,that President Trump called less than two weeks ago,  that has resulted in bringing our private sector  to the table because the test and the platform that was out there could only run between  four and 12 tests per platform per day.
lsL88Xgv1fg,20200318,1049,We've now moved into platforms that can run basically tens of thousands of tests per day.  So yeah, the reason I'm grateful for your question because it allows me to point out  that of course then there was backlog.  There were individuals who had been tested.
lsL88Xgv1fg,20200318,1065,Hey buddy.  have their specimen run because of the slow throughput.  It's now in a high-speed platform.  So we will see the number of people diagnosed dramatically  increase over the next four to five days.  I know some of you will use that to raise an alarm that we are
lsL88Xgv1fg,20200318,1085,worse than Italy because of our slope of our curve.  To every American out there, it will be five to six days  worth of tests being run in 24 to 48 hours.  So our curves will not be stable until sometime next week.
lsL88Xgv1fg,20200318,1103,The reason I talked about Thermo Fisher yesterday  is because their platform is in 2,000 laboratories.  They're the ones that are putting out the million tests  this week that will solve the issue that Atlanta and others  have brought up.
lsL88Xgv1fg,20200318,1119,I wanted to be clear.  We prioritize the areas.  We do county by county analyses.  Based on those analyses on what counties had more than 50 cases, we prioritize the test  kits we put out, the 400,000.  And that's why we're seeing a 7% plus positivity rate.
lsL88Xgv1fg,20200318,1139,We'll be able to expand that platform and re-prioritize based on the accessibility of  the other kits.  Mr. President, perhaps I can follow up.  How are non-symptomatic professional athletes getting tests while others are waiting in  line. True. Can't get them. Do the well connected go to the front of the line?
lsL88Xgv1fg,20200318,1154,Well, you'd have to ask them that question. I mean, they I've read no I  wouldn't say so but perhaps that's been the story of life that does happen on  occasion and I've noticed where some people have been tested fairly quickly.
lsL88Xgv1fg,20200318,1168,Story of life. Excuse me. We inherited a very obsolete system. This was a  a system that was out of date obsolete, or it was a system  that was never meant to take care of the kind of quantity.  The number of people that we're talking about,
lsL88Xgv1fg,20200318,1185,millions and millions of people.  If you go back in years past, like even recently,  with the flu, nobody had tests before.  They didn't test the entire nation to see whether or not  they had flu.  They got the flu.
lsL88Xgv1fg,20200318,1198,They got better.  Hopefully they got better.  That was it.  Now, all of a sudden, they do this very complex testing.  What we've done is we've broken it down,  we've broken up the system.  But it was obsolete and or, you could say,
lsL88Xgv1fg,20200318,1210,it was also a system that just wasn't meant to handle  the kind of volume that you're talking about.  We've rebuilt it into a system that, for the future,  will be a very good system if you want to go this route.
