video_id,date,start,text
lsL88Xgv1fg,20200318,16169,by my merch, moodinmerch.com.
lsL88Xgv1fg,20200318,16199,Oh, I was linking to the Twitch chat too.  Thank you, Chai. You're riding me.  Ooh, what's up Twitch chat?  Any ooze?
lsL88Xgv1fg,20200318,16233,Link it in your profile below your Twitch viewing channel.  That's a five head idea.  Thank you.  I didn't like download carry.  It depends.  damn so it's fine.
lsL88Xgv1fg,20200318,16278,It was sohem.  albums and high hopes.
lsL88Xgv1fg,20200318,16322,eighth
lsL88Xgv1fg,20200318,16382,So you stole the haircut because you knew the corona would even excuse the scamming.
lsL88Xgv1fg,20200318,16412,I physically can't go get my haircut.  If I buy, like, mushrooms or LSD from somebody,  am I just getting a second hand from them  just ordering it off the fucking dark web?  Like, should I just download Tor and figure out
lsL88Xgv1fg,20200318,16439,how to buy this shit myself, or?  You think these people that you're buying from are literally fucking growing mushrooms and shit?  Oh, I don't know. I don't know like who people that grow shit like buy from like should I just be fucking downloading Torrin getting
lsL88Xgv1fg,20200318,16448,Because I've heard that like buying like psychedelics online is ridiculously fucking easily.  Just grow your own.  Fuck you.  Go ahead.  The dark web is fuck nowadays, is it?  I thought that Torshik was like super fucking easy to get stuff.
lsL88Xgv1fg,20200318,16488,wouldn't be  taken  to
lsL88Xgv1fg,20200318,16533,Oh  All right  What um  Hi, can you get like MDMA online too? How do you know if you get good MDMA? How do you know if you can do this online in a video game?  I don't know if you should be asking your chat
lsL88Xgv1fg,20200318,16558,I'm talking about video games.  Dumbass.  I don't think that's gonna work.  How do I break the launch at for him?  You get test kits for MDMA.  that'll tell you like the purity of the MDMA.
lsL88Xgv1fg,20200318,16593,Snakey there.  I am an anime.  Kii.  Hah!  Bless you.  shut up  I've been mating oh  I watched two movies, okay  Well three movies the sonic movie was okay wasn't bad. It's okay, and then I watched um  Paddington and then Paddington too. Have you heard the bear one right? Yeah
lsL88Xgv1fg,20200318,16623,Yeah, those are really good movies. They're pretty good. Yeah  Most kid movies are actually pretty fucking good like  Well some of them are you know what the biggest sleeper hit kid movie fucking best fucking movie of all fucking time was
lsL88Xgv1fg,20200318,16638,It was a goddamn kid movie there is only  one right answer  And the answer is the god damn Lego movie. Holy shit  The Lego movies do not slept on it all people like this well, I thought the I don't like the Batman
lsL88Xgv1fg,20200318,16655,I didn't see the Batman one, but  the  two kills to kills  I have set up, I've set up.  Wait, oh my god.  Are we going to, are we going to now?  Yeah, I'm walking around.
lsL88Xgv1fg,20200318,16690,I'm here.  What is on the, I'm on the cat, I'm on the cat.  Yeah, she said.  Go up this way, up this way, up this way.  I'm not with anyone.  I feel like...  Oh my god.  I'm dead.  I'm dead.
lsL88Xgv1fg,20200318,16706,Oh!  That's alright.  You know that she gets more shutdown gold in that one kill than you just got in all  three goes, right?  Okay, well what the fuck do you want me to do?  I'm just kidding.  So
lsL88Xgv1fg,20200318,16748,I actually got three dark harvest decks, huh, you know those go away when you die you lose them on they do not  She's level three and level one really?  Hey, Shrat Thresh.  Guys, when you've got the glowing things around you is the support.
lsL88Xgv1fg,20200318,16766,It means when you hit creeds you execute them you get gold for it, okay?  You're fucking kidding me.  Did you get another count?  Okay, this throws just really bad.  Wish me luck.  You got it, man.  Me, me, me, me.
lsL88Xgv1fg,20200318,16790,Try my back.  Wait, have you been doing, you've been doing on bands this month, right?  Oh, yeah, a little bit, but I got more than you.  Good.  I got to sit with the flow.  You got the fl- what?
lsL88Xgv1fg,20200318,16805,Well, I had it a little bigger.  You're also on vacation, so I doubt there's that many, but yeah, that's my...  True, I haven't been playing League.  I don't think you should swap it over a bit.  No, I love you, no matter what happens.
lsL88Xgv1fg,20200318,16825,It's not about that. It's more about the culture. Good. I'm glad disrupt. I want to be disruptive  That's what all good businessmen are. They're disruptive. Okay, they're playmakers. Okay, not play takers  Guys listen up we might do this today or tomorrow
lsL88Xgv1fg,20200318,16848,Here's what's gonna happen. I  You fucking cuck  I'm gonna do a mass unban on my subreddit  Why would you hit that one instead of the one that I  Oh  Cool, I love him and Caitlin's late traps at a right exit turret. I think I'm so so interactive
lsL88Xgv1fg,20200318,16884,I'm gonna do debates you see a lot I don't know a lot  What are you doing down here?  Are you?  I think you're subrouting and boring.  My what? Sorry.  Is your subreddit getting boring?
lsL88Xgv1fg,20200318,16915,Well, no, I just want to bring everybody back.  Oh, I think what I'm going to do, we're changing it completely, guys, okay?  I'm going to enforce the labeling system on every post.  Dude, go away.  It's not going to happen.
lsL88Xgv1fg,20200318,16938,And I'm going to bring on mods, and we're going to enforce a minimum quality post, okay?  That means that means that if you're arguing with somebody you need to cite some fucking sources or your post is gonna  Get removed and you're gonna get like it's gonna be like a three strike system. You're gonna get banned
lsL88Xgv1fg,20200318,16953,That's what's gonna happen. Okay. I'm gonna have like ten mods and we're gonna fucking do this shit  Okay, I want a good ass subreddit some of you are good posters. Okay, but most of you fucking good mods  Most of you are rapists and thieves, okay? Some of you are good posters though
lsL88Xgv1fg,20200318,16975,On average they don't send their best though do they Steve?  What about memes you can have memes if you want you can label mean posts  That's fine  But like if we're gonna start talking about like politics or some shit like you need to start just you need to source shit
lsL88Xgv1fg,20200318,16987,Okay, so someone's gonna say some shit like oh the the federal reserve is a fucking new liberal Jewish shit with some shit  You gotta fucking link it. Give me some goddamn sources  No more it's just saying things without backing them up. I want high quality goddamn posts, okay
lsL88Xgv1fg,20200318,17002,Most of the time when I go to the subreddit, there's not even shit I can argue with because you're so fucking dumb  I don't even want to post there because it's so brain dead  Been too much
lsL88Xgv1fg,20200318,17032,Stop playing league boomer  Don't ever tell me to stop my passion.  Well, thanks Boomerdock for the 28 months.  More like Boomerdock.  Your mom's kind of like a boomerdock.  Like his boomerdock is just fucking?  Yeah, yeah boy.  boy you know you know how it go let's go let's fight
lsL88Xgv1fg,20200318,17069,,  more  to help the  mind  I
lsL88Xgv1fg,20200318,17100,Any other twitch farmers man man man you actually pulled her out of the goddamn fucking turret dude  You've got such a big brain thresh nice brain. It's big. It's smooth  It's awesome. Oh, no. No, it's not okay. No, I know this okay. You're lucky thresh
lsL88Xgv1fg,20200318,17116,Why are you hitting my creams?  Is my mic a little bit quieter when I scream now or is this still really loud guys?  Seems fine.  I fucked with the compressor shit a bit
lsL88Xgv1fg,20200318,17150,And a risky game mid the peaking was awful before it's good. He's a bit more compression okay  a little bit of a different stuff  Mary me, Mary me!  Hey, Moon?
lsL88Xgv1fg,20200318,17180,why he tea  even though you died fresh you died like a f***ing boss  no way  no way  All right, listen, you remember that you just walked on the song request, dude.
lsL88Xgv1fg,20200318,17224,She has a two-ceus lead, guys.  Watch it disappear with this masterful lane freeze, okay?  Are you gonna perform a magic trick?  Ha ha! The two of ends!  Are you fucking kidding me?  But why are you meaning from last year?
lsL88Xgv1fg,20200318,17249,Stop.  But these are year old memes dude.  This is streamhouse dead, they said they sent me the contract on Friday so we'll see.  They're dragging their feet on it though, I don't know boys.  Miami-St might be inbound.
lsL88Xgv1fg,20200318,17334,to  your death  Marianne  report is actually a fucking brain game is horrible at you  as I Mao XL  Who of support from the fucking game?  Hahahaha
lsL88Xgv1fg,20200318,17366,Is Austin Steve a possibility?  Think of the IEL memes  Almost zero chance of me going to Austin  Fuck that city  Good  Dude, chill bro  Look, even Derry's Tonya, chill  Haha  We
lsL88Xgv1fg,20200318,17403,Thresh you literally have an execute you've got three of them around you. What is this guy? He's like fucking bronze  Okay, no more. We're not giving him any good speed. Once the last ten of me can take over me
lsL88Xgv1fg,20200318,17418,Did he miss the big one? Yeah, he yes, and he's got his char gun things up. He's just fucking standing like a fucking idiot  is  the
lsL88Xgv1fg,20200318,17455,...  this do you all  a
lsL88Xgv1fg,20200318,17487,to  Okay.
lsL88Xgv1fg,20200318,17519,Not bad.  What's up, plain ape?  Better on  to
lsL88Xgv1fg,20200318,17550,that  was people unso  the  judgments  a  read the whole thread  wait was there just a leak you
lsL88Xgv1fg,20200318,17587,and  I'm not sure if you should die.  You had no shit Sherlock fucking Holmes.  Watch this bitch die now.  Straight flash.  Are you fucking kidding me dude?  Okay, just kidding.  Not very good.
lsL88Xgv1fg,20200318,17630,Dun-dah!  I  I  of  I need blue you help me if you come in and get me a double kill
lsL88Xgv1fg,20200318,17663,Oh, you know fucking Christ Almighty in my asshole  Is it really is it actually meta to build no mana anything yeah for me it is  for you what does that mean what about like a row I there's like real you ever
lsL88Xgv1fg,20200318,17680,don't need that shit to garbage item okay listen I don't tell you to build  driven right don't know me I don't know fucking any I ain't gonna steal it  because I'm respectful  I'm gonna come in.  Oh, I'm moving back.
lsL88Xgv1fg,20200318,17702,Now you're gonna come in?  No, I'm gonna stay bottom, actually.  Okay, that's what I want to hear, let's go.  baby wait what oh hey the guy with the blue buff hey well I can't fucking do  anything about it losing why does he have g a normal it first item
lsL88Xgv1fg,20200318,17735,Yeah.  Ready?  Big fights coming.  Oh  On to the turret timbers to tank the cute oh wait hold on oh
lsL88Xgv1fg,20200318,17766,Moot with the narrow dodge. Oh  Fucking has it  Just let me handle it.  Thank you everybody for the gods, Denise.
lsL88Xgv1fg,20200318,17799,15 dark harvest stacks. I don't know if that's good, but...  Get a f-  I love League of Legends.  Now that I'm a mid laner.  Time to just give up the bot lane, Steve.
lsL88Xgv1fg,20200318,17832,Come up.  Come up the rift.  Let's go.  Go.  Go if I hit that I'm gonna hit this one, okay  Team blue.
lsL88Xgv1fg,20200318,17882,Oh!  Oh!  I didn't hit- there's so many fucking buttons to press there.  It was never gonna work out.  So there's just too many fucking buttons.  buttons. I don't even know if you can batch the spells that quick. Hey Jetera, suck my
lsL88Xgv1fg,20200318,17925,my fucking dick don't give a fuck  i'm scaling  we played a scale now  What about Luxu out of cash?  See anything else that is going?
lsL88Xgv1fg,20200318,17956,Yeah.  Take it back to Terra.  Or I'll see you in the Unband forms.  Bend the knee.  I have all day of all day of all day.
lsL88Xgv1fg,20200318,17986,Can we do it, um, Baron?  Yeah. No, no one's coming.  Okay, I'm just gonna die to this. I am gonna die to it too. I just wanna waste them all and let everybody in this game die.  Did he bend the knee?
lsL88Xgv1fg,20200318,18007,15  disgusting as  you can easily
lsL88Xgv1fg,20200318,18044,can you only without now  are  stop you're pissing me off you don't think you won't you don't think you  already are running it down moose I'm carrying your fucking ass yeah  the
lsL88Xgv1fg,20200318,18096,Okay, what are you getting a shim?  Is there really nothing you can do when he's in that thing?  No, what are you gonna do?  It's so stupid though.  Yeah, untargetables are dumb.  No, he is tard- I'm done.  I'm AFK.
lsL88Xgv1fg,20200318,18119,I'll be back in a sec, guys.  Yeah, I got him.  Got him.  Got him.  Yeah, he better come back.  That's what I thought.  That's what I thought, homie.  Great and now you're feeding my fucking team.  Moot, you're not doing anything right now, Mooten.
lsL88Xgv1fg,20200318,18151,You didn't even stun anybody with the Tibbers.  go go go go go go go go, Moot!  Q!  I did.  I open up the fucking in him.  Oh my god.  Destroy the Regal.  E!  Help me!  God damn it!
lsL88Xgv1fg,20200318,18182,Do not accept coaxial  meaning  this  if
lsL88Xgv1fg,20200318,18219,the  chat eleven and five verses the virgin eleven and six  the chat eleven and five  verses the virgin eleven and six  the  the  is means testing actually bad son keeps trying to know there's nothing wrong with means testing it's just people on the left or
lsL88Xgv1fg,20200318,18244,progressive hated because they like  They have this weird delusion that if things are universal, they're like easier to like defend even though they can't cite you any evidence for that assertion whatsoever  It's just something they accept on dogma
lsL88Xgv1fg,20200318,18255,What does mean testing mean again?  Means testing is where like if I want to administer a social program  I like you there's like an income limit or something for it as well  Basically makes it a lot easier to fund things and it makes it easier to um
lsL88Xgv1fg,20200318,18267,To target the people that need help the most rather than just giving like blanket protections to everybody  Oh  I'm sure on top sure wait wait star is pushing but it's really weird to spot  Realistic was anything bad about bailouts and saying a lot of corporate socialism bailouts stuff
lsL88Xgv1fg,20200318,18289,But no, there's nothing bad about corporate bailouts anybody that says the same as a fucking moron  At least not any that the United States does  However, if we are gonna be bailing corporations out to stabilize them in the economy
lsL88Xgv1fg,20200318,18299,It's probably good that we stabilize like the people too, so there should probably be some sort of like cash transfer  To like civilians and non-businesses  Which you guys are just fucking hamming it out aren't you  the
lsL88Xgv1fg,20200318,18329,yoy  that's had thirteen and six verses the virgin twelve and five  come over here  and the game  one more kill than you shouldn't reward c o's use buybacks to raise profits  anytime you hear a progressive or lefty talk about buybacks you can be very
lsL88Xgv1fg,20200318,18352,confident that they have no idea what they're talking about and you can just ignore everything  they're saying. Vibax have nothing to do with anything. Anybody that brings them up just  heard it off a fucking Twitter thread. They couldn't tell you what a buyback is. They
lsL88Xgv1fg,20200318,18362,couldn't tell you why companies do buybacks. They couldn't explain why it's preferentially  do a buyback versus a dividend or why one is better than the other and it should be better  than the other. They all they know is that CEOs are compensated with stock and sometimes
lsL88Xgv1fg,20200318,18372,they do buybacks. Therefore, they're bad. That's the only thing I can tell you, okay?  Fuck out.  They're all absolutely  going from  meaus testing and reaction to the renowned sense of all years of course or 5 times and  a whole Corp Jessica means testing a certain case is conducting for sure when you are like healthcare education the cost
lsL88Xgv1fg,20200318,18403,as a  Hold on, ask her.  LMAO, imagine being able to buy baths.  We play League here.  No DOTA, Elite is allowed.  fro  pal
lsL88Xgv1fg,20200318,18437,of the predator  on their own enough to be worse  The second part of my account is that Hassan is like a credits as a Corona cash transfer, some of which are means tested in very low  bureaucracy ways like a cutoff of 90k income extremely easy to administer. Yeah, you should yeah, the cash transfers for the Corona stuff
lsL88Xgv1fg,20200318,18456,should just be fucking um  The cash transfers for that shit should should be means to us 100% scale it and you can even have it tape  Rob it doesn't have to be like a hard cut you can like taper it off. I don't need I don't need I don't need goddamn tax money
lsL88Xgv1fg,20200318,18469,For the fucking Corona shit. I'm fucking fine. Okay. Anybody that's making over 250,000 a year doesn't need a fucking cash transfer  For the fucking coronership, you're gonna be okay. All right, you'll live not working for a couple weeks, okay?
lsL88Xgv1fg,20200318,18482,Equalize the wealth. All right, smooch, flatten the curve. Hold on, where's Peach?  Tabor wants to join you on him by him or if you want Peach?  Yeah, we can do a couple of Tabor fuck up. Yeah, tell me what I'm
lsL88Xgv1fg,20200318,18499,I can't wait for my $1,000 need bucks  Bless the knee  Hey, we're gonna just join any channel isn't it more expensive to determine who deserves the money and not no people keep saying this  It's dumb as fuck. Okay. Let's say we want to give a thousand dollars to every single fucking American
lsL88Xgv1fg,20200318,18524,Okay, let's say that we means test this and and let's say that one third of Americans don't qualify  Okay after we means test it  330 million people times one thousand dollars  What is that?  That's like is that like 330 billion dollars?
lsL88Xgv1fg,20200318,18541,Do you think that's the cost of the administration there?  That we're gonna need to fuck 330 billion dollars to figure out that maybe you know some Americans shouldn't qualify for this  Fuck out of here with that people listen people here bureaucracy and they instantaneously assume
lsL88Xgv1fg,20200318,18552,Oh, administrative course is gonna be tens of trillions of fucking dollars like fucking chill Jesus.  I would like shut up $1,000  Hey, hi, can you get on?  Yes, I can  Not to mention the fact that a lot of this means testing is already
lsL88Xgv1fg,20200318,18578,We've already paid for it because the IRS already has that fucking information you can just make it go off of your 2016  I'm sorry your 2019 taxes  Are we confirmed to be getting some amount of meat bucks I would be shocked if there was no if there was no
lsL88Xgv1fg,20200318,18593,I would be shocked if that didn't happen  Give me my goddamn meat bucks now  Now.  OMG, this yelling is making me cum so hard.  Let's all cum together, cummers.  Invited table.  3, 2, 1, cum.  Biobax for just corporations being idiots and gaming the system to over inflate the value of companies,
lsL88Xgv1fg,20200318,18623,not related to getting checks from the government only related to what are you talking about?  Everything you do inflates the law, you restock.  Oh no! Did you just open a new factory?  Oh, you're in play in the value of your stocks!
lsL88Xgv1fg,20200318,18631,Oh no! Did you just invest in a new project and now you've got some new technology?  Oh, you're over in play in the value of your stocks!  Like, oh no! Like, everything inflates or deflates the value of stocks, but that's what you do.
lsL88Xgv1fg,20200318,18639,A stock buyback is returning cash to shareholders. It's all it fucking is.  You could pay out on dividends.  If you pay out on dividends and then some people want to buy your stocks,  because oh wow, they pay higher dividends, whatever,
lsL88Xgv1fg,20200318,18647,are you over in play in the value of stock?  They're like, fuck out of here, dude.  That's not real value, no assets.  Shut the fuck up! Please stop. Please stop. Please stop.  Don't talk about buybacks.  We don't talk about buybacks here, okay?
lsL88Xgv1fg,20200318,18656,Every single time a progressive or a left-leaning person  brings, it does inflate their stock.  So does, so do, paying out dividends is another way  to return cash to shareholders too, right?  Like, let's say that there are,  let's say that we have 10 stocks, okay?
lsL88Xgv1fg,20200318,18670,Or let's say that we have five shares  and we've got a million dollars, okay?  I could either spend that million dollars  to buy back five outstanding shares  and double the value of all these people's money  or I could pay each of them a million dollar
lsL88Xgv1fg,20200318,18681,in the form of a dividend, okay?  A million dollars in the form of a dividend.  Like, it's just returning money to shareholders, that's all it is.  The thing is that dividends are taxed, and the appreciation of the value of a stock is in text, you sell it.
lsL88Xgv1fg,20200318,18691,That's the only difference, okay?  Stop.  And every time somebody says neoliberal, you can also pretty safely send them no fucking idea what they're talking about either.  Oh God!
lsL88Xgv1fg,20200318,18723,Sorry, I'm sorry for screaming at you in chat, okay?  I don't hate you, I love you.  My bad.  Are capital gains only half-tax in the States as well?  Hell no, in the US, capital gains are texted  Like fucking one third or some shit capital games brackets are insanely fucking low. It's unreal
lsL88Xgv1fg,20200318,18737,Now we're nearly out of this line of skill.  Wealthy stay wealthy boys.  Fuck me dude.  Fuck me dude.  Yeah, moving.  One.  His AFK, just let me kill him.
lsL88Xgv1fg,20200318,18772,Two!  Two, Mooten!  You have amped page don't care kill is it kill baby  Just kill me I want to die  Why were buybacks illegal before Reagan buybacks were illegal for a small point of time  But buybacks were also legal like back in the fucking 1800s or whatever the reason why buybacks were made legal is
lsL88Xgv1fg,20200318,18803,It's not because they were so atrocious for companies or whatever stop stop. I don't want to talk about buybacks again  I don't want to talk about anything finance or economics related with any lefty. Let them moralize  Okay, just make moral arguments. Okay, companies are evil just stick to that
lsL88Xgv1fg,20200318,18817,Don't actually talk about anything coming to do with any market or anything to do with finance or stocks you they're fucking clueless  Okay, not true. You're not true. I'm going stadium. Okay  It's good  Stadium has epic drops
lsL88Xgv1fg,20200318,18850,Or are you some mean to lefties  Is there literally nothing on this fucking roof no nothing on the fucking  Can I jump in through here? No, there's no in. I'm not even trolling you. This doesn't  know that no. It's literally all just around the rim. Okay. Well, this is the dumbest
lsL88Xgv1fg,20200318,18874,fucking drop ever. You stupid piece of shit. It's like I said. I'm moving. I'm just I'm  going down with my pistol.  Moving!  So you don't have guns?  Wait, you can't even go into the stadium?  No!  What?  Okay.  Taber, don't pick the next landing because you fucked this really hard on this, okay?
lsL88Xgv1fg,20200318,18903,You're such a dumb...  You ever feel like you're the...  Nevermind.  No, what were you gonna say?  Taber...  You ever feel like you're the main...  Well do you ever feel like you're the side character in like the main story or
lsL88Xgv1fg,20200318,18916,You know I'm saying why can you not jump over this? I'm triggered. I'm so fucking triggered right now  I'm going to be triggered  You might cut out for a second there. What did you say? Do I feel like a what you ever feel triggered?
lsL88Xgv1fg,20200318,18933,The team is tracking your position.  Uh oh, the lefty sound over there.  Please get the fuck away from me.  They're hunting you, Steve.  The lefties are here, they are. They have a contract on your head.  This is cringe, Tabor.
lsL88Xgv1fg,20200318,18953,They do!  I am...  Dumb fuck?  Shut up!  I gotta listen.  I'm glad Tabor's in the fucking in my ear just saying stupid shit for the old W's in the chat  You literally had a fucking contract on your head dip shit
lsL88Xgv1fg,20200318,18972,You can see it on your heart  And you guys didn't do shit about it be the first time  I'm not like a bunch of dipshit you have to say it eight times. Vosh fucking got your ass Steve  Tabor you ever feel like you're the NPC in another main movie like a
lsL88Xgv1fg,20200318,19000,Too much money to be an infancy  Trick rages the triggering is off the chart moot when you fight  Wait, you didn't leave did you?  No.  Oh, okay.  I just can't see you're gonna.  Miss every shot mother.  Fuck!  Alright, watch me, let me show you how I fucking roll.
lsL88Xgv1fg,20200318,19031,Ready?  That's how I roll, Moot. I just get shit done. Try to do what I do, okay?
lsL88Xgv1fg,20200318,19068,I'm sorry, I win, Gunners.  Wait, you didn't win?  No, I fucking lost.  Don't worry guys.  I'll bring you back in.  Uncle Steve is here to fix your problems.  Uncle Steve, for sure.  What do you mean by that?
lsL88Xgv1fg,20200318,19102,Mm-hmm. Oh, what was your question?  What why don't I always hear these fucking things and I can't see them anyway?  Oh, the roof, oh, the roof.  Where?  Just fuck off.  I love it.  I love it.  I like those noises.
lsL88Xgv1fg,20200318,19132,They actually, they set her me mood.  Use your armor, planning.  Ah.  Ah.  Women are cool, and I do respect them.  That's right.  Chill.  to
lsL88Xgv1fg,20200318,19174,What?  It's right in front of you.  It's on the roof.  Yeah, they're both.  Band tavors, Andrew.  They're both fucking stupid.  Yeah, right there.  How do I get up there?  I can't.  Now jump to the left.  Now jump across.
