video_id,date,start,text
lsL88Xgv1fg,20200318,8002,I think I need to go back.  Where do I get next chat redemption?  Fuck it.  That's a jacuck item, man.  I'll get beer or something.  it  of
lsL88Xgv1fg,20200318,8032,them  alpha movements at the  it  was Contre tent  the
lsL88Xgv1fg,20200318,8065,any way a  that  is  power  as  fifty
lsL88Xgv1fg,20200318,8095,I wasn't interested in this lol  W Murd superstar  Oh my god  across  Was it that?  No.  Good enough.
lsL88Xgv1fg,20200318,8139,I also know.  I don't think you can.  I can't stop Warwicks old chat with my old right.  I think I've tried to do that twice now.  It doesn't work.  the  they  silliness  of young islands in the family  after he is open on the air.
lsL88Xgv1fg,20200318,8167,the  okay let's have one more time for that button and we're going to get it  come up come up come up  I'm with you baby. I'm with you baby
lsL88Xgv1fg,20200318,8212,Redbone  Hey, VCR is go.  I'll get a view.  Don't like that.  You ready?  No. Five seconds.  Four, three.  Oh, shit, we gotta go!  I was like, what the fuck? Why is my screen?  Okay, I'll play one.  I'll play two coders with you.
lsL88Xgv1fg,20200318,8243,We'll see load it up coder coders  All right the first friend who would like to join the group for the threes join the destiny room  Wait, are you serious? We don't have a third?  I mean we can do tabor dan, but I don't know which one it's gonna be pick one
lsL88Xgv1fg,20200318,8274,I'm not gonna pick one. That's why I said the first  Dan's busy I can't remember and it's tabor  Join off me I guess  Where's Taverlin, damim?
lsL88Xgv1fg,20200318,8305,What is 3 o'clock EST, that's a noon PST, right?  Okay.  Why?  This coach Redpaw wants it to be.  Today?  No.  Okay.  Okay, Tabor didn't respond.  Uh, Rayclick and join off me.  Dude, do I- all my kills in a minute, kinda the last game.
lsL88Xgv1fg,20200318,8328,I can't- did you guys win what happened?  No, he didn't win.  He was done.  Okay, if I get DC from this game, I'm gonna be fucking triggered.  Okay, join!  Hold on, I'm loading, or it's connecting the online services.
lsL88Xgv1fg,20200318,8338,Whatever the fuck that means.  Who are these people behind me?  Get out of here.  if  Oh man.  All right, I joined up for you.  We need a third.  Wait, why are you joining me?  I don't know how to play this.
lsL88Xgv1fg,20200318,8366,Okay, well then.  What do I click?  Battle Royale?  Yeah, just Battle Royale.  Am I searching right now?  Our party is host.  Our party host is looking for a match.  Yeah, you're good.  Ooh.  Leave, okay, hold on.  We need one more person.
lsL88Xgv1fg,20200318,8380,Yeah, well, I invited over power.  I didn't even answer.  Oh, he's already in.  I'm always out.  Invite his son.  Where is Peach's show?  That's fine.  We're only playing two games.  Fuck it, just go.  Alright, you're the leader, just start up.
lsL88Xgv1fg,20200318,8413,Why do I change my shit at weapons?  Yeah weapons and then I load out.  Unlocked at level four.  All right, baby.  Why is there a lock after when I can click continue?  Why does it do that?  Oh, it makes you wait to.
lsL88Xgv1fg,20200318,8432,Yeah, why?  What the fuck is that?  I don't know.  I don't know.  I don't know.  Oh my god.  It's the worst I've ever felt in a user interface before.  Uh...  Yeah.  Uh...  I feel a rap coming on.  Uh!
lsL88Xgv1fg,20200318,8461,Uh!  I feel my...  Come coming on, Mr. Mooten.  Fap, come on.  Come on.  My what?  A fap.  Of.  What do you mean?  Oh, we're with deployment.  Now it's a good talk to warm up.  Oh!  Oh!  I have one one
lsL88Xgv1fg,20200318,8502,Fuck is everybody in this  To you get up to I do  Oh wait fuck no you're bad.  Three shut up.  Alright that's enough fucking about.  That's it.  I will is under a move no.
lsL88Xgv1fg,20200318,8534,Too easy man.  Shut up you goddamn loser.  Too fucking easy.  I  Don't want to see this goddamn fucking load. Why are you a girl?  You're triggering me by picking dumb smaller hip-box skins  Also, the gamers get fucking triggered when a girl kills them
lsL88Xgv1fg,20200318,8559,true  Alright let's go. Oh shit I jumped. Okay, where do you want to go? I've hang right there  What what the fuck with  Where the gun how I pick this up?
lsL88Xgv1fg,20200318,8591,Down  Okay, well I down one on this side. Okay. I'm coming  How do you build it you press a era? Oh my god  Stop looting my loot  You fuck you fuck boy  Wait wait, wait there might have been a guy in here come here come on I'm bracing I'm bracing I'm bracing
lsL88Xgv1fg,20200318,8620,Yeah  Wait, I mean arm of plenty's you know our playings  I'm driving you I hear someone above us. Okay. Let me I'm armor-plating. Hold on  Ready  Yeah, we're gonna have to run out and kill him. Okay  ready yeah yeah please get in here get in here get in here just pick me up
lsL88Xgv1fg,20200318,8645,just come under I can't see it you didn't kill him all the way I know I  didn't give you something to pick you up  that's my kill to wait what I don't get to kill wait I hear maybe it maybe it
lsL88Xgv1fg,20200318,8662,Oh, that's you dumbass  Do you have any extra armor paintings? No, I've got to put my car car car what I'm armoring up your day  Do you have any ammo do you have any ammo amount?  How do I drop? I got what kind of ammo tap tap tap tap a our air air?
lsL88Xgv1fg,20200318,8679,Okay, it's I just dropped all my ammo come up here come in here  Someone outside you just found me  I shouldn't have had that.  Okay.  What are you doing?  Who's fighting?  You?  Uh, not yet.  Wait, how do you fight?
lsL88Xgv1fg,20200318,8697,Are we in the same one?  Oh, we're not in the same blue one.  We got unlucky.  You can cheat if your teammates there.  You can call over the people.  It's not cheating.  It's part of the game.  I'm not going to go to the game.
lsL88Xgv1fg,20200318,8710,I'm not going to go to the game.  I'm not going to go to the game.  The people it's not cheating part of prison culture. Okay, if you would have watched real movies like Shawshank  Redemption, you know that you can throw rocks at the people that have one damage time you hit it
lsL88Xgv1fg,20200318,8725,No, there's multiple after but  Put me in don't are you gonna win yours?  Do we each fight you win?  Yeah, we each know  What happens if one of us wins and one of us lose then the other gets in
lsL88Xgv1fg,20200318,8740,One doesn't come back in. You got a fucking win dude. I don't know how to tell you  Do you pick up guns in here?  Shut the fuck up. I'm trying to play the fucking goo log and I died. So no you don't
lsL88Xgv1fg,20200318,8758,Like the rat you are you see your left you saw him. You're right  What am I so good? Oh my I was like boom  You're in yeah, I'm somewhere where do I get a  You gotta go in your buildings
lsL88Xgv1fg,20200318,8780,You do it that early what I don't know I'm scared  Please remind me to change the ENF after this, okay?  Yeah, if you sprint, you can also just bust open a door.  If you just sprint through it.  Also, you can run over a loot and it'll pick up.
lsL88Xgv1fg,20200318,8802,Besides weapons and grenades and shit.  Why do I get these goddamn meme weapons?  Just change it now, change it now, change it now.  What now? You're fucking hockey.  I'm good.  How do I use my perks?  X.  Or X?
lsL88Xgv1fg,20200318,8820,You will you you while we.  Thank you the Dranslarger for the Twitch product for 19 minutes.  Wait, am I having some?  You heard him?  Yeah, I hear him.  What do you want to do about him?  I think that meme weapon was better for this.
lsL88Xgv1fg,20200318,8842,pick thank you  and my program out  yet really quick  much money to bring you back  s  shah I think it's forty five hundred  going there you just look  Bingo guys just cash them off
lsL88Xgv1fg,20200318,8872,Help me come up  Where is that thing going?  Say...  Here I go  Okay, that must not have an average cash  How much is, you didn't run over the money  What's up there?  Would you think your prombe  Okay, do you see the shop things right?
lsL88Xgv1fg,20200318,8891,Yeah, I click that  Go buy me back now  Scalanth  Just run.  Just run.  Top right. It's going to be the top right.  Enemy UAV overhead. Enemy UAV overhead.  Coming in chat.
lsL88Xgv1fg,20200318,8925,You can shoot down UAVs, right?  I don't think so.  Think much of all do you they're pretty quick. Oh over here lots of shit. I don't know if any of it's good, but  There's a lot of it  Some good shit
lsL88Xgv1fg,20200318,8944,Okay, do you want to go do the action  Take me to the action. Do you need armor planes? No, I got one. What do you see? I kill top right?  I'm three  nice  I got one. Let me do.
lsL88Xgv1fg,20200318,8963,I have a bison. I don't know if this is a shitweber or not. I actually was using that. I really fucking liked it.  I don't know if that's faster.  Oh since we're against console players you can also press Z and lay down it's
lsL88Xgv1fg,20200318,8990,barely it's hard over them to shoot you who's heard of the fucking console brain  Wait, what was that noise?  That's not me, right now, isn't it?  Wait!  Wait!  Are we gone?  Two brothers.  Are they gone?  Yeah, I think they're pretty fucking far.
lsL88Xgv1fg,20200318,9016,Yeah, they're gone.  Enemy UAV overhead!  Oh wait, I saw someone parachute.  I'm running towards him.  Okay.  Really far away.  If you press shift again,  I think it'll make you run quicker for a little bit.  Ooh, it's a, it takes a while now for that to recharge.
lsL88Xgv1fg,20200318,9037,Stop sliding.  It's a fuck that.  Let's do what the fuck I want.  Oh look, oh no, I didn't mean to do that.  There's a vehicle no no no trust me you can see him on the map right yeah I
lsL88Xgv1fg,20200318,9058,do yep they are going in yeah I look they're fucking around what the fuck  you see that yeah we're just gonna charge him and they just got out and  back in now they're out yeah we're definitely gonna charge them ready
lsL88Xgv1fg,20200318,9080,they're in here they're in here oh you see him in there and up here and he's up  there he's up there he's up there there's one over there I don't know I just  a rocket one up there what up there means I'm
lsL88Xgv1fg,20200318,9099,pinging it boomer oh getting inside  I found him don't want you to  I didn't see your pings before that was my bad okay.  Hey! plays  in that  coyote  shooter cell
lsL88Xgv1fg,20200318,9134,ang instrumental  lol  Oh, yeah, never mind. I'm gonna be the party.  How do I invite you?  Alright, I invited you.  Who me?  Yeah, here.  Oh, here's the info for our 123rd.  There you go.  Who am I?  I'm moving down a way.
lsL88Xgv1fg,20200318,9162,Add.  Moving down  And  They're a trial member though trial member what does that mean if they that means if they  Die without any kills for three games in a row. They're out fine till now  Wait, what you  Yeah, we're doing this for everybody. We're gonna put them on trial
lsL88Xgv1fg,20200318,9189,We're gonna find her oh, I thought you meant like the game like banjo if you didn't get like  Okay, hurry up peach it you I don't have a fucking day  Hey.  Hey.  Boost your mic by 10,000%.  True.  We're not, this is a start-up.
lsL88Xgv1fg,20200318,9218,We're gonna be farming kills, okay?  Yeah.  I invited you.  You should just put my mic up to 200%.  I don't think that the gain makes me that much louder.  I think it just helps pick up like,  stuff in the way surroundings.
lsL88Xgv1fg,20200318,9233,Why the battle pass with your shitload of CP?  What?  With your, yeah, CP.  Wait, not new Peach.  Have you added me?  Yep.  I don't see you.  This is the first boss that you gotta figure out.  Wait, what's your favorite?
lsL88Xgv1fg,20200318,9255,I added you on the Activision account, right?  Or is it the battle net?  It's battle net.  Okay, I just got your press.  Okay, invite me to the party.  Uh, you are invited.  Did you buy the battle pass Steve with your CP?
lsL88Xgv1fg,20200318,9281,No, sorry. Oh wait, you battle pass.  What, what?  Just buy it. I don't know what I'm even supposed to buy.  What am I looking at?  Oh yeah.  Bye battle pass.  Battle pass bundle?  Yeah, the big one.  Okay, there I got it.
lsL88Xgv1fg,20200318,9295,There's too much shit on the screen, okay?  That in my days we didn't have this much shit  on our screen all the time, okay?  True.  Why do I even have so much CP?  That's why the FBI keeps getting calling you.
lsL88Xgv1fg,20200318,9308,Do you know why?  What do I get 9,500 for?  You probably bought the game prior  I never spent your CP.  Whatever, dude.  Okay, some sponsors are telling me  that they have to pay me 90 days late  because of COVID-19.
lsL88Xgv1fg,20200318,9324,Is this actually real?  Are banks actually getting famous later  or are just fucking people doing dumb shit?  I think it's probably people just doing dumb shit.  I don't believe this shit for a microsecond.  Fuck this.  Which sponsor?  Maybe for like a super small company.
lsL88Xgv1fg,20200318,9339,It's not, it's for some,  I shouldn't say a bit.  Name and shame.  Well, we'll be deployment.  Oh wait the woman you I should have one kill but you committed suicide why didn't
lsL88Xgv1fg,20200318,9385,you guys remind me to switch my ENF.  How many kills you have?  About to have one baby.  Wait what?  Or I'm almost done. I win again.  Okay, options, controller.  Keyboard and mouse.  fire Andy all right we're going to this we're going to the boneyard
lsL88Xgv1fg,20200318,9421,the boneyard Steven I don't know where it is okay I picked a boneyard  bone how do I jump when I jump when I want to peach yes because that's how  pros do it what is happening to my computer I don't know how to do this
lsL88Xgv1fg,20200318,9447,deployment shit I'm going enemies are going to go near to yeah great now we're  fucked  all right I landed a little early page but shit  Not a good look for you, Peach.  To join our school HUD.  Oh my god.
lsL88Xgv1fg,20200318,9469,Are you dead?  Oh my god.  I didn't die.  No, no, no, I didn't die.  I'm crawling towards you.  I cut my parachute.  Did I really have this?  I'm full of love.  Not a good luck, Peach.  Did you kill anyone?
lsL88Xgv1fg,20200318,9486,Did you get him?  No, that was so good in my fault.  I just picked up Peach. Wait, who downed her?  Chirsel.  I put my parachute too early.  Peach.  Keep your shuttle shit out of the game, okay?  Jesus.  Where are you, Moot? I have a secured a chopper.
lsL88Xgv1fg,20200318,9508,Okay, your car, watch out.  It's mine.  Alright, Steve. Get in.  What?  Why?  You secured it. Let's go.  Wait, we're waiting on you.  Am I going in the drop a 2? Yes, you are. Hurry up before we get shot.
lsL88Xgv1fg,20200318,9526,Each climb the ladder.  Climb the ladder.  Each look at the ladder quick. Get the ladder.  Jump, get on. Get on.  Go. I made it a drop.  I've never been on a helicopter in this game before.  This is cool.
lsL88Xgv1fg,20200318,9548,Moot! Where are we going?  Oh, I'm over here.  TP-stake.  Your mic settings are... Wait, what's wrong?  Just ban them.  Is there a friendly?  Uh, you might be able to open up that look, I don't know.  Alright, we're landing here.
lsL88Xgv1fg,20200318,9572,Okay, we're gonna go through.  Okay, don't loot on top of me, didn't we learn this?  This was the worst landing spot ever.  There's another helicopter here.  Where?  Above us.  On our building?  They just jumped.  One just jumped.  One's coming on the top of the building.
lsL88Xgv1fg,20200318,9589,I'm coming.  I know there's on this building.  Where are you, Moot?  He's not even up here.  No, I wasn't.  I couldn't be.  No, I mean the enemy's not.  He was.  I'm going in!  I'm running in moot!  One down?
lsL88Xgv1fg,20200318,9617,Okay.  Don't ever loot my kills.  We go to the roof. Oh, no, I gotta put on armor people are shot in the hole on  Does it go out here? You're dead down them  Dead don't steal my kill steal his kills
lsL88Xgv1fg,20200318,9647,Who shot?  Above about directly. Oh, oh, yeah, okay  We got to go up after him guys  Pushing for nothing's happening. Move. Are you coming?  four four secure foot secure  zits what I'm getting from the bottom  right why oh so I'm up here with Pete
lsL88Xgv1fg,20200318,9676,you go first good like okay he jumped  off that's why  raga's armor where he went over there  he's after him  I hate him.  No, you got in the truck guys.  I shot a gun.  He's fine, he's gone.  Are you guys fucking kidding me?
lsL88Xgv1fg,20200318,9706,You just fucking kidding me?  Moot, why do you have so much goddamn money?  Share some of the fucking world.  Luke goblin if you call down a loadout is it for all of us or just for one person?  better be
lsL88Xgv1fg,20200318,9721,Do your armor I don't have any armor  Yeah, I need it is peach come by some over here. Yeah, I will go by  some armor  Love the glowing sounds it sounds like fortnight god. I love that game  Wait, where is it?
lsL88Xgv1fg,20200318,9739,I don't have enough.  Wait, where the fuck is this?  Oh wait, can you open me?  Oh, go on the phone.  Where are you?  I'm pinned!  Look at the mat!  I know you are.  Okay, um...  I'm dropping some armor and plating.
lsL88Xgv1fg,20200318,9761,Wait, so does the loadout for all of us?  But I just I just got some guns  You don't have to stay on the floor you can swap as you please wait. Thanks for coil for the twitch prime  I'm not picking up the armor plates. You might be full
lsL88Xgv1fg,20200318,9773,I thought you picked them a lot of mad at them. I said everything is automatically  I don't know what any of this is  Yeah, I bought an air strike  Okay, where we headed?  Wait, so do I want to pick up the loadout or?
lsL88Xgv1fg,20200318,9794,Yeah, yes for the-  Yeah, they all suck, I don't want any of them, I'm not kidding.  Oh wait, it's for the perks!  You want the perks?  Yeah.  And then you can pick up your gun off the ground, it doesn't matter.
lsL88Xgv1fg,20200318,9806,Double time heart, do these last forever or what?  Dude, no, are you fucking serious?  Drop it, you motherfucker, holy shit!  Unfucking believable.  the guy that actually does work around here okay have the fucking weapons fucking  I'm so fucking mad right now wait there's nobody news fucking idiot
lsL88Xgv1fg,20200318,9828,just this way no fucking true  can we kill some goddamn enemies instead of jerking off all day in here we haven't  found any  I see enemies  Put another arm
lsL88Xgv1fg,20200318,9862,Shit, alright, you guys ready?  Wait.  You saw him, right?  Did you see him?  He's literally right there.  Team wiped him.  They were getting shot from that way.  They were getting shot from the other side, other side.  Did you see him?
lsL88Xgv1fg,20200318,9875,Down.  Down.  Down.  Down.  Down.  Down.  Down.  Down.  Down.  Down.  Down.  Down.  Down.  Down.  Down.  Down.  Down.  Down.  Oh  I need to pick up  Yes, I'm trying
lsL88Xgv1fg,20200318,9908,Peach peach peach yes, oh god they're coming okay. Yeah, they're coming okay. I'm good  How do I put down my claim work?  You.  That.  There.  Are claim wars friendly fire?  Hello?  There are claymore's friendly fire
lsL88Xgv1fg,20200318,9944,Hello wait can somebody drop some armor moot I know you're hoarding  Okay, I think someone just parachuted in above us  Do you want to go up to the top floor safe and okay to load out drops  I'm dropped in that direction in that direction. So there's probably people there
lsL88Xgv1fg,20200318,9969,Get upstairs  Going up I'm on the roof  Okay guys.  What are you shooting at?  Oh, other roof, other roof, other roof, other roof, give me again.  Get one.
lsL88Xgv1fg,20200318,10001,Down one.  Pick her up, I'm taking a peach.  Okay, I'd get over here.  Down to another?  Oh wait, I just hit him like three times.  Can we hit that?  Hit?  Down?  I'm fucking going over there, mutant!  Wow!  Dead?
lsL88Xgv1fg,20200318,10029,Wait.  I got shot from behind.  I'm running over there.  Did we wipe out?  Not sure.  I got two kills, so I got one down in here and then another guy in here.
lsL88Xgv1fg,20200318,10064,One  You have an air strike you could have called an uncle  Wait, I think you're both of my gulag  Oh yeah we are. Oh dude you're fighting you're fighting you're fighting I'm gonna  tell you where he is okay you're right you're right you're right you're right
lsL88Xgv1fg,20200318,10096,what is his shit I was fucking done he's on your right side still he's  pushing he's pushing right side he's done  did you win yeah don't ask me if I won the one you want to reach out he
lsL88Xgv1fg,20200318,10112,I never lose it.  Um, I don't see...  I think he already realized that.  Oh god, none of you are watching this.  Wait, where are you flying, Steve?  Oh, I'm not gonna make go to this loadout, Steven.
lsL88Xgv1fg,20200318,10143,Booze.  Stop right there.  I'm just gonna make it out.  Okay, got it.  You won, you're one of you won?  Yeah.  Why are you surprised?  You're running around like a bumbling what like a bumbling what?  buffoon  a buffoon  That's a buffer. That's the racial insult you want to go with there
lsL88Xgv1fg,20200318,10169,The food is not racial are you in case you're gonna do a stream on d-live or  Peach are you  a dude I get fire Amy down and kill him kill him at least  I have to go I'm so sorry my I'm fucking are you gonna let me die I've no
lsL88Xgv1fg,20200318,10200,god damn it hold on where are you?  I'm crawling. I'm slugging. Okay, I can't go up this.  Are we in the smoke? No.  I guess. Okay. Peach, get in here.  Okay. I need a better gun.  Yep.  Did you open it? No. I might have opened it, sorry.
lsL88Xgv1fg,20200318,10228,Hahaha!  Oh, what are these sh**s?  We're getting more money!  We can revive him if we get on a...  How much do you have?  Oh no, do you have armor?  No, not at all.  Sh**!  Okay, so I'm going to just shot through that.
lsL88Xgv1fg,20200318,10251,Okay, careful.  Don't peek  Hey  They got back a bag of it at the back of it a couple I hid in my little baby  Zorem  Oh  Are you down?  Yes.  Okay, crawl, crawl, crawl, wait.  Let me just hit you.
lsL88Xgv1fg,20200318,10279,Fuck!  How many kills, Peach?  Um, I don't know if I got a kill.  Uh-oh.  What does it say?  That's trial one.  Good.  Trial one.  Failing.  I got a good little kill.  What?  Mmm.  Not bad.  Not bad.  She won the guillotine. That's a kill. When I checked her as
lsL88Xgv1fg,20200318,10302,specating, it said zero kills.  Uh oh.  Hey.  What?  Steve had five. I had four.  You had two.  Okay. Let's be real. I knew I saw you had two. You had two.  No.  You're wrong.  No, check my button. Check the button.
lsL88Xgv1fg,20200318,10321,aramme8
lsL88Xgv1fg,20200318,10351,I'm disappointed.  One.  Two.  Two.  How many do you have seen?  I don't know why I headed you to this shit ass fucking reference
lsL88Xgv1fg,20200318,10381,Get me into the action  Get me in here!  Three  Four  Alright, that's enough fucking about  Four, four  Oh my god dude  40 or zero.  We're now dropping.
lsL88Xgv1fg,20200318,10413,It's a shit.  Run to the boneyard.  Drop ASAP.  Did you ping it?  Which ping is yours?  Blue are the blue.  The blue blue one  Favorite color  Go directly to here do not pass go there going in okay
lsL88Xgv1fg,20200318,10444,My god I dropped so  Oh, we're already on a con.  Who is having cars in the background?  Peach?  What?  Sorry, that is my background.  Oh, you know, I didn't even realize.
lsL88Xgv1fg,20200318,10475,On top of me. Why would you run and inject my armor? Holy shit?  You're leaning on top of me you literally written into the place I was at you  Check your desk card  What are you gonna do? What are you gonna call me?
lsL88Xgv1fg,20200318,10490,Don't roge me, I'm going to check my discord.  Okay, you ready to move?  I'm not going to seal any of this.  You ready?  We're going to go over here.  Cross, we're crossing.  Cross!  Keep your eye open, sir.  The sun bloom isn't my fucking eye though.
lsL88Xgv1fg,20200318,10521,We're in the fuckiest peach at.  I'm behind you guys.  Yeah, we're going here.  We're going and bridge, bridge, bridge, bridge, bridge.  Wait, what is our contract right now?  I hear good loot in here.  Right, right.  Sure you do.
lsL88Xgv1fg,20200318,10541,What are these flashes of light?  I don't know.  Wait, that means someone's aiming at you.  Really?  If you're seeing weird glints in the distance.  Not always, but most of the time, yes.  We need not always.  It was just like a flash away.
lsL88Xgv1fg,20200318,10558,On a game, shit, so.  Wait, the game is shit?  That you, so this game is awesome.  Yeah, sometimes random shank, or flickers.  Game is perfect, and everyone, but.  Very issues.  Okay, does anyone need armor playings or  Why don't you get the recon drone move it's garbage. It doesn't do anything. It looks at things dumbass. I'm not a looker
lsL88Xgv1fg,20200318,10596,Oh, there's a biostation here  For real.  Found a vendor, give me supplies.  Oh fuck, is everybody out of this goddamn game?  Okay, I'm buying my shit.  Why?  Oh, I hear a car.  Really?  I heard one.  I can't be.
lsL88Xgv1fg,20200318,10613,Buying you with me?  Buying a loadout, yes.  Do you have enough room?  I'm rich.  I load out a sock.  Nice.  Oh, damn it.  Guys.  What?  He didn't do the contracting time.  He fucked it all up.  It's OK.  It's not OK.
lsL88Xgv1fg,20200318,10643,I'm in another ammo plate.  Why do you all remember that?  I have five.  Same.  I'm loaded.  Okay, we kind of need to go into the circle.  Yeah, let me get a load out.  Okay, boomer.  Okay, where we at?
lsL88Xgv1fg,20200318,10668,Okay, we're going in.  This is fucking mean shit.  Wait, is it good?  since it's like bread or is it that mean it shit means it's like better oh fucking  no you don't know anything do you let's go squad rollout
lsL88Xgv1fg,20200318,10694,Go.  Okay.  You got thermals on that.  That's going to shit.  Thermals?  Wait.  You aim down the slice?  Not in that game.  People wait.  It's way fucking good.  Yeah, maybe for you, Dan.  Let's go, guys.  They're in that building, I think.
