video_id,date,start,text
lsL88Xgv1fg,20200318,2850,No, no, I don't see that at all.  Oh, he has fewer delegates.  Okay.  Well, let's take a look at your math  and see where you went wrong.  Okay.  Yeah, I just compared the two numbers  and saw which one was bigger.
lsL88Xgv1fg,20200318,2863,Yeah, see, you skipped a bunch of steps here.  First, you have to subtract the super-dellians.  Wait, wait, wait, wait, why did you do that?  I'm not bad with me.  Then you add 10 momentum points  for every stake you want in a row.
lsL88Xgv1fg,20200318,2875,Multiply that by how much birds like him.  Now, you do have to subtract a point  for every media outlet that is blacking him out.  But even after you do that,  you can see that he's winning in a landslide.
lsL88Xgv1fg,20200318,2887,No, it feels like you're just jumping through  a bunch of hoops to mask a hard mathematical truth  that you don't like.  Could it be that you're a fucking Hillary supporter  who thinks she's entitled to presidency?  No, I'm not saying anything about the candidates themselves.
lsL88Xgv1fg,20200318,2899,I'm saying if you look at the numbers,  Hillary Clinton's delegate count is bigger.  Okay, let's look at it like this.  Okay.  California has 475 delegates, right?  Okay, yeah, I'm following you.  Okay.  Everyone I know personally is voting for Bernie Sanders.
lsL88Xgv1fg,20200318,2916,Therefore, we can assume that all 475 delegates  in California are gonna go to him.  Oh.  And there you go.  There I go, what?  No, even if he wins all 475 of those delegates,  he's still losing him.  Now you're making the same mistake.
lsL88Xgv1fg,20200318,2929,You're not subtracting the super delegates.  Yeah, so can you explain why you do that again?  I don't like them.  Okay.  They're not democratic.  Okay, oh, no, I think I get this, okay.  So that means we also don't count caucus results
lsL88Xgv1fg,20200318,2942,because those aren't very democratic when you think about it.  No, no, no, no, no, no, we love caucuses.  If anything, caucuses count double.  I'm now confused again.  It sounds to me like you think it's impossible  from the win and you're a neoliberal shell.
lsL88Xgv1fg,20200318,2954,I'm not saying anything about him as a candidate.  I'm just saying he's not currently winning  and it's really weird that you have  a completely different narrative.  I think you aren't factoring in  how much I want him to win.
lsL88Xgv1fg,20200318,2964,If you do that and you remember  that Obama came from behind,  then you can see that actually,  all those super delegates moved to Bernie.  Why does that do anything?  Because you said we're not supposed  to count the super delegates.
lsL88Xgv1fg,20200318,2974,Oh yeah, no, you count super delegates  if they're for Bernie.  This doesn't make any sense.  I got a same surprise.  I didn't realize you hate Bernie this much.  I don't hate Bernie.  Look, I'm just saying if you look at the numbers
lsL88Xgv1fg,20200318,2987,and if they don't change,  I feel like you're setting yourself up  for a huge disappointment.  I'll bet your $10,000 Bernie wins.  You don't have that kind of money.  Oh, first you assume I have all the money I want.
lsL88Xgv1fg,20200318,3003,Good ones.  We are main pioneers.  Wait, how are we?  Wait, is female landlords?  Is that the one girl from chat?  a  connected
lsL88Xgv1fg,20200318,3035,he  Oh, there's our destiny.  Nice save.  Oh my god, guys.  We fucking did it.  Wait was this really first posted on my subreddit?  I found that hard to believe.  Is it?  Was it?  Oh yeah, I was thinking of the ironically edu person.
lsL88Xgv1fg,20200318,3065,There's no way this was posted on my sub first.  However, we are the ones that did bring back the, um, the gnoming people and we never got credit for that. So we'll take credit for it.  True.  Fucking, you're, ha ha ha ha, Mr. Mental. How are we doing today?
lsL88Xgv1fg,20200318,3085,I'm good today.  Yesterday I was really tired. I had like four hours of sleep the day before or like that night day of and then, you know, today.  But today I'm good.  The mental is unbreakable.  Unbreakable.  I won't flame a jungler a single time or I'll gift you 100
lsL88Xgv1fg,20200318,3101,six months up glad you're home 100 subs 100 oh  shit  But if I slam it  Are you gonna are you planning on slamming it today?  Of course every day I slam it waiting for the hand to break so I think he's not to play
lsL88Xgv1fg,20200318,3121,Okay.  Rokazama.  God, it's playing.  Oh yeah, don't you owe your chat something  about damages and Karthus and second dick,  your own dick on a stream.  Were you gonna be doing a twitch or chatter bait?  Oh, stinky.  Damn, that's brave.
lsL88Xgv1fg,20200318,3147,I'm dead because never mind. I'm so good  You get him  Shouldn't I  Wait, so there's basically no point in looting in this game, right?  Or like you don't spend a lot of loading. Yeah, it's um a lot more. Yes
lsL88Xgv1fg,20200318,3175,I mean you can do the thing we didn't pub you wait and stuff, but um there's no looting  Random ass things yeah, sure looking for like 27 different types of attachments or whatever  Yeah, you're looking for like your fucking 4x scope, which I think is good
lsL88Xgv1fg,20200318,3190,I also like how if you open a crate or whatever the all the loot just fucking drops on the floor. I think that happened in the other one  drop that. Cars in this game are fucking super good. Yeah, and then if you called on your
lsL88Xgv1fg,20200318,3210,dropout after getting cash, you're basically like fully kitted right? Yeah.  You have better shit than default stuff right now.  Fuck does this guy fucking get in here every goddamn time we're gonna start using a new room  Wait, what did you ask Danica and hear you? I'm sorry. I'm sorry. I only hear these talks against like Jewish people honestly coming in here
lsL88Xgv1fg,20200318,3236,That we tell it to Taborin like into I was playing the jay card  He always plays the jay card  Hold on I gotta turn down up  Okay, Dan talk, I need to make sure you're up.  Hello, sir.  It's fine.
lsL88Xgv1fg,20200318,3252,Oh my God.  When we play late, we are swapping rooms and no one is going to be in here.  Just a fucking first off.  You're so like aggressive, Mr. Muhan.  When I see you in person, you're so nice, but then I'm in here with you and Steve.
lsL88Xgv1fg,20200318,3276,You know why you know what he's not doing in person  playing League of Legends dummas  I'm waiting for the longitudinal study on League of Legends and like domestic abuse towards your house really you think that's like a good thing that people should
lsL88Xgv1fg,20200318,3294,I think that's a correlation. I think they should get rid of League of Legends. Do you think they should be?  infected with something maybe  What?  No, you can't even make that you're gonna get bad. Are you is that what well that sounded like where you were going?
lsL88Xgv1fg,20200318,3307,No, that's where you were going  Are you sure about that?  You want to clarify for the audience?  I'm calling you you want to clarify that for the audience so that people are yeah, I don't even know how you've connected those
lsL88Xgv1fg,20200318,3323,So what do you guys think of that band what is we already everybody thinks it's bullshit like gonna be  No one.  It's not bullshit, then you got a real hot dick.  Go ahead.  No, no, I think it's bullshit.
lsL88Xgv1fg,20200318,3333,It's bullshit.  This would be like the perfect, this is such bullshit, this is the perfect one for the  Twitch streamers to rally around and say, hey Twitch like, well they of course they  were because Casey Tron makes fun of, they always view her as like a parody of thought
lsL88Xgv1fg,20200318,3347,streaming so people are okay, good fan of Casey Tron because I can still use her as  if I hate one.  Play with touch, not mood.  True.  Wait, what?  since Casey Tron is a parody it's okay to laugh when she does things like
lsL88Xgv1fg,20200318,3360,booping out and everything like you can still hate other women while still liking  Casey Tron that's okay oh no that's that's not what I was getting I'm talking  about like twitch streamers aligning against twitch for like their their oh
lsL88Xgv1fg,20200318,3371,twitch streamers have always been against twitch's stupid fucking moderation policy  everybody knows yeah but they don't they don't actually like get what are we  gonna fucking do yeah what are you gonna do man I don't know you get like a few
lsL88Xgv1fg,20200318,3381,of those 8k and he's just stop streaming for two days maybe they're not gonna  I ever do that.  That's never gonna happen, unfortunately.  It would be cool, but yeah, it's never gonna happen.  That sucks.  I tried to see if any of them were on,
lsL88Xgv1fg,20200318,3394,was that site called Cameo?  See if I could get them to say something against Twitch.  And then, yeah, but no, none of them,  none of the big ones are on.  Steve, what am I doing for stocks?  Give me a pick, I'll do it.
lsL88Xgv1fg,20200318,3408,Socks?  Yep, stock.  Oh, stocks.  down nor in the next month.  By Norwegian cruises, it's going down down down.  Is that your cake Stephen?  In a month.  I here is my honest to God hot take ready.  I have a super hard time believing that the United States is going to not do
lsL88Xgv1fg,20200318,3430,some radical action to redirect the economy within the next month.  There's no way that we can just endure this for weeks and weeks and weeks.  Like, how many times do we trip the breaker now?  Is it three, four times?
lsL88Xgv1fg,20200318,3442,What do we, how many have we done it so far in the past couple of weeks?  Okay.  Fair.  Like, how long does it take to pass any legislation like that?  I mean, in the form of stimulus, I don't know how long did it take Bush to get his little
lsL88Xgv1fg,20200318,3453,stimulus bullshit through.  Well, here for the airlines to get filled out after 9-11.  Do you think we're going to let that happen again?  It seems like our monetary policy and stuff related to that has gotten more and more aggressive.
lsL88Xgv1fg,20200318,3463,No.  I don't know.  Yeah, like people are saying in chat talk got passed in a week like it feels like we've been more aggressive on that  But it could be wrong  It just if like you understand right that this is like
lsL88Xgv1fg,20200318,3477,Catastrophic like even other European countries are enduring like catastrophic damage right now  The idea that this will just go on for like maybe a month or two. It seems that seems unfathomable to me  Like people are getting laid off like en masse like banks are gonna start hurting is like payments and stuff
lsL88Xgv1fg,20200318,3494,for not being made like, my guess, wait.  I'm tempted to, I'm tempted to stake you, Dan.  We can go in 50-50.  Because Dan, you know that like,  if the stock market is going up, those are puts, right?  If it's going on a call, it's calls.
lsL88Xgv1fg,20200318,3519,I feel like as soon as the US government announces  something related to like stimulus,  that shit is gonna go fucking massively up.  Do you think that it's gonna be like a fucking five  to 10% rebound in like a fucking day?
lsL88Xgv1fg,20200318,3531,Well, it's only if you believe that,  if the market believes that Trump can do it,  like we just had Trump's conference  and now a fucking American is $10 right now.  It's fucking crazy.  Yeah, but they don't actually have like
lsL88Xgv1fg,20200318,3543,a single stand together, right?  Like people don't think that it's.  So do you remember watching that Srele stream  for a long time ago where he was analyzing eBay.  You know what I'm talking about?  Sure.  Like he was an master of power.
lsL88Xgv1fg,20200318,3558,Throwing money.  We need to find out what the asset  really is of some companies.  Stops are value based.  And then hold on one second.  I got a 20.  He is in the dumpster right now.  OK, sorry.  What were you saying?
lsL88Xgv1fg,20200318,3569,We need to find out the asset value of a company.  And when it gets close to that, we  need to go fucking hard long on it.  So what is the value of American Airlines assets right now?  I don't think it is.
lsL88Xgv1fg,20200318,3580,Right now, asset value probably has  little to do with how you value a company like that. It probably is more tied in with like revenue,  right? No, no, sure. But I mean, there's kind of a floor for this, right? Like American Airlines
lsL88Xgv1fg,20200318,3592,is certainly not going to go negative. Like I look at what happened to Yahoo when that was getting  acquired, right? And the assets that they had in... Yeah, but this is all conjecture. I don't know.  Okay. But like the problem is, is like, let's say that we let's say that we value the underlying,
lsL88Xgv1fg,20200318,3608,first of all, the underlying assets of the company are probably going to be like a fraction of like,  like what the company's actually worth now.  And secondly, even if we try to make a valuation  like of the company based on just the assets,
lsL88Xgv1fg,20200318,3617,if it gets to the point to where the prices are that low,  don't you think those assets would start falling  in value as well?  No, no, I'm sure.  So that's totally makes sense.  So yeah, I don't know.  I've been following American a little bit,
lsL88Xgv1fg,20200318,3628,but like, you know, I'm looking at the spy now.  So I don't know.  What are you, so you think shit's gonna get  go massively up in the next month?  At the end of the month,  you think it's gonna be higher or lower than the price.
lsL88Xgv1fg,20200318,3638,Anyone else flocking board?  I mean, I feel like the end of the month has to be higher, but I don't know I'm not confident about my market analysis  I'm not gonna take it alone and like invest or some shit
lsL88Xgv1fg,20200318,3646,Like I don't actually know that that would just but my it feels to me like by the end of the month shit has to be different  That like no one can do this for this long. It's too much
lsL88Xgv1fg,20200318,3655,Especially when you've already seen like other countries that are like kind of like fixing their shit  Yeah  Do you think this is the time to fucking giggle hey  I'm gonna keep gambling it and be broke by tomorrow and have to sell my hands.
lsL88Xgv1fg,20200318,3673,Nice.  Yeah.  I actually came here to confront you, Steven.  What's up?  You're kind of mean to me yesterday on stream.  Well, you came in a metal during league, so get fucked.  I just said hi.  Yeah, during league, didn't you?
lsL88Xgv1fg,20200318,3693,It's like touching a bear and fucking with it and then it's being yeah  But I'm not I'm not confronting you on be on my behalf because I'm used to your abuse  It was the fact that you guys left paper in here by himself and you kind of just ditch taper and that was kind of messed up
lsL88Xgv1fg,20200318,3706,Yep, that was your friend  How do you feel about that the u-class team?  Doesn't matter me and my actions do not control you and your actions. You're a grown fucking man  They definitely treated your friend like shit. Nope. You basically came in and you moved us all out of there
lsL88Xgv1fg,20200318,3719,We're supposed to be your friend as well. I can't actually believe that you did that you came in and know where  I  Get in here with us and I said you came in and you got him kicked a fuck out what W am I right?
lsL88Xgv1fg,20200318,3731,Oh my god, I feel bad for women. Well, he's in here now. So yeah, I don't know. He's pretty mad at you  He's not mad all right five grand Steve. What are we doing? I got six Dan  You have six thousand you want to put into this we're ready
lsL88Xgv1fg,20200318,3747,I'm ready.  We in Robinhood ready to go?  I don't have to cash it in Robinhood.  I can put it in now, I guess.  What are you investing in?  We're figuring that out right fucking now, Lycan.  Bring an apple as he seems to know, right?
lsL88Xgv1fg,20200318,3761,I trust anything.  Apple has to say more than fucking me, dude.  Apple is getting in here.  Tell us what to do.  All right, Steve.  I'm ready.  I'm almost done with this card game.  Yeah, no problem, I did.  And we're ready.
lsL88Xgv1fg,20200318,3773,Are we looking for FDS or are we looking for like?  F.D.'s nuts.  I was just gonna say that, but you're so funny,  an awesome Mr. Mooten that you did it first.  No problem.  It's funnier, cause you said it anyway.
lsL88Xgv1fg,20200318,3791,Not true, women can be funny.  Hey Dan, why don't you open one of those green screens again?  What the fuck?  Apple is, what are we doing?  All three of us are going in.  Tell us now, what's the play?
lsL88Xgv1fg,20200318,3804,Apple is, wait, Apple is.  Do you think that the US can just take this for like a month?  It feels like something has to give, right?  Either some crazy stimulus package  from the federal government or something?  Yeah, I mean, everything's fucked.
lsL88Xgv1fg,20200318,3817,But my industry is completely fucked right now.  Everything is shut down and there's  like everything's going out of business.  Yeah, and it's going to be another,  it's not like going to be, oh, you can't end it.  Like my kid's school is out for a fucking month.
lsL88Xgv1fg,20200318,3830,Yeah, like the governor of California  said that all public schools are going to be out  until at least July, so.  Wait, what?  Yeah.  All public schools, you mean like universities  are like great school and shit?  No, I think like high school, middle school,
lsL88Xgv1fg,20200318,3850,and like all public, you know.  Thanks, Dr. Guma.  That's insane.  So if we know that that's the case,  doesn't that mean shit is like, oh,  Meg is gonna hit the fan?  No one's gonna be buying anything.  People are gonna be staying in in the fucking panic.
lsL88Xgv1fg,20200318,3864,Yeah.  We do what we do in puts then Apple is I mean if you like that was we're asking you  Tell us what are we doing the problem is I'm like I'm day trading right?  So you just I just look at Dow futures from day to day and that gives me enough indication of which way the market's gonna try
lsL88Xgv1fg,20200318,3882,I mean for for the next day, so this is your insight. You can't help us. We just have to fucking guess  Yeah, I mean that's essentially what stop trading is right fuck me  The region cruises man $60 steady for years it's down to 10 right now
lsL88Xgv1fg,20200318,3899,It's probably gonna drop a little more before their quarter  It's gonna go bankrupt because who's gonna bail out a cruise line  I mean, that's any ready hold on mr. Millen wait a goddamn second. Okay, we're trying to make money
lsL88Xgv1fg,20200318,3910,This is what you need to do you're gonna make money you just lie already made wrong wrong wrong  I made money. No, I didn't I want to see my fucking shit  I hate money. Yeah, go ahead fucking fake news fucking
lsL88Xgv1fg,20200318,3922,Let's not be so hostile take a breath  I made money mr. Mooten because I had fucking golden hands and I held through when American was pumping and then I sold fucking today  Okay, now we're talking about the next is is Mooten getting in on this because aren't you exclusively trading on margin because you
lsL88Xgv1fg,20200318,3941,I have like $6,000. Oh, excuse me who the fuck would trade not on margin when you take it's free money  I would get free.  All right, Destiny.  I'm sorry.  Let me introduce you, Appolas, to the concept that has rich people use, called OPM, okay?
lsL88Xgv1fg,20200318,3957,Other people's money.  That's how you get rich, okay?  Keep going, Mr. Mooten.  Get as much margin as possible.  That's the only way to trade, baby.  All right.  One month puts on the S&P 500.  What do you think, Steve?
lsL88Xgv1fg,20200318,3969,It depends on the premium.  What is premium?  Is that how much you pay for the option fee or whatever?  What is that?  Current price it's 20 bucks. It's 20 bucks right now. Apple is that too frisky?  Thanks helpful as always
lsL88Xgv1fg,20200318,3989,Can say nothing we're trying to make the Dan trying to make money here one side. Okay, I'll log in okay  Apple is so so the issue is like this fucking ball up. What if what if they push through like an
lsL88Xgv1fg,20200318,4002,850 billion dollar stimulus plan in a week or two and  and the market spikes accordingly, like I don't know.  Okay, we think it's, I think it's going down.  Steve, are you a downer or an upper?  Tell me.  I said it was an upper.
lsL88Xgv1fg,20200318,4019,I feel like it has to go up.  What if, what if, but what if they try to pump it  and nothing happens?  Like the market hasn't responded much to the feds,  like interest shit, right recently and the repo should.
lsL88Xgv1fg,20200318,4030,It's swung for one day.  Yeah.  So like if they try to pump it and it doesn't go up,  Like if we like what I'm curious about is like if it seems like the Fed is ineffective at getting anything done here
lsL88Xgv1fg,20200318,4041,That's really fucking scary  Well, then the next step would have to be some form of government stimulus and that should get something done, right?  Then with the money printer is literally gonna go burr  Literally gonna go burr and we're gonna study you think that's gonna happen. Are we going up or down Steve?
lsL88Xgv1fg,20200318,4057,It's gotta go up. That's  Long it's going  Long long long we're going one month, baby  So so what what period of time we can go longer than a month if you want to but let me see what the prices is
lsL88Xgv1fg,20200318,4071,Do it day by day  Just fucking no word every fucking that's too much work. Okay. We think it's going up. We're gonna buy a call  Okay, money goes bird  We're gonna look at April 17. That's about a month April 17th calls
lsL88Xgv1fg,20200318,4087,On this going down Dan  Are you yelling timber?  Okay, and these are also down because the shit's going up. So do you want to buy it at the current price Steve?  Good luck, Dan. I think so. Wait wait for a call do those automatically like
lsL88Xgv1fg,20200318,4104,Execute or whatever at a certain price like how does that work again?  Like if we got something to certain price you just like make a ton of money or do you have to like  Do the option or whatever executed or whatever?
lsL88Xgv1fg,20200318,4114,How does it work?  Daytrider wait, then you're the one buying it. You should know this right fuck that shit yolo, bro  I don't need to know how this shit works press the fucking buttons make money  Apros the button money goes burr
lsL88Xgv1fg,20200318,4126,Okay  all right a call on  S&P 500 okay, so we have the right to  Buy it at this price in the future so we want to do it at the current price which is about  $231 all right, so that cost us 20
lsL88Xgv1fg,20200318,4148,Do we want to do that for a month out that means for a month we got the right?  To buy it at 2 31 oh  So okay, so you can you can execute that whenever you want to write it
lsL88Xgv1fg,20200318,4162,Yes, you can you can sell the contract  It depends on if you're buying a European or an American style option wait real quick was league patched already  is Draven's W faster?  I don't think so. I didn't download anything, but I don't know.
lsL88Xgv1fg,20200318,4176,Apple, I just want to read your European option. You can only, you know, only actually redeem it at the time of expiration of an American option. You could redeem it at any point prior to or at expiration.  We're never buying European options.
lsL88Xgv1fg,20200318,4190,But it, it, like they call it a European option, but it does, it's not necessarily restricted to European securities. You understand that.  Yeah, that makes sense  Chat he's making me do this  So Apple is any suggestions here  Yolo Dan
lsL88Xgv1fg,20200318,4214,Boy, I'm glad I fucking brought you in here to say nothing. I hate people like you people who say they're an expert  You ask them. Hey, what should I do to say? Oh fuck the bye? No, Markie goes up. Markie goes down useless
lsL88Xgv1fg,20200318,4225,I'm not a fucking expert. What the fuck should I know?  Just  Okay  Well now I think  It's gonna hit the fucking fan this month as no one fucking goes out  I think it's gonna keep going down down  I think that then go fucking buy some like spy puts or something. What does spy?
lsL88Xgv1fg,20200318,4251,500 oh  the  when people talking about buying like money the rope one that's a mean right  row, you mean you mean the rope in the still  the long and the rope and go long and still  no it's short rope
lsL88Xgv1fg,20200318,4275,Whatever  I don't go on Wall Street, that's right. I literally I never do  Yeah, what up guys? What's up Andy?  How you doing?  See after this leak in oh  Yeah, shit right too cool for me. Give me an enthusiastic. What's up, man? What's up?
lsL88Xgv1fg,20200318,4297,It's fucking early dude. It's 10 30. Okay. I only got so much energy this time of the day  It's 1230 for me. I'm in Texas. Oh, how you doing over there? What do you got to?  I  Just got an Airbnb with some of my friends kind of far away from Austin
lsL88Xgv1fg,20200318,4312,Just to get out of the hood and be a little bit more in the suburbs  But yeah, it's pretty chill  Not so you stay inside or you beat you're not you're not down with the hype  Um, yeah, I'm staying inside now. I just got back from Sweden and Canada and Boston, but I'm staying inside now. Yeah.
lsL88Xgv1fg,20200318,4335,Yeah, people are kind of mad at me because I was, uh, I just started staying inside like yesterday, but I was out on 6th Street with like a thousand people fucking.  Yeah, I mean I was shooting a music video and I just like there's a lot of fucking sweaty strangers around
lsL88Xgv1fg,20200318,4358,But that was before they kind of like closed all the places and told everybody they shouldn't leave  That's why Austin got 17 cases  Austin doesn't have 17 cases like hour away from Austin does  You did it you did it I?
